{
 "UID": "582690698",
 "name": "Andrew Anh Tuan Nguyen",
 "education": " UTS: University of Technology Sydney BA Marketing Major School year 1999 THCS Trưng Vương High School School year 1992",
 "work": " TA Engineer CEO & Founder 2 January 2001 - Present Ho Chi Minh City, Vietnam Construction Business A2Z Recording Studio Owner 1 January 2001 - Present Ho Chi Minh City, Vietnam",
 "placelive": " Ho Chi Minh City, Vietnam Current town/city Sydney, Australia Moved in 1994 Sydney, Australia Moved in 1994 Ho Chi Minh City, Vietnam Home town",
 "contact_info": " 6A Tong Huu Dinh, ward Thao Dien, dist.2,, Ho Chi Minh City, Vietnam Address /TA.ENGINEER.Co Facebook",
 "basic_info": " Male Gender English language Languages",
 "relationship": " Married",
 "bio": "null",
 "checkin": " NGON TA Coffee Ho Chi Minh City, Vietnam Visited on 11 October 2021 Huntington Beach, California California Visited on 8 August 2018 New York, New York New York Visited on 19 June 2016 Lafayette Square, Washington, D.C. Washington D.C. Visited on 18 June 2016",
 "sport": "SPORTS Hội Golf Việt Nam Bắc Âu Cộng Đồng Golfer Tại Tp Hồ Chí Minh Golf Vietnam Câu lạc bộ Golf Xứ Đoài Presidents Cup",
 "music": " Black Lemon Musician/Band",
 "films": " Gia Đình Sô - Bít Shopping and retail Yêu Phim Việt Public figure",
 "television": " On Green TV Programme",
 "books": " Namiko - Namiko From Japan Book",
 "app": " Microspace",
 "likes": " 15 Minute Golf Coach 280 Lương Định Của, An Phú, Quận 2 3Dmodelling.com.au 7 Wiki ABC GOLF MALL ACS - Architecture & Construction sharing",
 "backup_info": " 9+ 82 Andrew Anh Tuan Nguyen EDUCATION UTS: University of Technology Sydney BA Marketing Major School year 1999 THCS Trưng Vương High School School year 1992 WORK TA Engineer CEO & Founder 2 January 2001 - Present Ho Chi Minh City, Vietnam Construction Business A2Z Recording Studio Owner 1 January 2001 - Present Ho Chi Minh City, Vietnam PLACES LIVED Ho Chi Minh City, Vietnam Current town/city Sydney, Australia Moved in 1994 Sydney, Australia Moved in 1994 Ho Chi Minh City, Vietnam Home town CONTACT INFO 6A Tong Huu Dinh, ward Thao Dien, dist.2,, Ho Chi Minh City, Vietnam Address /TA.ENGINEER.Co Facebook BASIC INFO Male Gender English language Languages OTHER NAMES TA Engineer Name with title RELATIONSHIP Married LIFE EVENTS PHOTOS VIDEOS CHECK-INS NGON TA Coffee Ho Chi Minh City, Vietnam Visited on 11 October 2021 Huntington Beach, California California Visited on 8 August 2018 New York, New York New York Visited on 19 June 2016 Lafayette Square, Washington, D.C. Washington D.C. Visited on 18 June 2016 SPORTS Hội Golf Việt Nam Bắc Âu Cộng Đồng Golfer Tại Tp Hồ Chí Minh Golf Vietnam Câu lạc bộ Golf Xứ Đoài Presidents Cup MUSIC Black Lemon Musician/Band FILMS Gia Đình Sô - Bít Shopping and retail Yêu Phim Việt Public figure TV PROGRAMMES On Green TV Programme APPS AND GAMES Microspace LIKES 15 Minute Golf Coach 280 Lương Định Của, An Phú, Quận 2 3Dmodelling.com.au 7 Wiki ABC GOLF MALL ACS - Architecture & Construction sharing REVIEWS GIVEN TA Engineer - Smart MEP Solutions 5 stars Chúng tôi - TA ENGINEER, Nhà thầu cơ điện với tiêu chí: “Chất lượng đảm bảo, Tiến độ rốt ráo, Hiệu quả nâng cao, Vững bền hợp tác.” Duyên dáng Bolero 5 stars Handee 5 stars TA Serviced Apartments 5 stars",
 "contents": "null"
}