{
 "UID": "100001676819101",
 "name": "Bach Tran",
 "education": " kinh te quoc dan Kiểm toán School year 2012 National Economics University University THPT Nam Truc High School School year 2008 trung hoc pho thong nam truc High School 12A1 with Doan Van Duong Nam Trực High School",
 "work": "null",
 "placelive": " Hanoi, Vietnam Current town/city Nam Định, Nam Định, Vietnam Home town",
 "contact_info": " /bach.tran.9883dsa Facebook",
 "basic_info": " 21 August Date of birth Male Gender Women Interested in",
 "relationship": " Thu Hương Married Since October 2014 See photos of Bach and Thu",
 "bio": "null",
 "checkin": " Nhà hàng Hải Phương Hanoi, Vietnam Visited on 23 January 2021 Cô Hàng Xén - Mẹ Đậu Hanoi, Vietnam Visited on 13 May 2018 Thịt Nướng Gogi Hàn Quốc Hanoi, Vietnam Visited on 15 December 2017 Khu Du Lịch Buôn Đôn Buôn Ma Thuột, Đắc Lắk, Vietnam Visited on 25 February 2017",
 "sport": "SPORTS KhonkaenStar vc fanclub - แฟนคลับสโมสรขอนแก่นสตาร์ วีซี Thai Volleyball",
 "music": " Real Music Artist",
 "films": " Hanh Dong Va Hai Film",
 "television": " MasterChef Thailand - มาสเตอร์เชฟ ประเทศไทย TV Programme วันวันของคนดูซีรี่ย์ก็งี้แหละ Episode ไดอารี่ตุ๊ดซี่ส์ Film I.NEED Th-Sub TV Programme",
 "books": " เหล้ามายังไหว Business service Cartoons TV",
 "app": " Half-Life 2",
 "likes": " 3CE MART - 63A Cửa Bắc Agribank Chi nhánh tỉnh Bắc Giang Albee Le Fashion BELLE Biệt Đội Sành Ăn Chinh phục Đỉnh cao Nghề nghiệp Kế toán - Kiểm toán - Tài chính",
 "backup_info": " 1 9+ Bach Tran EDUCATION kinh te quoc dan Kiểm toán School year 2012 National Economics University University THPT Nam Truc High School School year 2008 trung hoc pho thong nam truc High School 12A1 with Doan Van Duong Nam Trực High School PLACES LIVED Hanoi, Vietnam Current town/city Nam Định, Nam Định, Vietnam Home town CONTACT INFO /bach.tran.9883dsa Facebook BASIC INFO 21 August Date of birth Male Gender Women Interested in RELATIONSHIP Thu Hương Married Since October 2014 See photos of Bach and Thu FAMILY MEMBERS Tuan Anh Tran Younger brother LIFE EVENTS FRIENDS Thu Hương Thang Le Van Trần Sỹ Triệu Huê PHOTOS VIDEOS CHECK-INS Nhà hàng Hải Phương Hanoi, Vietnam Visited on 23 January 2021 Cô Hàng Xén - Mẹ Đậu Hanoi, Vietnam Visited on 13 May 2018 Thịt Nướng Gogi Hàn Quốc Hanoi, Vietnam Visited on 15 December 2017 Khu Du Lịch Buôn Đôn Buôn Ma Thuột, Đắc Lắk, Vietnam Visited on 25 February 2017 MUSIC Real Music Artist FILMS Hanh Dong Va Hai Film APPS AND GAMES Half-Life 2 LIKES 3CE MART - 63A Cửa Bắc Agribank Chi nhánh tỉnh Bắc Giang Albee Le Fashion BELLE Biệt Đội Sành Ăn Chinh phục Đỉnh cao Nghề nghiệp Kế toán - Kiểm toán - Tài chính",
 "contents": "null"
}