{
 "UID": "100005452926371",
 "name": "Cong Khanh Le",
 "education": " DH Cửu Long University School year 2018 Trường THPT Võ Văn Kiệt High School School year 2013",
 "work": " Vĩnh Long",
 "placelive": " Vĩnh Long Current town/city Vĩnh Long Home town",
 "contact_info": " /congkhanh.le.180 Facebook",
 "basic_info": " Male Gender",
 "relationship": " Engaged",
 "bio": "null",
 "checkin": " Cù Lao Dài Vĩnh Long Visited on 22 November 2020 Thảo Cầm Viên, Q.1 Bình Hưng Hòa B Visited on 22 June 2019 Giay Dep DUWA Ho Chi Minh City, Vietnam Visited on 31 December 2018 VinPro Ho Chi Minh City, Vietnam Visited on 18 August 2018",
 "sport": "SPORTS Bóng Đá Cười",
 "music": " Hey TV Just for fun",
 "films": " Nhóc Zui Tánh Film",
 "television": " Hay.tv Publisher Vietnam Idol TV Programme Clip Hot Trên Mạng Just for fun",
 "books": " T-Style Shop Business centre",
 "app": " Hay Day",
 "likes": " 21fact ANU Luxury Azshopvn Bia Blanc 1664 Nhập Khẩu Bia Heineken Pháp Nhập Khẩu Bách Chiến Vô Song",
 "backup_info": " 9+ 9 9+ 57 Cong Khanh Le EDUCATION DH Cửu Long University School year 2018 Trường THPT Võ Văn Kiệt High School School year 2013 WORK Vĩnh Long PLACES LIVED Vĩnh Long Current town/city Vĩnh Long Home town CONTACT INFO /congkhanh.le.180 Facebook BASIC INFO Male Gender RELATIONSHIP Engaged FAMILY MEMBERS Nguyen Tuyen Older sister LIFE EVENTS FRIENDS Huỳnh Ngân Dang Que Trần Ngọc Tùng Pham Quy PHOTOS VIDEOS CHECK-INS Cù Lao Dài Vĩnh Long Visited on 22 November 2020 Thảo Cầm Viên, Q.1 Bình Hưng Hòa B Visited on 22 June 2019 Giay Dep DUWA Ho Chi Minh City, Vietnam Visited on 31 December 2018 VinPro Ho Chi Minh City, Vietnam Visited on 18 August 2018 FILMS Nhóc Zui Tánh Film BOOKS T-Style Shop Business centre LIKES 21fact ANU Luxury Azshopvn Bia Blanc 1664 Nhập Khẩu Bia Heineken Pháp Nhập Khẩu Bách Chiến Vô Song REVIEWS GIVEN Game Củ Hành",
 "contents": "null"
}