{
 "UID": "100001801501170",
 "name": "Cườg Ken",
 "education": "null",
 "work": " CEO Kim Phúc Real 20 March 2018 - Present Học viện Tài Chính (Academy Of Finance)",
 "placelive": " Ha Loi, Ha Noi, Vietnam Current town/city Nam Định, Nam Định, Vietnam Home town",
 "contact_info": " /cuogken Facebook",
 "basic_info": " Male Gender Men Interested in",
 "relationship": "null",
 "bio": "null",
 "checkin": " Đơn Dương, Lâm Đồng Ho Chi Minh City, Vietnam Visited on 23 December 2021 Bệnh Viện Quân Dân Miền Đông Ho Chi Minh City, Vietnam Visited on 17 October 2018 Da Lat Lâm Đồng Province Visited on 23 February 2018 Mercure Hoi An Hoi An, Quang Nam-Da Nang, Vietnam Visited on 8 May 2017",
 "sport": "SPORTS Thanh Hóa FC Since 1962 Manchester United ManUtd Việt Nam",
 "music": " WOW Pics Society & culture website",
 "films": " Yêu Phim Hay Sport and recreation Chụp Ảnh Kỷ Yếu - Team Chú Hùng Vlog Video creator Yeah1 Movie Media/news company HDViet Entertainment website",
 "television": " Heirs Vietnam Interest Bông Shop - Chuyên Sỉ Lẻ Giày Dép, Túi Xách Thời Trang Cao Cấp Design and fashion Missing You TV Programme Phim Mới Video creator",
 "books": " Xu Xu đừng Khóc Book",
 "app": " Play Together PUBG Mobile Esports Việt Nam CrossFire: Legends Xuong Si Garagames Viện đào tạo sắc đẹp Standard Chắn Online - Thapthanh.com Yo! Mobile",
 "likes": " 38 Degree Flowers A Little Soul Alotin.com Amazing Đà Lạt AmoonRa Android Cool Apps",
 "backup_info": " 1 9+ Cườg Ken WORK CEO Kim Phúc Real 20 March 2018 - Present Học viện Tài Chính (Academy Of Finance) PLACES LIVED Ha Loi, Ha Noi, Vietnam Current town/city Nam Định, Nam Định, Vietnam Home town CONTACT INFO /cuogken Facebook BASIC INFO Male Gender Men Interested in OTHER NAMES Try-again Other FAMILY MEMBERS Quynh Turnip Older sister Hien Kieu Sister Kim Anh Nguyễn Older sister LIFE EVENTS PHOTOS VIDEOS CHECK-INS Đơn Dương, Lâm Đồng Ho Chi Minh City, Vietnam Visited on 23 December 2021 Bệnh Viện Quân Dân Miền Đông Ho Chi Minh City, Vietnam Visited on 17 October 2018 Da Lat Lâm Đồng Province Visited on 23 February 2018 Mercure Hoi An Hoi An, Quang Nam-Da Nang, Vietnam Visited on 8 May 2017 MUSIC WOW Pics Society & culture website FILMS Yêu Phim Hay Sport and recreation Chụp Ảnh Kỷ Yếu - Team Chú Hùng Vlog Video creator Yeah1 Movie Media/news company HDViet Entertainment website TV PROGRAMMES Heirs Vietnam Interest Bông Shop - Chuyên Sỉ Lẻ Giày Dép, Túi Xách Thời Trang Cao Cấp Design and fashion Missing You TV Programme Phim Mới Video creator APPS AND GAMES Play Together PUBG Mobile Esports Việt Nam CrossFire: Legends Xuong Si Garagames Viện đào tạo sắc đẹp Standard Chắn Online - Thapthanh.com Yo! Mobile LIKES 38 Degree Flowers A Little Soul Alotin.com Amazing Đà Lạt AmoonRa Android Cool Apps REVIEWS GIVEN Diễn Đàn Cà Mau 3 stars TP Đà Nẵng 5 stars Charm Resort Long Hải The Gioi Di Dong Le Van Viet Q9 Tôi rất hài lòng về chất lượng dịch vụ của cửa hàng",
 "contents": "null"
}