{
 "UID": "587366761\n",
 "name": "Cẩm Tú",
 "education": " HNU Journalism School year 2004 THPT Kim Liên High School School year 1999 Kim Liên High School School year 1999",
 "work": " Azooo.vn sai vặt 1 August 2018 - Present VPBank project communication 10 October 2017 - August 2018 Hanoi, Vietnam Blue C Content Development Company Rót nước, pha trà July 2014 - August 2017 Hanoi, Vietnam",
 "placelive": " Hanoi, Vietnam Current town/city Hanoi, Vietnam Home town",
 "contact_info": " /cam.tu.165 Facebook",
 "basic_info": " Female Gender English language Languages",
 "relationship": "null",
 "bio": "null",
 "checkin": " Fortuna Hotel Hanoi Hanoi, Vietnam Visited on 18 July 2020 Hanoi, Vietnam Vietnam Visited on 31 August 2018 Hanoi, Vietnam Vietnam Visited on 10 October 2017 Up VPBank Hanoi, Vietnam Visited on 16 September 2017",
 "sport": "SPORTS Fandom Owker",
 "music": "null",
 "films": " Cuộc thi Nhà biên kịch tài năng Film Kênh thông tin phim truyện cập nhật mới Film Điện Ảnh Trong Tầm Tay Film Xin chào ngày xưa ấy=网剧你好旧时光 FC 2017 Film",
 "television": " TVMVV TV Programme Thách Thức Danh Hài TV Programme Descendant of the Sun - 태양의 후예 - Vietnam Fanpage Episode",
 "books": " Đọc Truyện Online Interest Dạy Con Thành Tài Community",
 "app": " Đồ chơi học liệu giáo dục sớm SohaGame",
 "likes": " 2nd brand shop 5Desire 84RACE 9GAG AP Advertising Vietnam",
 "backup_info": " 9+ 9 9+ 67 Cẩm Tú EDUCATION HNU Journalism School year 2004 THPT Kim Liên High School School year 1999 Kim Liên High School School year 1999 WORK Azooo.vn sai vặt 1 August 2018 - Present VPBank project communication 10 October 2017 - August 2018 Hanoi, Vietnam Blue C Content Development Company Rót nước, pha trà July 2014 - August 2017 Hanoi, Vietnam PLACES LIVED Hanoi, Vietnam Current town/city Hanoi, Vietnam Home town CONTACT INFO /cam.tu.165 Facebook BASIC INFO Female Gender English language Languages LIFE EVENTS PHOTOS VIDEOS CHECK-INS Fortuna Hotel Hanoi Hanoi, Vietnam Visited on 18 July 2020 Hanoi, Vietnam Vietnam Visited on 31 August 2018 Hanoi, Vietnam Vietnam Visited on 10 October 2017 Up VPBank Hanoi, Vietnam Visited on 16 September 2017 SPORTS Fandom Owker FILMS Cuộc thi Nhà biên kịch tài năng Film Kênh thông tin phim truyện cập nhật mới Film Điện Ảnh Trong Tầm Tay Film Xin chào ngày xưa ấy=网剧你好旧时光 FC 2017 Film TV PROGRAMMES TVMVV TV Programme Thách Thức Danh Hài TV Programme Descendant of the Sun - 태양의 후예 - Vietnam Fanpage Episode BOOKS Đọc Truyện Online Interest Dạy Con Thành Tài Community APPS AND GAMES Đồ chơi học liệu giáo dục sớm SohaGame LIKES 2nd brand shop 5Desire 84RACE 9GAG AP Advertising Vietnam REVIEWS GIVEN Ji Chang Wook & Nam Ji Hyun VietNam Fanpage 5 stars MobiFone 5 stars Mỹ phẩm Hàn Quốc Queenie 5 stars Trung tâm Hội nghị Tiệc cưới Forevermark 5 stars Nhà hàng vị trí đẹp, không gian loãng moạn, món ăn hợp khẩu vị... Nói chung đi ăn cưới về xong muốn cưới lượt nữa :)",
 "contents": "null"
}