{
 "UID": "777369707",
 "name": "Cẩm Tú Nguyễn",
 "education": " Thang Long University University PTTH Kim Lien -Ha Noi High School",
 "work": " Bon Bon Food & Milk Tea - Trà Chanh Chủ thương hiệu 8 October 2019 - Present Hot Paradise Chủ tịch hội đồng Chém gió 20 December 2015 - Present Kumo BBQ & Hotpot - Lẩu nướng Hàn Quốc 14/1141 Giải Phóng Chủ tịch",
 "placelive": " Hanoi, Vietnam Current town/city Hanoi, Vietnam Home town",
 "contact_info": " /camtu.nguyen.73744 Facebook tara.nguyen1979 Instagram",
 "basic_info": " Female Gender",
 "relationship": "null",
 "bio": "null",
 "checkin": " Kumo BBQ & Hotpot - Lẩu nướng Hàn Quốc 14/1141 Giải Phóng Hanoi, Vietnam Visited on 25 June 2021 30SHINE Hanoi, Vietnam Visited on 8 February 2021 Lòng Trần Cháo Đào Duy Từ Hanoi, Vietnam Visited on 29 December 2020 THCS Nguyễn Trường Tộ - Hà Nội Hanoi, Vietnam Visited on 1 September 2020",
 "sport": "null",
 "music": " Vòng Gỗ Bán Buôn Bán Lẻ Hoàn Minh Album",
 "films": "null",
 "television": " HÀI Vitalk.vn Interest",
 "books": "null",
 "app": " Mini World: Creata Vietnam",
 "likes": " 1989house 28th Shop chuyên Order hàng Japan/US/Spain/China 4P Food Solutions 71 Nguyên Khiết ,Pub Cafe Hotel 82X A Fashion",
 "backup_info": " 9+ 9 9+ 59 Cẩm Tú Nguyễn EDUCATION Thang Long University University PTTH Kim Lien -Ha Noi High School WORK Bon Bon Food & Milk Tea - Trà Chanh Chủ thương hiệu 8 October 2019 - Present Hot Paradise Chủ tịch hội đồng Chém gió 20 December 2015 - Present Kumo BBQ & Hotpot - Lẩu nướng Hàn Quốc 14/1141 Giải Phóng Chủ tịch PLACES LIVED Hanoi, Vietnam Current town/city Hanoi, Vietnam Home town CONTACT INFO /camtu.nguyen.73744 Facebook tara.nguyen1979 Instagram BASIC INFO Female Gender FAMILY MEMBERS Anh Bach Niece LIFE EVENTS FRIENDS Nguyễn Vũ Khánh Dương Mai Hương Nguyễn Hoàng Việt Mùa Thu PHOTOS VIDEOS CHECK-INS Kumo BBQ & Hotpot - Lẩu nướng Hàn Quốc 14/1141 Giải Phóng Hanoi, Vietnam Visited on 25 June 2021 30SHINE Hanoi, Vietnam Visited on 8 February 2021 Lòng Trần Cháo Đào Duy Từ Hanoi, Vietnam Visited on 29 December 2020 THCS Nguyễn Trường Tộ - Hà Nội Hanoi, Vietnam Visited on 1 September 2020 MUSIC Vòng Gỗ Bán Buôn Bán Lẻ Hoàn Minh Album TV PROGRAMMES HÀI Vitalk.vn Interest APPS AND GAMES Mini World: Creata Vietnam LIKES 1989house 28th Shop chuyên Order hàng Japan/US/Spain/China 4P Food Solutions 71 Nguyên Khiết ,Pub Cafe Hotel 82X A Fashion REVIEWS GIVEN Sức Khỏe Gia Đình Chất lượng tốt, nhân viên nhiệt tình Kumo BBQ & Bar 14 Thịnh Liệt 5 stars Học Sinh THPT Ngọc Hồi 5 stars � “BUFFET LẨU, NƯỚNG SIÊU HOT - GIÁ CHỈ #159k - ĂN THỎA THÍCH 30 MÓN TỰ CHỌN tại nhà hàng # KUMO BBQ & BAR 14 Thịnh Liệt, Giải Phóng, Hoàng Mai �ĐIỀU HÒA MÁT LẠNH ĂN NƯỚNG THẢ GA � �CHECKIN sang chảnh với buffet nướng, lẩu Kumo BBQ & Bar � Mở cửa từ 10h sáng đến 23h. đồng giá 159k/suất trưa, 179k/ suất tối � / ăn thoải mái các món cực chất: 1. Ba chỉ bò mỹ 2. Ba chỉ heo 3. Sườn sụn 4. Xúc xích 5. Gà 6. Ngao 7. Tôm 8. Mực ống 9. Bò cuốn nấm 10. Thịt dải 11. Lòng non 12. Nầm heo 13. Bạch tuộc 14. Chân gà rút xương 15. Dẻ sườn bò Mỹ 16. Bánh mỳ bơ đường 17. Khoai tây chiên 18. Súp gà nấm 19. Kim chi 20.Rau cuốn 21. Nước lẩu 22. Ngô ngọt 23. Mỳ tôm 24. Miến 25. Rau lẩu 26. Nấm kim châm 27. Váng đậu 28. Cơm rang thập cẩm 29. Hoa quả 30. Tào phớ �� Còn chần chừ gì nữa mà không đến ngay với Kumo BBQ & Bar để thưởng thức thả phanh và cảm nhận những SIÊU ƯU ĐÃI NÀY � HÃY LIKE + SHARE VÀ TAG BẠN BÈ HẸN HÒ NGAY ĐỂ CÙNG NHAU GIẢI NHIỆT NGÀY HÈ � � Dành cho khách đặt món không dùng bufeet! � Chỉ 39k - 59k/đĩa bạn có thể lựa chọn rất nhiều món khác nhau. �Bàn đi từ 6 người được tặng 1 món đặc biệt trong ngày �Phục vụ nhiệt tình, chu đáo �Liên hệ đặt bàn: 0985202100, 0966662266 � Địa chỉ: 14 Phố Thịnh Liệt- Giải Phóng, Hoàng Mai ( Số 14/ 1141 đường Giải Phóng cũ) Kumo BBQ & Hotpot - Lẩu nướng Hàn Quốc 14/1141 Giải Phóng 5 stars",
 "contents": "null"
}