{
 "UID": "100003119059377",
 "name": "Dominh Cuong",
 "education": " Đại học Kinh tế Quốc dân University Dong Do High School High School",
 "work": " thien long",
 "placelive": " Hanoi, Vietnam Current town/city Hanoi, Vietnam Home town",
 "contact_info": " /cuong.dominh.1 Facebook",
 "basic_info": " 19 May 1979 Date of birth Male Gender",
 "relationship": "null",
 "bio": "null",
 "checkin": " Sân Bóng Đông Đô 2 Hanoi, Vietnam Visited on 14 March 2021 Ngõ 85, Xuân Thủy, Cầu Giấy, Hà Nộip Hanoi, Vietnam Visited on 20 May 2020 Trường Trung Học Cơ Sở Nam Trung Yên Hanoi, Vietnam Visited on 3 April 2020 Trống Đồng Palace 489 Hoàng Quốc Việt Hanoi, Vietnam Visited on 21 January 2020",
 "sport": "SPORTS Anh Thắng Sport-Thời Trang Thể Thao Cao Cấp Blida Gymnastique Nhà phân phối sơn Japan Assy Homematic Nhà Thông Minh FPT Sports CLB Cầu lông Nữ Nhi",
 "music": " Đam Mê Hát Văn Musician/Band",
 "films": " Truth or Dare Film Sống khoẻ mỗi ngày Media/news company Tôi Thích Xem Phim Film Đời Sống Quanh Ta Newspaper",
 "television": " Triết Lý Người Thành Công TV Programme Đại Kỷ Nguyên - Việt Nam Society & culture website Cafe sáng với VTV3 Interest Shark Tank Việt Nam TV Programme",
 "books": " First News Trí Việt Book",
 "app": " Đại Lý Đồ Chơi Thẩm Mỹ Ngọc Anh Đồ Chơi Khoa Học COKI Bibo Store - Shop Đồ Chơi Thông Minh Cửu Âm Chân Kinh Web Đồ chơi điểu kiển từ xa",
 "likes": " (·. Những câu chuyện cuộc sống .·) - Cảm Xúc Cuộc Sống - 1 2 3 Cùng cười nào 1 Phút Thay Đổi Tư Duy Để Thành Công 1001 Bí kíp Dạy con trưởng thành 1001 Bí quyết tập Yoga mỗi ngày",
 "backup_info": " 9+ 9 9+ 57 Dominh Cuong EDUCATION Đại học Kinh tế Quốc dân University Dong Do High School High School WORK thien long PLACES LIVED Hanoi, Vietnam Current town/city Hanoi, Vietnam Home town CONTACT INFO /cuong.dominh.1 Facebook BASIC INFO 19 May 1979 Date of birth Male Gender FAMILY MEMBERS Bất Cần Đời Family member LIFE EVENTS FRIENDS Nghĩa Trung Le Tuan Ngoc Eras Vpp Nhan Do PHOTOS VIDEOS CHECK-INS Sân Bóng Đông Đô 2 Hanoi, Vietnam Visited on 14 March 2021 Ngõ 85, Xuân Thủy, Cầu Giấy, Hà Nộip Hanoi, Vietnam Visited on 20 May 2020 Trường Trung Học Cơ Sở Nam Trung Yên Hanoi, Vietnam Visited on 3 April 2020 Trống Đồng Palace 489 Hoàng Quốc Việt Hanoi, Vietnam Visited on 21 January 2020 SPORTS Anh Thắng Sport-Thời Trang Thể Thao Cao Cấp Blida Gymnastique Nhà phân phối sơn Japan Assy Homematic Nhà Thông Minh FPT Sports CLB Cầu lông Nữ Nhi MUSIC Đam Mê Hát Văn Musician/Band FILMS Truth or Dare Film Sống khoẻ mỗi ngày Media/news company Tôi Thích Xem Phim Film Đời Sống Quanh Ta Newspaper TV PROGRAMMES Triết Lý Người Thành Công TV Programme Đại Kỷ Nguyên - Việt Nam Society & culture website Cafe sáng với VTV3 Interest Shark Tank Việt Nam TV Programme BOOKS First News Trí Việt Book APPS AND GAMES Đại Lý Đồ Chơi Thẩm Mỹ Ngọc Anh Đồ Chơi Khoa Học COKI Bibo Store - Shop Đồ Chơi Thông Minh Cửu Âm Chân Kinh Web Đồ chơi điểu kiển từ xa LIKES (·. Những câu chuyện cuộc sống .·) - Cảm Xúc Cuộc Sống - 1 2 3 Cùng cười nào 1 Phút Thay Đổi Tư Duy Để Thành Công 1001 Bí kíp Dạy con trưởng thành 1001 Bí quyết tập Yoga mỗi ngày",
 "contents": "null"
}