{
 "UID": "1482997267",
 "name": "Duy Ngô",
 "education": "null",
 "work": "null",
 "placelive": "null",
 "contact_info": " /duy.ngo.5688 Facebook",
 "basic_info": " 30 April Date of birth Male Gender",
 "relationship": "null",
 "bio": "null",
 "checkin": " Tik Tok Triệu View Visited on 7 December 2020 Mỹ Phẩm V LIFE Ha Long Visited on 1 October 2020 Yên Cư Phố Ha Long Visited on 21 January 2020 Cửa Khẩu Lóng Sập/LAOS Vietnam Visited on 29 April 2019",
 "sport": "SPORTS Giày Hoka Running Order - Xách tay - SALES",
 "music": " Reel Video Music video Thuy Nga - Paris By Night Record label Nhà ven hồ Hotel resort Clip Nóng Trong Ngày Music video",
 "films": " Hà Nội Em Yêu Anh Film",
 "television": " Shark Tank Việt Nam TV Programme SÖZ Digital creator Chương trình gì hay là thích TV Hanamaru Kindergarten Local business",
 "books": " Lịch sử và chính trị Book",
 "app": " Sun World Blog Đường Phố",
 "likes": " 4̲0̲+̲ ̲ツ 61 Giây BBC News Tiếng Việt Belle Poque Bend Burlesque Co. Best Buy",
 "backup_info": " 3 9+ Duy Ngô CONTACT INFO /duy.ngo.5688 Facebook BASIC INFO 30 April Date of birth Male Gender LIFE EVENTS FRIENDS Ken Ken Nhung Hươu Tín Tài Nguyễn Hanh Phạm Hương PHOTOS VIDEOS CHECK-INS Tik Tok Triệu View Visited on 7 December 2020 Mỹ Phẩm V LIFE Ha Long Visited on 1 October 2020 Yên Cư Phố Ha Long Visited on 21 January 2020 Cửa Khẩu Lóng Sập/LAOS Vietnam Visited on 29 April 2019 MUSIC Reel Video Music video Thuy Nga - Paris By Night Record label Nhà ven hồ Hotel resort Clip Nóng Trong Ngày Music video TV PROGRAMMES Shark Tank Việt Nam TV Programme SÖZ Digital creator Chương trình gì hay là thích TV Hanamaru Kindergarten Local business BOOKS Lịch sử và chính trị Book APPS AND GAMES Sun World Blog Đường Phố LIKES 4̲0̲+̲ ̲ツ 61 Giây BBC News Tiếng Việt Belle Poque Bend Burlesque Co. Best Buy REVIEWS GIVEN Con Đường Hạnh Phúc Hà Giang 5 stars Đẹp",
 "contents": "null"
}