{
 "UID": "100001813074485",
 "name": "Duyên Bùi",
 "education": "null",
 "work": "null",
 "placelive": "null",
 "contact_info": " /duyenmonkey Facebook",
 "basic_info": " 16 February Date of birth Female Gender",
 "relationship": "null",
 "bio": "null",
 "checkin": " Đơn Dương, Lâm Đồng Ho Chi Minh City, Vietnam Visited on 23 December 2021 Bệnh Viện Quân Dân Miền Đông Ho Chi Minh City, Vietnam Visited on 17 October 2018 Da Lat Lâm Đồng Province Visited on 23 February 2018 Mercure Hoi An Hoi An, Quang Nam-Da Nang, Vietnam Visited on 8 May 2017",
 "sport": "SPORTS Manchester United",
 "music": " Ailee Artist Eminem Artist",
 "films": " 5 Centimet trên giây Film ConanVN-Fansub Community Tổng kho sỉ lẻ đồ gia dụng tiện ích Local business khi nhung ba noi tro hanh dong Film",
 "television": " Điều ước thứ 7 TV Programme Dự báo thời tiết VTV TV Programme Roomate 룸메이트 FanPage TV Programme Bạn Muốn Hẹn Hò? Arts and entertainment",
 "books": " Bloom Books - Cảm hứng sống Book Vì cuộc đời là những chuyến đi - Tôi đi du học Book Hội những người thích đọc \"Thám tử lừng danh Conan\" Book series ಌღ Truyện ღಌ Interest",
 "app": " Wartune at R2Games.com",
 "likes": " 1992 1viec.com - Mạng tìm việc làm - Viết CV xin việc online 2 Closet Online 2 Shoes Shop 2000's Throwbacks 21.CHU",
 "backup_info": " 1 9+ Duyên Bùi CONTACT INFO /duyenmonkey Facebook BASIC INFO 16 February Date of birth Female Gender LIFE EVENTS FAVOURITE QUOTES Don’t stop giving love even if you don’t receive it. Smile and have patience.         there's a long way to go before your story ends. so don't lose your patience because you weren't fast enough. if you go slower, then you can see more along the way. if you ask me who will grow stronger, i think it's the one who took it slow PHOTOS SPORTS Manchester United MUSIC Ailee Artist Eminem Artist FILMS 5 Centimet trên giây Film ConanVN-Fansub Community Tổng kho sỉ lẻ đồ gia dụng tiện ích Local business khi nhung ba noi tro hanh dong Film TV PROGRAMMES Điều ước thứ 7 TV Programme Dự báo thời tiết VTV TV Programme Roomate 룸메이트 FanPage TV Programme Bạn Muốn Hẹn Hò? Arts and entertainment BOOKS Bloom Books - Cảm hứng sống Book Vì cuộc đời là những chuyến đi - Tôi đi du học Book Hội những người thích đọc \"Thám tử lừng danh Conan\" Book series ಌღ Truyện ღಌ Interest APPS AND GAMES Wartune at R2Games.com LIKES 1992 1viec.com - Mạng tìm việc làm - Viết CV xin việc online 2 Closet Online 2 Shoes Shop 2000's Throwbacks 21.CHU",
 "contents": "null"
}