{
 "UID": "100001155748489",
 "name": "Elvin Nguyen",
 "education": " Christian Unified Schools of San Diego University Trường THCS Lê Quý Đôn High School Le Quy Don High School High School 10D5 with Khanh Đỗ Patti Trường Trung Học Phổ Thông Lê Quý Đôn High School",
 "work": " Tony Fruit Market & Juice 169 Khánh Hội P.3 Q.4 2018 - Present Ho Chi Minh City, Vietnam Bán trái cây nhập khẩu các loại.",
 "placelive": " Ho Chi Minh City, Vietnam Current town/city",
 "contact_info": " /elvin0306 Facebook https://soundcloud.com/elgoe SoundCloud",
 "basic_info": " Male Gender English language, Japanese language and France Languages",
 "relationship": "null",
 "bio": "ABOUT ELVIN What Goes Around Come Back Around :)",
 "checkin": " Riverside Palace Ho Chi Minh City, Vietnam Visited on 2 January 2016 Moo Beef Steak Ho Chi Minh City, Vietnam Visited on 9 June 2015 Christian Unified Schools of San Diego El Cajon, California Visited on 23 May 2015 Fuse Bar Visited on 17 June 2014",
 "sport": "SPORTS FC Barcelona Arsenal Real Madrid C.F. Manchester United",
 "music": " SPIN Awards Music award VDEs - tìm kiếm địa điểm tổ chức tiệc cưới Adult entertainment service 84NOISE Society & culture website Pharreal Phuong Beauty, cosmetic and personal care",
 "films": " Cuồng phim-Review News & media website thuyetminh.com Interest New Moon Film Phim Rạp Entertainment website",
 "television": " Black Mirror TV Programme Heirs Vietnam Interest Disney Channel TV network Vietnam Idol TV Programme",
 "books": " Đọc Truyện Online Interest Twilight Interest",
 "app": " Garena Liên Quân Mobile",
 "likes": " 12 cung hoàng đạo 1988homeup.vn 2! Magazine 2nshop.vn - Chuyên hàng công nghệ 84NOISE ACET - Australian Centre for Education and Training",
 "backup_info": " 1 9+ Elvin Nguyen WORK Tony Fruit Market & Juice 169 Khánh Hội P.3 Q.4 2018 - Present Ho Chi Minh City, Vietnam Bán trái cây nhập khẩu các loại. EDUCATION Christian Unified Schools of San Diego University Trường THCS Lê Quý Đôn High School Le Quy Don High School High School 10D5 with Khanh Đỗ Patti Trường Trung Học Phổ Thông Lê Quý Đôn High School PLACES LIVED Ho Chi Minh City, Vietnam Current town/city CONTACT INFO /elvin0306 Facebook https://soundcloud.com/elgoe SoundCloud BASIC INFO Male Gender English language, Japanese language and France Languages FAMILY MEMBERS Nguyen Quynh Younger sister Minh Ngọc Younger sister Khang Q. Ngo Cousin Phuong Anh Lam Mai Grandmother ABOUT ELVIN What Goes Around Come Back Around :) LIFE EVENTS PHOTOS VIDEOS CHECK-INS Riverside Palace Ho Chi Minh City, Vietnam Visited on 2 January 2016 Moo Beef Steak Ho Chi Minh City, Vietnam Visited on 9 June 2015 Christian Unified Schools of San Diego El Cajon, California Visited on 23 May 2015 Fuse Bar Visited on 17 June 2014 SPORTS FC Barcelona Arsenal Real Madrid C.F. Manchester United MUSIC SPIN Awards Music award VDEs - tìm kiếm địa điểm tổ chức tiệc cưới Adult entertainment service 84NOISE Society & culture website Pharreal Phuong Beauty, cosmetic and personal care FILMS Cuồng phim-Review News & media website thuyetminh.com Interest New Moon Film Phim Rạp Entertainment website TV PROGRAMMES Black Mirror TV Programme Heirs Vietnam Interest Disney Channel TV network Vietnam Idol TV Programme BOOKS Đọc Truyện Online Interest Twilight Interest APPS AND GAMES Garena Liên Quân Mobile LIKES 12 cung hoàng đạo 1988homeup.vn 2! Magazine 2nshop.vn - Chuyên hàng công nghệ 84NOISE ACET - Australian Centre for Education and Training REVIEWS GIVEN VietnamPomade - Men's Hair Styling Product 5 stars MeoMeo Photography 5 stars Miracle Coffee Have been to many coffee place but this one seem the best ! Tư Vấn Du Học Thế Hệ Mới Các anh chị rất tốt, kinh nghiệm, giỏi, và nhiệt tình. Đảm bảo đậu nhé !",
 "contents": "null"
}