{
 "UID": "100002736158305",
 "name": "Fiona Pham",
 "education": " Hoa Sen University University 2002 - Present Nguyen Du High School 1999 - Present THPT Nguyễn Du High School",
 "work": "null",
 "placelive": " Ho Chi Minh City, Vietnam Current town/city Ho Chi Minh City, Vietnam Home town",
 "contact_info": "null",
 "basic_info": " Female Gender",
 "relationship": "null",
 "bio": "null",
 "checkin": " Trà Sữa -18°C Lê Văn Sĩ Ho Chi Minh City, Vietnam Visited on 24 January 2016 Wonderland Club Ho Chi Minh City, Vietnam Visited on 22 January 2016 Karaoke Nnice Ho Chi Minh City, Vietnam Visited on 16 January 2016 Novotel Saigon Centre Hotel Ho Chi Minh City, Vietnam Visited on 16 January 2016",
 "sport": "SPORTS Manchester United",
 "music": " Tiện ích xanh 1 Interest Buồn Music Music video VDEs - tìm kiếm địa điểm tổ chức tiệc cưới Adult entertainment service Acoustic Music Corner Community",
 "films": " Review phim hay Film B9 Studio Product/Service Các câu nói hay - ý nghĩa và hài hước trong phim TVB Film God's Not Dead Film",
 "television": " Biệt Tài Tí Hon TV Programme VieKids Media/news company Đồ Gỗ Kangnam Shopping service VIETV Network TV network",
 "books": " Tạp chí Thể Thao Văn Hóa & Đàn Ông Book ಌღ Truyện ღಌ Interest",
 "app": " Shop Bé Cưng - Nơi mẹ yêu con Xuong Si Garagames Viện đào tạo sắc đẹp Standard",
 "likes": " \bBếp Hoà Phát 1001 Ý Tưởng Kinh Doanh 1995 Shop 2T SHOP ABC Angel ABC Bakery Nguyễn Trãi",
 "backup_info": " 4 5 9+ 45 Fiona Pham EDUCATION Hoa Sen University University 2002 - Present Nguyen Du High School 1999 - Present THPT Nguyễn Du High School PLACES LIVED Ho Chi Minh City, Vietnam Current town/city Ho Chi Minh City, Vietnam Home town BASIC INFO Female Gender OTHER NAMES Fiona Pham Nickname FAMILY MEMBERS Barney Pham Older brother Mỹ Tuyên Bảo Hiểm Younger sister Thức Older brother Trí Nguyễn Cousin David Nguyen Nephew ThanhTrúc Hoàng Grandmother LIFE EVENTS FRIENDS Nguyễn Minh Đức Yen Nguyen Phương Mai Hong Kelly PHOTOS VIDEOS CHECK-INS Trà Sữa -18°C Lê Văn Sĩ Ho Chi Minh City, Vietnam Visited on 24 January 2016 Wonderland Club Ho Chi Minh City, Vietnam Visited on 22 January 2016 Karaoke Nnice Ho Chi Minh City, Vietnam Visited on 16 January 2016 Novotel Saigon Centre Hotel Ho Chi Minh City, Vietnam Visited on 16 January 2016 MUSIC Tiện ích xanh 1 Interest Buồn Music Music video VDEs - tìm kiếm địa điểm tổ chức tiệc cưới Adult entertainment service Acoustic Music Corner Community FILMS Review phim hay Film B9 Studio Product/Service Các câu nói hay - ý nghĩa và hài hước trong phim TVB Film God's Not Dead Film TV PROGRAMMES Biệt Tài Tí Hon TV Programme VieKids Media/news company Đồ Gỗ Kangnam Shopping service VIETV Network TV network BOOKS Tạp chí Thể Thao Văn Hóa & Đàn Ông Book ಌღ Truyện ღಌ Interest APPS AND GAMES Shop Bé Cưng - Nơi mẹ yêu con Xuong Si Garagames Viện đào tạo sắc đẹp Standard LIKES \bBếp Hoà Phát 1001 Ý Tưởng Kinh Doanh 1995 Shop 2T SHOP ABC Angel ABC Bakery Nguyễn Trãi REVIEWS GIVEN Tiệm cà phê Nhà Số 10 quán decor dễ thương, giá bình dân. Ti Ti Quán - Cao Thắng thức ăn cũng ok. nhưng ngày tết phụ thu 20%, đồ ăn nguội, tôilet dơ, ko có phục vụ giấy vệ sinh. cơ sở vật chất xuống cấp. nói chung ko ngon như trước. Nội Thất Viết Vinh Nhà Bán Lẻ Số 1 Nội Thất Văn Phòng Sài Gòn 1 stars",
 "contents": "null"
}