{
 "UID": "100004202531919",
 "name": "Henry Trần",
 "education": "null",
 "work": " Doanh Nhân Đào Tạo Tài Chính 4.0 8 March 2019 to present CEO training in financial technology 4.0 2 May 2017 to present Trường Doanh Nhân CEO Việt Nam Branch manager 31 January 2016 to present CEO Training and developing marketing human resources 19 January 2016 to present CEO language programming and word training 17 August 2015 to present",
 "placelive": " Thu Dau Mot Current town/city Cà Mau Home town",
 "contact_info": "null",
 "basic_info": " Male Gender",
 "relationship": " Single",
 "bio": "ABOUT HENRY _Sóg đơn giản _Khi nói là làm _thích kết bạn ( bạn điểu thỳ kút, bấm nút \"BIẾN \".) _Vui vẻ, hòa đồg,.v.v.. _Ai tốt ví mỳh tkỳ mỳh tốt lại..",
 "checkin": " Hòn Rơm Mũi Né Phan Thiet Visited on 24 November 2019 Mường Thanh Luxury Viễn Triều Hotel Nha Trang Visited on 23 November 2019 Mường Thanh Luxury Viễn Triều Hotel Nha Trang Visited on 22 November 2019",
 "sport": "SPORTS Manchester United Fanzone Chelsea Football Club We are Madridista in Việt Nam Real Madrid C.F. FC Barcelona",
 "music": " Did You Know? Shopping and retail dOSe in Asia Clothing (brand) Hội Những Người Đam Mê CF Radio station YG FAMILY Record label",
 "films": " Học Viện Sách Book Harry Potter Film",
 "television": " Hội những người thích xem TV Show TV Programme Street Food Around The World TV Programme アリティーヴィー株式会社(ariTV,inc.) Internet company",
 "books": " Nhật Ký Yêu Thương Arts and entertainment",
 "app": " Fanvip.club - Đăng ký tặng thẻ miễn phí Thế Giới Game Mobile Garena Liên Quân Mobile Bida - ZingPlay Đột Kích Trong Tầm Ngắm Hắc Ám Chi Quang",
 "likes": " 24H Bình Dương AE Samy House AKI SHOP ANna Design Alcatel mobile American University of Phnom Penh",
 "backup_info": " 9+ 9 9+ 57 Henry Trần WORK Doanh Nhân Đào Tạo Tài Chính 4.0 8 March 2019 to present CEO training in financial technology 4.0 2 May 2017 to present Trường Doanh Nhân CEO Việt Nam Branch manager 31 January 2016 to present CEO Training and developing marketing human resources 19 January 2016 to present CEO language programming and word training 17 August 2015 to present PLACES LIVED Thu Dau Mot Current town/city Cà Mau Home town BASIC INFO Male Gender RELATIONSHIP Single ABOUT HENRY _Sóg đơn giản _Khi nói là làm _thích kết bạn ( bạn điểu thỳ kút, bấm nút \"BIẾN \".) _Vui vẻ, hòa đồg,.v.v.. _Ai tốt ví mỳh tkỳ mỳh tốt lại.. LIFE EVENTS FAVOURITE QUOTES _Thích thể thao: + bóg đá. + bóg chuyền. _thích nghe nhạc _xem TV _cafe chém gió. PHOTOS VIDEOS CHECK-INS Hòn Rơm Mũi Né Phan Thiet Visited on 24 November 2019 Mường Thanh Luxury Viễn Triều Hotel Nha Trang Visited on 23 November 2019 Mường Thanh Luxury Viễn Triều Hotel Nha Trang Visited on 22 November 2019 SPORTS Manchester United Fanzone Chelsea Football Club We are Madridista in Việt Nam Real Madrid C.F. FC Barcelona MUSIC Did You Know? Shopping and retail dOSe in Asia Clothing (brand) Hội Những Người Đam Mê CF Radio station YG FAMILY Record label FILMS Học Viện Sách Book Harry Potter Film TV PROGRAMMES Hội những người thích xem TV Show TV Programme Street Food Around The World TV Programme アリティーヴィー株式会社(ariTV,inc.) Internet company BOOKS Nhật Ký Yêu Thương Arts and entertainment APPS AND GAMES Fanvip.club - Đăng ký tặng thẻ miễn phí Thế Giới Game Mobile Garena Liên Quân Mobile Bida - ZingPlay Đột Kích Trong Tầm Ngắm Hắc Ám Chi Quang LIKES 24H Bình Dương AE Samy House AKI SHOP ANna Design Alcatel mobile American University of Phnom Penh REVIEWS GIVEN Đất nền giá rẻ đầu tư sinh lời cao Uý tính và chất lượng đáng đầu tư",
 "contents": "null"
}