{
 "UID": "1576970539",
 "name": "Heo Con",
 "education": " THPT Phú Mỹ University Phú Mỹ High School School year 2001 Middletown High School High School",
 "work": " Trường THCS Phú Mỹ Ho Chi Minh City, Vietnam Vung Tau",
 "placelive": " Thành phố Hồ Chí Minh, Hồ Chí Minh, Vietnam Current town/city Vung Tau Home town",
 "contact_info": " /nguyen.hong.7140 Facebook",
 "basic_info": " Female Gender Women Interested in",
 "relationship": " Single",
 "bio": "null",
 "checkin": " Ho Chi Minh City, Vietnam Ho Chi Minh City Visited on 12 April 2021 Candy's Coffee and Food Ho Chi Minh City, Vietnam Visited on 8 March 2021 Ho Chi Minh City, Vietnam Ho Chi Minh City Visited on 24 May 2020 Cánh đồng diều quận 2 Ho Chi Minh City, Vietnam Visited on 30 June 2019",
 "sport": "SPORTS Fashion Tira chuyen hang thiet ke",
 "music": " Thuy Nga - Paris By Night Record label Ca Sĩ Nhí Music video Sony Music Brasil Record label",
 "films": " Mọt Phim Ngôn Tình Trung Quốc Interest",
 "television": " Nhân Duyên Interest Phụ nữ truyền cảm hứng TV Programme PHAN HIẾU Performing arts Mặt Trời Bé Con TV Programme",
 "books": " Đường hai ngả, người thương thành lạ School/university Nếu biết trăm năm là hữu hạn Community",
 "app": " Messi Toys - Đồ chơi giáo dục - An toàn, Chất lượng Chill kids - Sài Gòn Speedy Bike FunnyLand.vn tiNiToy Hay Day",
 "likes": " 30 Phút Tiếng Anh Mỗi Ngày 38 Degree Flowers 3Bs Restaurant and Sports Pub 3Sach Food Gourmet Market 67 Rustic Villa 99 Fitness Quận 2",
 "backup_info": " 3 9+ Heo Con WORK Trường THCS Phú Mỹ Ho Chi Minh City, Vietnam Vung Tau EDUCATION THPT Phú Mỹ University Phú Mỹ High School School year 2001 Middletown High School High School PLACES LIVED Thành phố Hồ Chí Minh, Hồ Chí Minh, Vietnam Current town/city Vung Tau Home town CONTACT INFO /nguyen.hong.7140 Facebook BASIC INFO Female Gender Women Interested in OTHER NAMES Heo con Other RELATIONSHIP Single FAMILY MEMBERS Quang Trương Younger brother Diep Huynh Older sister Thư Kỳ Older sister Phong Nguyên Family member Roderick van Grinsven Family member LIFE EVENTS FRIENDS Phan Tri Tử Đinh Hương Lê Lợi Nguyễn Chí Thanh PHOTOS VIDEOS CHECK-INS Ho Chi Minh City, Vietnam Ho Chi Minh City Visited on 12 April 2021 Candy's Coffee and Food Ho Chi Minh City, Vietnam Visited on 8 March 2021 Ho Chi Minh City, Vietnam Ho Chi Minh City Visited on 24 May 2020 Cánh đồng diều quận 2 Ho Chi Minh City, Vietnam Visited on 30 June 2019 SPORTS Fashion Tira chuyen hang thiet ke MUSIC Thuy Nga - Paris By Night Record label Ca Sĩ Nhí Music video Sony Music Brasil Record label FILMS Mọt Phim Ngôn Tình Trung Quốc Interest TV PROGRAMMES Nhân Duyên Interest Phụ nữ truyền cảm hứng TV Programme PHAN HIẾU Performing arts Mặt Trời Bé Con TV Programme APPS AND GAMES Messi Toys - Đồ chơi giáo dục - An toàn, Chất lượng Chill kids - Sài Gòn Speedy Bike FunnyLand.vn tiNiToy Hay Day LIKES 30 Phút Tiếng Anh Mỗi Ngày 38 Degree Flowers 3Bs Restaurant and Sports Pub 3Sach Food Gourmet Market 67 Rustic Villa 99 Fitness Quận 2 REVIEWS GIVEN 心粥馆 @ Panda Hotel Hong Kong 2 stars LAGarden Restaurant 5 stars Golden Central Hotel, Saigon",
 "contents": "null"
}