{
 "UID": "100001819212022",
 "name": "Hiệp Nguyễn",
 "education": " Đại Học Kỹ Thuật Công Nghiệp Thái Nguyên University School year 2006 Thai Nguyen University of Technology University ptth gia vien c High School",
 "work": " Bảo Trì Điện Máy Ninh Bình",
 "placelive": " Ninh Bình Current town/city Ninh Bình Home town",
 "contact_info": " /hiep.nguyen.161009 Facebook",
 "basic_info": " Male Gender",
 "relationship": " Married",
 "bio": "null",
 "checkin": " Đại Học Kỹ Thuật Công Nghiệp Thái Nguyên - TNUT Thái Nguyên Visited on 13 October 2020 Bảo Trì Điện Máy Ninh Bình Ninh Bình Visited on 3 January 2020 Ninh Bình Ninh Bình Province Visited on 12 November 2019 Bảo Trì Điện Máy Ninh Bình Ninh Bình Visited on 9 November 2019",
 "sport": "SPORTS Manchester United",
 "music": " Thế Giới Xe Hơi Vehicle consultant",
 "films": " 5 Centimet trên giây Film ConanVN-Fansub Community Tổng kho sỉ lẻ đồ gia dụng tiện ích Local business khi nhung ba noi tro hanh dong Film",
 "television": " Ai Là Triệu Phú Local business Hội Quán Cười Community Hội những người đỡ không nổi những người khó đỡ Arts and entertainment",
 "books": " Bloom Books - Cảm hứng sống Book Vì cuộc đời là những chuyến đi - Tôi đi du học Book Hội những người thích đọc \"Thám tử lừng danh Conan\" Book series ಌღ Truyện ღಌ Interest",
 "app": " Wartune at R2Games.com",
 "likes": " 12E Ai Là Triệu Phú Anten HDG BomKids-Chuyên đồ Qc trẻ em Bảo Trì Điện Máy Ninh Bình Chuyên Phụ Kiện Nội Địa Nhật",
 "backup_info": " 4 5 9+ 45 Hiệp Nguyễn EDUCATION Đại Học Kỹ Thuật Công Nghiệp Thái Nguyên University School year 2006 Thai Nguyen University of Technology University ptth gia vien c High School WORK Bảo Trì Điện Máy Ninh Bình PLACES LIVED Ninh Bình Current town/city Ninh Bình Home town CONTACT INFO /hiep.nguyen.161009 Facebook BASIC INFO Male Gender RELATIONSHIP Married LIFE EVENTS FRIENDS Nguyen Gold Nguyễn Hữu Hoành Cường Đỗ Hùng Nguyễn Huỳnh Minh Thuận PHOTOS VIDEOS CHECK-INS Đại Học Kỹ Thuật Công Nghiệp Thái Nguyên - TNUT Thái Nguyên Visited on 13 October 2020 Bảo Trì Điện Máy Ninh Bình Ninh Bình Visited on 3 January 2020 Ninh Bình Ninh Bình Province Visited on 12 November 2019 Bảo Trì Điện Máy Ninh Bình Ninh Bình Visited on 9 November 2019 MUSIC Thế Giới Xe Hơi Vehicle consultant TV PROGRAMMES Ai Là Triệu Phú Local business Hội Quán Cười Community Hội những người đỡ không nổi những người khó đỡ Arts and entertainment LIKES 12E Ai Là Triệu Phú Anten HDG BomKids-Chuyên đồ Qc trẻ em Bảo Trì Điện Máy Ninh Bình Chuyên Phụ Kiện Nội Địa Nhật",
 "contents": "null"
}