{
 "UID": "1619117085",
 "name": "Hoàng Quân",
 "education": " Huflit University Nhạc Viện TPHCM University",
 "work": " ProductionQ - Creative House Managing Director 8 July 2018 - Present Ho Chi Minh City, Vietnam ProductionQ is a network of creatives, producers, directors. We exists to tell visual stories via crafted films. We are a creative house.  We want to be the leader in TVC/Video ad production in... Pencil Group - never run out of ink Chief Operation Officer 22 February 2018 - Present Ho Chi Minh City, Vietnam Pencil Group - never run out of ink Deputy Managing Director July 2015 - January 2018 Ho Chi Minh City, Vietnam OgilvyOne Vietnam Senior Copywriter May 2010 - March 2013 Ho Chi Minh City, Vietnam OgilvyOne Vietnam Senior Content Manager May 2010 - July 2014 Ho Chi Minh City, Vietnam Manzana Fashion Shop Owner March 2008 to December 2008 Thời trang nhập khẩu cao cấp và sang trọng! Sài Gòn Xinh Spa Owner January 2007 to February 2008 Không gian thư giãn và phong cách đậm nét Sài Gòn giữa lòng Hà Nội Miss Universe Vietnam 2015 Creative director Ho Chi Minh City, Vietnam",
 "placelive": " Ho Chi Minh City, Vietnam Current town/city Ho Chi Minh City, Vietnam Home town",
 "contact_info": " /hoangquan.ibox Facebook",
 "basic_info": " 1982 Year of birth Male Gender Men and women Interested in English language Languages",
 "relationship": " Single",
 "bio": "ABOUT HOÀNG Somehow, someday, somewhere....  Attractive, Sentiment, Optimist, Enthusiasm, Ambition....",
 "checkin": " DZS Media Ho Chi Minh City, Vietnam Visited on 5 April 2022 Nha Trang Khánh Hòa Province Visited on 26 March 2022 Bản Tả Phìn - Sapa Lào Cai Visited on 25 March 2022 Sapa Jade Hill Resort & Spa Sa Pa Visited on 24 March 2022",
 "sport": "SPORTS WheyStore Channel",
 "music": " Châu Thâm Vietnam Fanpage- 周深_卡布越南粉丝 Musician/Band Hãng Đĩa Thời Đại Record label The First Draft Music chart Màu Nước Band Performing arts",
 "films": " Thiên Linh Cái Movie Film Ruby Media Film Kênh Phim tổng hợp Thế giới Interest Hậu cung Như Ý truyện 后宫如懿传 Interest",
 "television": " How to Get Away With Murder TV Programme Vợ Chồng Son Publisher Gác Nhỏ, The Nook Acoustic TV Programme Come Out Arts and entertainment",
 "books": " Tạp chí Thể Thao Văn Hóa & Đàn Ông Book Andy the Bard Book Mạc Ngôn Book Kanehara Hitomi Author",
 "app": " Angry Birds Flight Control Plants vs. Zombies",
 "likes": " 1990 Agency 1990 Movie 27 Station 52/3 Kitchen & Bar 5S Consulting & Media 7-Eleven Vietnam",
 "backup_info": " 3 9+ Hoàng Quân WORK ProductionQ - Creative House Managing Director 8 July 2018 - Present Ho Chi Minh City, Vietnam ProductionQ is a network of creatives, producers, directors. We exists to tell visual stories via crafted films. We are a creative house.  We want to be the leader in TVC/Video ad production in... Pencil Group - never run out of ink Chief Operation Officer 22 February 2018 - Present Ho Chi Minh City, Vietnam Pencil Group - never run out of ink Deputy Managing Director July 2015 - January 2018 Ho Chi Minh City, Vietnam OgilvyOne Vietnam Senior Copywriter May 2010 - March 2013 Ho Chi Minh City, Vietnam OgilvyOne Vietnam Senior Content Manager May 2010 - July 2014 Ho Chi Minh City, Vietnam Manzana Fashion Shop Owner March 2008 to December 2008 Thời trang nhập khẩu cao cấp và sang trọng! Sài Gòn Xinh Spa Owner January 2007 to February 2008 Không gian thư giãn và phong cách đậm nét Sài Gòn giữa lòng Hà Nội Miss Universe Vietnam 2015 Creative director Ho Chi Minh City, Vietnam EDUCATION Huflit University Nhạc Viện TPHCM University PLACES LIVED Ho Chi Minh City, Vietnam Current town/city Ho Chi Minh City, Vietnam Home town CONTACT INFO /hoangquan.ibox Facebook BASIC INFO 1982 Year of birth Male Gender Men and women Interested in English language Languages OTHER NAMES Nhạc Trưởng Nội Dung Nickname RELATIONSHIP Single FAMILY MEMBERS Nguyen Diep Tililac Family member ABOUT HOÀNG Somehow, someday, somewhere....  Attractive, Sentiment, Optimist, Enthusiasm, Ambition.... LIFE EVENTS FAVOURITE QUOTES Love means nerver having to say you're sorry! FRIENDS Trần Hữu Tấn Thành Phạm Ngô Thạch Thảo Tuyết Nhung PHOTOS VIDEOS CHECK-INS DZS Media Ho Chi Minh City, Vietnam Visited on 5 April 2022 Nha Trang Khánh Hòa Province Visited on 26 March 2022 Bản Tả Phìn - Sapa Lào Cai Visited on 25 March 2022 Sapa Jade Hill Resort & Spa Sa Pa Visited on 24 March 2022 SPORTS WheyStore Channel MUSIC Châu Thâm Vietnam Fanpage- 周深_卡布越南粉丝 Musician/Band Hãng Đĩa Thời Đại Record label The First Draft Music chart Màu Nước Band Performing arts FILMS Thiên Linh Cái Movie Film Ruby Media Film Kênh Phim tổng hợp Thế giới Interest Hậu cung Như Ý truyện 后宫如懿传 Interest TV PROGRAMMES How to Get Away With Murder TV Programme Vợ Chồng Son Publisher Gác Nhỏ, The Nook Acoustic TV Programme Come Out Arts and entertainment BOOKS Tạp chí Thể Thao Văn Hóa & Đàn Ông Book Andy the Bard Book Mạc Ngôn Book Kanehara Hitomi Author APPS AND GAMES Angry Birds Flight Control Plants vs. Zombies LIKES 1990 Agency 1990 Movie 27 Station 52/3 Kitchen & Bar 5S Consulting & Media 7-Eleven Vietnam REVIEWS GIVEN Tree House Resort Ninh Binh 5 stars An extraodinary experience there! Great views and very useful staffs!",
 "contents": "null"
}