{
 "UID": "100000281950157",
 "name": "Huy Quang",
 "education": " Hoc Vien TCKT University",
 "work": " Azul Systems",
 "placelive": "null",
 "contact_info": " /huy.quang.1042 Facebook",
 "basic_info": " Male Gender",
 "relationship": "null",
 "bio": "null",
 "checkin": " Thảo Viên - Botanic Garden Hanoi, Vietnam Visited on 1 November 2020 Tamarind Hotel Danang Da Nang, Vietnam Visited on 8 July 2020 Tha Bo Nong Khai, Thailand Visited on 13 June 2020 Trống Đồng Cảnh Hồ 173 Trường Chinh Hanoi, Vietnam Visited on 1 March 2020",
 "sport": "SPORTS Nguyễn Tiến Minh",
 "music": " Thuy Nga - Paris By Night Record label SECC Events - Saigon Exhibition and Convention Center Performance and event venue Mỹ Linh Artist Uyên Linh Music",
 "films": " Phim Hay Film",
 "television": " Hài Vỡ Bụng Arts and entertainment",
 "books": " FamilyBooks - Tủ Sách Gia Đình Interest Sách bất động sản - Sách của môi giới Việt Book Tacabooks - Sách hay về quản trị doanh nghiệp Book shop",
 "app": " Evony - The King's Return Gunny",
 "likes": " 24hplus.info 360 Game 5 Gum 7day Kids - Quần áo trẻ em xuất dư A Vui AIVI",
 "backup_info": " 4 5 9+ 45 Huy Quang EDUCATION Hoc Vien TCKT University WORK Azul Systems CONTACT INFO /huy.quang.1042 Facebook BASIC INFO Male Gender LIFE EVENTS PHOTOS VIDEOS CHECK-INS Thảo Viên - Botanic Garden Hanoi, Vietnam Visited on 1 November 2020 Tamarind Hotel Danang Da Nang, Vietnam Visited on 8 July 2020 Tha Bo Nong Khai, Thailand Visited on 13 June 2020 Trống Đồng Cảnh Hồ 173 Trường Chinh Hanoi, Vietnam Visited on 1 March 2020 SPORTS Nguyễn Tiến Minh FILMS Phim Hay Film TV PROGRAMMES Hài Vỡ Bụng Arts and entertainment APPS AND GAMES Evony - The King's Return Gunny LIKES 24hplus.info 360 Game 5 Gum 7day Kids - Quần áo trẻ em xuất dư A Vui AIVI REVIEWS GIVEN Lẩu Nấm Gia Khánh 5 stars Chuyên đóng mới xe chuyên dụng BNI PRO Chapter 5 stars Chuyên đóng mới xe chuyên dụng",
 "contents": "null"
}