{
 "UID": "100004679922355",
 "name": "Huyen Vuong",
 "education": " Trường THPT chuyên Nguyễn Trãi Hải Dương High School",
 "work": " Hanoi, Vietnam",
 "placelive": " Hanoi, Vietnam Current town/city Hải Dương Home town",
 "contact_info": " /huyen.vgt1974 Facebook",
 "basic_info": " Female Gender",
 "relationship": "",
 "bio": "null",
 "checkin": " Language Link Hải Dương Hải Dương Visited on 13 February 2020",
 "sport": "SPORTS Manchester United",
 "music": " Thuy Nga - Paris By Night Record label",
 "films": " Flipped Film",
 "television": " Her Voice Health/Beauty",
 "books": " Credit Default Swaps Book",
 "app": " Lilu Fox",
 "likes": " Amazing Cambridge English Ams' Got Talent Season 13 BC I.BANK Back To School Charitable Organisation BÁCH HOÁ TỔNG HỢP CJC - CNN Japanese Club",
 "backup_info": " 9+ 9 9+ 57 Huyen Vuong EDUCATION Trường THPT chuyên Nguyễn Trãi Hải Dương High School WORK Hanoi, Vietnam PLACES LIVED Hanoi, Vietnam Current town/city Hải Dương Home town CONTACT INFO /huyen.vgt1974 Facebook BASIC INFO Female Gender RELATIONSHIP LIFE EVENTS FRIENDS Đặng Văn Hưng Minh Trần Minh Tran Tuan Lâm Vương PHOTOS CHECK-INS Language Link Hải Dương Hải Dương Visited on 13 February 2020 FILMS Flipped Film BOOKS Credit Default Swaps Book LIKES Amazing Cambridge English Ams' Got Talent Season 13 BC I.BANK Back To School Charitable Organisation BÁCH HOÁ TỔNG HỢP CJC - CNN Japanese Club REVIEWS GIVEN Language Link Hải Dương Chương trình hay, Thương hiệu mạnh, Giáo viên chuẩn, Địa điểm đẹp.",
 "contents": "null"
}