{
 "UID": "100005542276019",
 "name": "Hân Đàm",
 "education": " THPT TRẦN QUỐC TUẤN - PHÚ YÊN High School",
 "work": " Công ty thiết kế xây dựng Louis Ho Chi Minh City, Vietnam Công ty CP đầu tư xây dựng Không Gian Đẹp",
 "placelive": " Ho Chi Minh City, Vietnam Current town/city Ho Chi Minh City, Vietnam Home town",
 "contact_info": " 090 950 38 38 Mobile /hankhonggiandep Facebook",
 "basic_info": " Male Gender",
 "relationship": "null",
 "bio": "null",
 "checkin": " Hồ Xuân Hương - TP Đà Lạt Da Lat Visited on 7 May 2016 Chợ nổi Cái Răng Cần Thơ Binh Minh Visited on 16 April 2016 Cao Đẳng Sư Phạm Đà Lạt Da Lat Visited on 1 February 2016 Công Viên Cá Koi Nhật Bản Ho Chi Minh City, Vietnam Visited on 17 January 2016",
 "sport": "SPORTS Bóng Đá Cười",
 "music": " Nha hang huong que Performance and event venue",
 "films": " Universal Pictures Film/Television studio",
 "television": " Rap Việt - Vie Channel TV Programme",
 "books": " Người Lữ hành Kỳ Dị Book",
 "app": " Smart PK - Auto Võ Lâm 1 mobile Volampc.net",
 "likes": " AGLwindow Abu Shop - Thời trang trẻ em xuất khẩu Adam Khoo Education Amac Khẩu Trang Vải Kháng Khuẩn Ant-Architects ArchLight",
 "backup_info": " 9+ 9 9+ 57 Hân Đàm EDUCATION THPT TRẦN QUỐC TUẤN - PHÚ YÊN High School WORK Công ty thiết kế xây dựng Louis Ho Chi Minh City, Vietnam Công ty CP đầu tư xây dựng Không Gian Đẹp PLACES LIVED Ho Chi Minh City, Vietnam Current town/city Ho Chi Minh City, Vietnam Home town CONTACT INFO 090 950 38 38 Mobile /hankhonggiandep Facebook BASIC INFO Male Gender LIFE EVENTS FRIENDS Hoang Minh Long Thy Nguyen Nguyễn Thanh Hiếu Vinh Vớ Vẩn PHOTOS CHECK-INS Hồ Xuân Hương - TP Đà Lạt Da Lat Visited on 7 May 2016 Chợ nổi Cái Răng Cần Thơ Binh Minh Visited on 16 April 2016 Cao Đẳng Sư Phạm Đà Lạt Da Lat Visited on 1 February 2016 Công Viên Cá Koi Nhật Bản Ho Chi Minh City, Vietnam Visited on 17 January 2016 MUSIC Nha hang huong que Performance and event venue TV PROGRAMMES Rap Việt - Vie Channel TV Programme BOOKS Người Lữ hành Kỳ Dị Book APPS AND GAMES Smart PK - Auto Võ Lâm 1 mobile Volampc.net LIKES AGLwindow Abu Shop - Thời trang trẻ em xuất khẩu Adam Khoo Education Amac Khẩu Trang Vải Kháng Khuẩn Ant-Architects ArchLight REVIEWS GIVEN Công ty thiết kế xây dựng Louis",
 "contents": "null"
}