{
 "UID": "100004630686514",
 "name": "H∆∞∆°ng L√™",
 "education": " ƒê·∫°i H·ªçc M·ªü H√† N·ªôi - HOU University School year 2012 Tr∆∞·ªùng THPT L√™ Xoay High School School year 2003",
 "work": " H√† N·ªôi Ph·ªë",
 "placelive": " Hanoi, Vietnam Current town/city Vƒ©nh Ph√∫c Home town",
 "contact_info": " /lehuongts Facebook",
 "basic_info": " Female Gender",
 "relationship": "null",
 "bio": "null",
 "checkin": " Venus Hotel Tam ƒê·∫£o Hanoi, Vietnam Visited on 24 November 2019 Nh√† H√†ng Tr√¢u T∆∞∆°i Th√∫y H·∫±ng - c∆° s·ªü 10 Linh ƒê√†m Hanoi, Vietnam Visited on 30 June 2019 Nh√† H√†ng Tr√¢u T∆∞∆°i Th√∫y H·∫±ng - c∆° s·ªü 10 Linh ƒê√†m Hanoi, Vietnam Visited on 1 May 2019 Tr√¢u T∆∞∆°i Th√∫y H·∫±ng - C∆° S·ªü 10 Hanoi, Vietnam Visited on 15 December 2018",
 "sport": "SPORTS Manchester United",
 "music": " Thuy Nga - Paris By Night Record label",
 "films": " H·ªçc Vi·ªán S√°ch Book Harry Potter Film",
 "television": " Her Voice Health/Beauty",
 "books": " ƒê·ªÅ Thi H·ªçc K√¨ Education website Th∆∞ Vi·ªán S√°ch Qu√Ω Gooda.vn Book",
 "app": " Lilu Fox",
 "likes": " \u001dG U C H I 08 District 1001 B√≠ k√≠p D·∫°y con tr∆∞·ªüng th√†nh 137 KIDS 137 Kids - 17A H√†ng C√≥t 18carat Authentic - 12 Tr√∫c Kh√™ - H√† N·ªôi",
 "backup_info": " 9+ 9 9+ 57 H∆∞∆°ng L√™ EDUCATION ƒê·∫°i H·ªçc M·ªü H√† N·ªôi - HOU University School year 2012 Tr∆∞·ªùng THPT L√™ Xoay High School School year 2003 WORK H√† N·ªôi Ph·ªë PLACES LIVED Hanoi, Vietnam Current town/city Vƒ©nh Ph√∫c Home town CONTACT INFO /lehuongts Facebook BASIC INFO Female Gender LIFE EVENTS PHOTOS VIDEOS CHECK-INS Venus Hotel Tam ƒê·∫£o Hanoi, Vietnam Visited on 24 November 2019 Nh√† H√†ng Tr√¢u T∆∞∆°i Th√∫y H·∫±ng - c∆° s·ªü 10 Linh ƒê√†m Hanoi, Vietnam Visited on 30 June 2019 Nh√† H√†ng Tr√¢u T∆∞∆°i Th√∫y H·∫±ng - c∆° s·ªü 10 Linh ƒê√†m Hanoi, Vietnam Visited on 1 May 2019 Tr√¢u T∆∞∆°i Th√∫y H·∫±ng - C∆° S·ªü 10 Hanoi, Vietnam Visited on 15 December 2018 MUSIC Thuy Nga - Paris By Night Record label TV PROGRAMMES Her Voice Health/Beauty BOOKS ƒê·ªÅ Thi H·ªçc K√¨ Education website Th∆∞ Vi·ªán S√°ch Qu√Ω Gooda.vn Book APPS AND GAMES Lilu Fox LIKES \u001dG U C H I 08 District 1001 B√≠ k√≠p D·∫°y con tr∆∞·ªüng th√†nh 137 KIDS 137 Kids - 17A H√†ng C√≥t 18carat Authentic - 12 Tr√∫c Kh√™ - H√† N·ªôi REVIEWS GIVEN Bi·ªÉn H·∫£i Ho√† 4 stars Nh√† H√†ng Tr√¢u T∆∞∆°i Th√∫y H·∫±ng - c∆° s·ªü 10 Linh ƒê√†m ƒê·ªì ƒÉn t∆∞∆°i ngon, m√≥n ƒÉn phong ph√∫, ph·ª•c v·ª• nhi·ªát t√¨nhüëçüëçüëç Khu Du L·ªãch TrƒÉm Tr·ª©ng - 100 Egg Theme Park",
 "contents": "null"
}