{
 "UID": "100003217237002",
 "name": "Hải Võ",
 "education": " Dai hoc lao dong xa hoi co so 2 University Trường THPT Lý Thường Kiệt High School",
 "work": " Trường THPT Lý Thường Kiệt",
 "placelive": " Ho Chi Minh City, Vietnam Current town/city Lazi Home town",
 "contact_info": " /hai.vo.758 Facebook",
 "basic_info": " Male Gender",
 "relationship": "null",
 "bio": "null",
 "checkin": " Chùa Hải Hội Mân Quang Da Nang, Vietnam Visited on 3 February 2022 Trạm Thu Phí - IC8 Phù Ninh Phú Thọ Phù Ninh Visited on 15 June 2021 Trạm Thu Phí - IC8 Phù Ninh Phú Thọ Phù Ninh Visited on 14 January 2021 Khách sạn 5 sao Tân Sơn Nhất Ho Chi Minh City, Vietnam Visited on 8 January 2021",
 "sport": "SPORTS Bích Câu PL Manchester United FC Barcelona",
 "music": " Happy Birthday Happy Birthday",
 "films": " Top Phim Hay Film Breaking Dawn Film James Bond 007 Film HBO TV network",
 "television": " Cung Xem TV network Mua Nhà ở Nhật - Tobama 不動産 Estate agents Thời sự VTV Media/news company Ơn Giời Cậu Đây Rồi Arts and entertainment",
 "books": " Asbooks Arts and entertainment",
 "app": " SHOP TUYETMI.COM Khu Vườn Trên Mây IGOSU.vn Dzogame - Yulgang Hiệp Khách",
 "likes": " AeonEshop Ahn Cosmetics - Mỹ Phẩm Hàn Quốc Nhật Bản Amazing Đà Lạt An's Paris Asbooks AuditBoy",
 "backup_info": " 9+ 80 Hải Võ EDUCATION Dai hoc lao dong xa hoi co so 2 University Trường THPT Lý Thường Kiệt High School WORK Trường THPT Lý Thường Kiệt PLACES LIVED Ho Chi Minh City, Vietnam Current town/city Lazi Home town CONTACT INFO /hai.vo.758 Facebook BASIC INFO Male Gender FAMILY MEMBERS Nhi Hoàng Sister LIFE EVENTS PHOTOS VIDEOS BOOKS Asbooks Arts and entertainment APPS AND GAMES SHOP TUYETMI.COM Khu Vườn Trên Mây IGOSU.vn Dzogame - Yulgang Hiệp Khách LIKES AeonEshop Ahn Cosmetics - Mỹ Phẩm Hàn Quốc Nhật Bản Amazing Đà Lạt An's Paris Asbooks AuditBoy REVIEWS GIVEN Ri's Store - Chuyên Hàng Úc Đã từng mua sp này cho phụ huynh. Vì không tin tưởng nguồn gốc sản phẩm ở Việt Nam và chị là hàng xóm lúc ở Việt Nam nên đã nhờ chủ shop mua và chuyển về Việt Nam. Chủ shop rất nhiệt tình và luôn tin tưởng về nguồn gốc cũng như chất lượng sản phẩm.",
 "contents": "null"
}