{
 "UID": "100000101084684",
 "name": "JamPa Tuấn Anh Ng",
 "education": " Edith Cowan University (ECU) Marketing industrial Viet Duc High School High School School year 2000 THCS Trưng Vương Hà Nội High School THPT Việt Đức - Viet Duc High School High School",
 "work": "null",
 "placelive": " ShangriLa Home town",
 "contact_info": " /Jampa179 Facebook",
 "basic_info": " Male Gender",
 "relationship": "null",
 "bio": "null",
 "checkin": "null",
 "sport": "null",
 "music": "null",
 "films": "null",
 "television": "null",
 "books": "null",
 "app": "null",
 "likes": "null",
 "backup_info": " 1 5 9+ 32 JamPa Tuấn Anh Ng EDUCATION Edith Cowan University (ECU) Marketing industrial Viet Duc High School High School School year 2000 THCS Trưng Vương Hà Nội High School THPT Việt Đức - Viet Duc High School High School PLACES LIVED ShangriLa Home town CONTACT INFO /Jampa179 Facebook BASIC INFO Male Gender OTHER NAMES Jampa Other LIFE EVENTS PHOTOS VIDEOS CHECK-INS The Pearl Hoi An Dai An, Quang Nam-Da Nang, Vietnam Visited on 8 August 2019 Citadines Pearl Hoi An Dai An, Quang Nam-Da Nang, Vietnam Visited on 8 August 2019 Hãng Hàng Không Bamboo Airways Hanoi, Vietnam Visited on 2 September 2018 Son Doong Adventure Đồng Hới Visited on 14 May 2018 MUSIC Dusted Recordings Record label Radio Gaza FM 100.9 Radio station Trance music Just for fun I Am Hardwell Vietnam Concert tour FILMS The Good Father Film Infernal Affairs III Film Pirates of the Caribbean Film The Buddha Interest LIKES 100 Million Ami Dewa Recitation Retreat 1900 1990 hotel 28boutique- 17A Trần Phú, HN 2B CLOSET 30 Phút Tiếng Anh Mỗi Ngày REVIEWS GIVEN Dự Án Hinode City 201 Minh Khai 5 stars Solukhumbu 5 stars Potala Palace 5 stars Trường Mẫu Giáo Mầm Non B 5 stars"
}