{
 "UID": "1622568854",
 "name": "Kevin Nguyen",
 "education": " Luật sư tại Học viện Tư pháp 베트남 사법연수원에서 변호사업 공부했습니다 Luật sư 변호사업 Hanoi National University 한국 언어와 문화학과 Korean Language and Culture Hanoi Law University/하노이법대학교에 졸업했습니다 High School",
 "work": " Công ty TNHH Hoàng Vinh Thiên Uy Founder, Director, CEO 18 February 2022 - Present Chi hội Luật gia - Đoàn Luật sư Thành phố Hà Nội. 2021 - Present Văn phòng luật sư 365 법무법인 365 6 June 2020 - Present JP LAW FIRM IN HANOI Công ty Luật TNHH JP Law Firm tại Hà Nội 30 December 2010 to present Hanoi, Vietnam RDL 한국 부동산 개발사 Hãng Hàng Không Hàn Quốc - Korean Air - 대한항공 2005 - Present Samsung Engineering Co Ltd",
 "placelive": " Hanoi, Vietnam Current town/city",
 "contact_info": " 098 469 66 79 Mobile /hoi.nguyenvan.1238 Facebook",
 "basic_info": " 30 June 1979 Date of birth Male Gender 한국어 Languages",
 "relationship": "null",
 "bio": "null",
 "checkin": " Đoàn Luật Sư Hà Nội Hanoi, Vietnam Visited on 30 June 2021 Hanoi, Vietnam Vietnam Visited on 26 June 2021 Khu Sinh Thái Hoàng Vân Nam Định, Nam Định, Vietnam Visited on 25 June 2018 Công ty thiết kế web tại Nam Định Nam Định, Nam Định, Vietnam Visited on 19 April 2018",
 "sport": "SPORTS Liverpool FC Socceroos Khu Sinh Thái Hoàng Vân TYOGA Dynamic GYM CLB Storm Gym B&H",
 "music": " Pérolas do Flashback Music video",
 "films": " HTV Films Film Cây Táo Nở Hoa - Vie Channel Film Mê Phim Hay Public figure Phim Rạp Entertainment website",
 "television": " Vietnam's Next Top Model TV Programme",
 "books": " Sống Khác - Skybooks Book",
 "app": " Tiếu Ngạo Độc Tôn - VGP Thượng Dương Phú Mobile Độc Cô Cửu Kiếm - CMN The Lord Đại Lãnh Chủ",
 "likes": " 1990 Agency 1990 Movie 27 Station 52/3 Kitchen & Bar 5S Consulting & Media 7-Eleven Vietnam",
 "backup_info": " 3 9+ Kevin Nguyen WORK Công ty TNHH Hoàng Vinh Thiên Uy Founder, Director, CEO 18 February 2022 - Present Chi hội Luật gia - Đoàn Luật sư Thành phố Hà Nội. 2021 - Present Văn phòng luật sư 365 법무법인 365 6 June 2020 - Present JP LAW FIRM IN HANOI Công ty Luật TNHH JP Law Firm tại Hà Nội 30 December 2010 to present Hanoi, Vietnam RDL 한국 부동산 개발사 Hãng Hàng Không Hàn Quốc - Korean Air - 대한항공 2005 - Present Samsung Engineering Co Ltd EDUCATION Luật sư tại Học viện Tư pháp 베트남 사법연수원에서 변호사업 공부했습니다 Luật sư 변호사업 Hanoi National University 한국 언어와 문화학과 Korean Language and Culture Hanoi Law University/하노이법대학교에 졸업했습니다 High School PLACES LIVED Hanoi, Vietnam Current town/city CONTACT INFO 098 469 66 79 Mobile /hoi.nguyenvan.1238 Facebook BASIC INFO 30 June 1979 Date of birth Male Gender 한국어 Languages LIFE EVENTS 2021 Started new job at Chi hội Luật gia - Đoàn Luật sư Thành phố Hà Nội. PHOTOS VIDEOS CHECK-INS Đoàn Luật Sư Hà Nội Hanoi, Vietnam Visited on 30 June 2021 Hanoi, Vietnam Vietnam Visited on 26 June 2021 Khu Sinh Thái Hoàng Vân Nam Định, Nam Định, Vietnam Visited on 25 June 2018 Công ty thiết kế web tại Nam Định Nam Định, Nam Định, Vietnam Visited on 19 April 2018 SPORTS Liverpool FC Socceroos Khu Sinh Thái Hoàng Vân TYOGA Dynamic GYM CLB Storm Gym B&H MUSIC Pérolas do Flashback Music video FILMS HTV Films Film Cây Táo Nở Hoa - Vie Channel Film Mê Phim Hay Public figure Phim Rạp Entertainment website TV PROGRAMMES Vietnam's Next Top Model TV Programme BOOKS Sống Khác - Skybooks Book APPS AND GAMES Tiếu Ngạo Độc Tôn - VGP Thượng Dương Phú Mobile Độc Cô Cửu Kiếm - CMN The Lord Đại Lãnh Chủ",
 "contents": "null"
}