{
 "UID": "100011697550747",
 "name": "Kim Amax",
 "education": " THPT BUÔN HỒ High School",
 "work": " Amax Việt Nam Hanoi, Vietnam",
 "placelive": " Hanoi, Vietnam Current town/city Ban Krong Buk, Đắc Lắk, Vietnam Home town",
 "contact_info": " /kimamaxtools Facebook",
 "basic_info": " Male Gender",
 "relationship": "null",
 "bio": "null",
 "checkin": " Phố 3 Phường Quảng Hưng Thành Phố Thanh Hóa Thanh Hóa Visited on 26 March 2019 BẢO TÍN MINH CHÂU Visited on 17 February 2019 Phố 3 Phường Quảng Hưng Thành Phố Thanh Hóa Thanh Hóa Visited on 25 July 2018 Khu Du Lịch Sinh Thái Đảo Nghi Sơn Tinh Gia Visited on 30 March 2018",
 "sport": "SPORTS Điện máy quang sáng",
 "music": " Nhạc Chờ Doanh Nghiệp - Ziness Media Media",
 "films": " Yêu Plus TV Film",
 "television": " TIN ĐẤT NỀN GIÁ RẺ 24h Estate agents",
 "books": " Thiết Bị Nha Khoa Việt Đăng Tools/equipment Thư Viện Sách Cổ Người Xưa Book",
 "app": " Mykingdom",
 "likes": " 3'eshq-عشق 3S Cloud Render Farm A7 Studio / Thiết kế nội thất - kiến trúc AMAX power tools ASECO AUTO.,jsc Adal Home - Tấm lợp phủ đá nhựa đường",
 "backup_info": " 3 5 9+ 32 Kim Amax EDUCATION THPT BUÔN HỒ High School WORK Amax Việt Nam Hanoi, Vietnam PLACES LIVED Hanoi, Vietnam Current town/city Ban Krong Buk, Đắc Lắk, Vietnam Home town CONTACT INFO /kimamaxtools Facebook BASIC INFO Male Gender LIFE EVENTS FRIENDS JingLin Pong Đỗ Minh Ngọc Thanh Hồ Nguyễn Thanh PHOTOS VIDEOS CHECK-INS Phố 3 Phường Quảng Hưng Thành Phố Thanh Hóa Thanh Hóa Visited on 26 March 2019 BẢO TÍN MINH CHÂU Visited on 17 February 2019 Phố 3 Phường Quảng Hưng Thành Phố Thanh Hóa Thanh Hóa Visited on 25 July 2018 Khu Du Lịch Sinh Thái Đảo Nghi Sơn Tinh Gia Visited on 30 March 2018 SPORTS Điện máy quang sáng MUSIC Nhạc Chờ Doanh Nghiệp - Ziness Media Media TV PROGRAMMES TIN ĐẤT NỀN GIÁ RẺ 24h Estate agents LIKES 3'eshq-عشق 3S Cloud Render Farm A7 Studio / Thiết kế nội thất - kiến trúc AMAX power tools ASECO AUTO.,jsc Adal Home - Tấm lợp phủ đá nhựa đường",
 "contents": "null"
}