{
 "UID": "100001871386701",
 "name": "Kiều Loan",
 "education": " Vietnam National University of Agriculture University School year 2008 Trường THPT Chu Văn An High School School year 2005",
 "work": " Bắc Ninh",
 "placelive": " Bắc Ninh Current town/city Yên Bái Home town",
 "contact_info": " /kieuloan.dao Facebook",
 "basic_info": " Female Gender Men Interested in",
 "relationship": " Single",
 "bio": "null",
 "checkin": " Suối Khoáng Kim Bôi - Hòa Bình Kim Bôi Visited on 1 May 2020 Vincom Plaza Việt Trì - Phú Thọ Viet Tri Visited on 2 January 2020 Mường Thanh Luxury Bắc Ninh Bắc Ninh Visited on 29 December 2019 66 Ngô Gia Tự, Suối Hoa, Tp Bắc Ninh Bắc Ninh Visited on 26 December 2019",
 "sport": "SPORTS Thư Giãn Mỗi Ngày",
 "music": " Tiểu Hà Mễ - 小虾米 Interest Ghiền Nhạc US-UK Music chart Cười Mỗi Ngay Radio station Arif Khan Musician/Band",
 "films": " Now We Review Movie Film genre",
 "television": " BẮC NINH TOÀN CẢNH TV Programme Clip Hot Trên Mạng TV channel TỪ SƠN 360 Interest Hội những người đỡ không nổi những người khó đỡ Arts and entertainment",
 "books": " Bloom Books - Cảm hứng sống Book Vì cuộc đời là những chuyến đi - Tôi đi du học Book Hội những người thích đọc \"Thám tử lừng danh Conan\" Book series ಌღ Truyện ღಌ Interest",
 "app": " Wartune at R2Games.com",
 "likes": " 23.uhera 23.uhera 4bikers.vn Đồ Bảo Hộ - Phụ Kiện cho Bikers 92 WEAR A LAND A.O.Smith Việt Nam",
 "backup_info": " 4 5 9+ 45 Kiều Loan EDUCATION Vietnam National University of Agriculture University School year 2008 Trường THPT Chu Văn An High School School year 2005 WORK Bắc Ninh PLACES LIVED Bắc Ninh Current town/city Yên Bái Home town CONTACT INFO /kieuloan.dao Facebook BASIC INFO Female Gender Men Interested in OTHER NAMES Nai Zừ Other RELATIONSHIP Single FAMILY MEMBERS Phi Long Younger brother Hoai Thu Dang Sister-in-law Ngọc Sơn Trần Brother-in-law LIFE EVENTS FAVOURITE QUOTES http://vietthao.vn/ FRIENDS Ký Ức Của Mưa Hung Phi Thùy Thùy Nguyễn Văn Dũng PHOTOS VIDEOS CHECK-INS Suối Khoáng Kim Bôi - Hòa Bình Kim Bôi Visited on 1 May 2020 Vincom Plaza Việt Trì - Phú Thọ Viet Tri Visited on 2 January 2020 Mường Thanh Luxury Bắc Ninh Bắc Ninh Visited on 29 December 2019 66 Ngô Gia Tự, Suối Hoa, Tp Bắc Ninh Bắc Ninh Visited on 26 December 2019 SPORTS Thư Giãn Mỗi Ngày MUSIC Tiểu Hà Mễ - 小虾米 Interest Ghiền Nhạc US-UK Music chart Cười Mỗi Ngay Radio station Arif Khan Musician/Band FILMS Now We Review Movie Film genre TV PROGRAMMES BẮC NINH TOÀN CẢNH TV Programme Clip Hot Trên Mạng TV channel TỪ SƠN 360 Interest Hội những người đỡ không nổi những người khó đỡ Arts and entertainment LIKES 23.uhera 23.uhera 4bikers.vn Đồ Bảo Hộ - Phụ Kiện cho Bikers 92 WEAR A LAND A.O.Smith Việt Nam REVIEWS GIVEN Kiều Vịt 5 stars Có cúp ngực nhung đỏ ko b ơi? Nine-clothes 5 stars Biệt Thự Ông Bà Hùng Tuyết 5 stars <3 CTN Design Bắc Ninh Design cho ngôi nhà hạnh phúc.......... liên hệ ck e nhé",
 "contents": "null"
}