{
 "UID": "100006127954663",
 "name": "Lai Van Duong",
 "education": " bien hoa High School",
 "work": " Hanoi, Vietnam",
 "placelive": " Hanoi, Vietnam Current town/city Hanoi, Vietnam Home town",
 "contact_info": " /laivan.duong.37 Facebook",
 "basic_info": " Male Gender",
 "relationship": " Married since 19 January 2005",
 "bio": "null",
 "checkin": " Khuôn Cửa,Cầu Thang,Nội Thất Thành Phố Phủ Lý-Hà Nam Phu Ly Visited on 10 February 2018 Mirai Sushi & Sake N04 Hoàng Đạo Thúy Hanoi, Vietnam Visited on 19 October 2017 Trung Hòa Nhân Chính,HN Hanoi, Vietnam Visited on 9 November 2013 34T Hanoi, Vietnam Visited on 6 August 2013",
 "sport": "SPORTS Câu Lạc Bộ Bóng Đá Đồng Tháp",
 "music": " La La Life Musician/Band Văn Thơ Âm Nhạc Media/news company",
 "films": " Universal Pictures Film/Television studio",
 "television": " OLN.tv TV network The Fox TV network The Voice TV Programme Kỹ Năng Sống TV Programme",
 "books": " Người Lữ hành Kỳ Dị Book",
 "app": " Làng Danh Vọng Liên Quân Mini World",
 "likes": " 1001 Bí kíp Dạy con trưởng thành 6,700 người vì 6,700 cây xanh ACT CO.JSC AKA Online Store AOTA atelier APPLE 428",
 "backup_info": " 9+ 80 Lai Van Duong EDUCATION bien hoa High School WORK Hanoi, Vietnam PLACES LIVED Hanoi, Vietnam Current town/city Hanoi, Vietnam Home town CONTACT INFO /laivan.duong.37 Facebook BASIC INFO Male Gender RELATIONSHIP Married since 19 January 2005 FAMILY MEMBERS Hong Quyen Pham Thi Family member LIFE EVENTS FRIENDS Nam Anh Cảnh Kim Thanh Phú Lê Gia Quế Anh UwU Lại PHOTOS VIDEOS CHECK-INS Khuôn Cửa,Cầu Thang,Nội Thất Thành Phố Phủ Lý-Hà Nam Phu Ly Visited on 10 February 2018 Mirai Sushi & Sake N04 Hoàng Đạo Thúy Hanoi, Vietnam Visited on 19 October 2017 Trung Hòa Nhân Chính,HN Hanoi, Vietnam Visited on 9 November 2013 34T Hanoi, Vietnam Visited on 6 August 2013 MUSIC La La Life Musician/Band Văn Thơ Âm Nhạc Media/news company TV PROGRAMMES OLN.tv TV network The Fox TV network The Voice TV Programme Kỹ Năng Sống TV Programme LIKES 1001 Bí kíp Dạy con trưởng thành 6,700 người vì 6,700 cây xanh ACT CO.JSC AKA Online Store AOTA atelier APPLE 428 REVIEWS GIVEN Auto Service 👍👍👍👍👍👍👍👍👍👍👍👍👍👍👍👍👍👍👍👍👍👍👍👍👍",
 "contents": "null"
}