{
 "UID": "100000234168500",
 "name": "Lam Tran",
 "education": " The University of Technology University THPT Nghèn High School",
 "work": " Vé Máy Bay Giá Rẻ Rồng Xanh Rong Xanh Booking Office Director (film) Ho Chi Minh City, Vietnam \"Giấc Mơ Bay Trong Tầm Tay\"",
 "placelive": " Ho Chi Minh City, Vietnam Current town/city Hà Tĩnh Home town",
 "contact_info": " /lamtranmb07 Facebook",
 "basic_info": " Male Gender",
 "relationship": " Trang Thư In a relationship See photos of Lam and Trang",
 "bio": "ABOUT LAM \"Change yoursefl,change the world\"",
 "checkin": " Máy Lọc nước Amazon Ho Chi Minh City, Vietnam Visited on 27 February 2022 Máy Lọc nước Amazon Ho Chi Minh City, Vietnam Visited on 21 October 2021 Bến Tàu Rạch Giá-Hòn Sơn Ho Chi Minh City, Vietnam Visited on 13 January 2021 Bến phà Mỹ An Huong Thanh Phu, Bến Tre, Vietnam Visited on 17 July 2020",
 "sport": "SPORTS Becamex Binh Duong FC Chelsea Football Club",
 "music": " Thuy Nga - Paris By Night Record label SECC Events - Saigon Exhibition and Convention Center Performance and event venue Mỹ Linh Artist Uyên Linh Music",
 "films": " Onlyu.info nơi clip thăng hoa Interest Phim Rạp Entertainment website Tào Tháo Film Co Gai Do Long Film",
 "television": " Vietnam Idol TV Programme viet nam idol TV Vietnam Idol Local business",
 "books": " FamilyBooks - Tủ Sách Gia Đình Interest Sách bất động sản - Sách của môi giới Việt Book Tacabooks - Sách hay về quản trị doanh nghiệp Book shop",
 "app": " KOTO",
 "likes": " \" English JoKes \" \" English Quotes \" 10 châm ngôn thú vị 10 sự thật thú vị 123design Store 23/9 Ultimate Frisbee Team",
 "backup_info": " 1 9+ Lam Tran WORK Vé Máy Bay Giá Rẻ Rồng Xanh Rong Xanh Booking Office Director (film) Ho Chi Minh City, Vietnam \"Giấc Mơ Bay Trong Tầm Tay\" EDUCATION The University of Technology University THPT Nghèn High School PLACES LIVED Ho Chi Minh City, Vietnam Current town/city Hà Tĩnh Home town CONTACT INFO /lamtranmb07 Facebook BASIC INFO Male Gender RELATIONSHIP Trang Thư In a relationship See photos of Lam and Trang ABOUT LAM \"Change yoursefl,change the world\" LIFE EVENTS FAVOURITE QUOTES \"Tết đến không tiền vui chi tết Xuân về hết gạo đón chi xuân\" (sưu tầm) PHOTOS VIDEOS CHECK-INS Máy Lọc nước Amazon Ho Chi Minh City, Vietnam Visited on 27 February 2022 Máy Lọc nước Amazon Ho Chi Minh City, Vietnam Visited on 21 October 2021 Bến Tàu Rạch Giá-Hòn Sơn Ho Chi Minh City, Vietnam Visited on 13 January 2021 Bến phà Mỹ An Huong Thanh Phu, Bến Tre, Vietnam Visited on 17 July 2020 SPORTS Becamex Binh Duong FC Chelsea Football Club MUSIC Thuy Nga - Paris By Night Record label SECC Events - Saigon Exhibition and Convention Center Performance and event venue Mỹ Linh Artist Uyên Linh Music FILMS Onlyu.info nơi clip thăng hoa Interest Phim Rạp Entertainment website Tào Tháo Film Co Gai Do Long Film TV PROGRAMMES Vietnam Idol TV Programme viet nam idol TV Vietnam Idol Local business BOOKS FamilyBooks - Tủ Sách Gia Đình Interest Sách bất động sản - Sách của môi giới Việt Book Tacabooks - Sách hay về quản trị doanh nghiệp Book shop APPS AND GAMES KOTO LIKES \" English JoKes \" \" English Quotes \" 10 châm ngôn thú vị 10 sự thật thú vị 123design Store 23/9 Ultimate Frisbee Team REVIEWS GIVEN Thực phẩm sạch giá rẻ Thịt heo rất thơm ngon, giá vat hợp lý, giao hàng uy tín. Do You Like the English Language? 5 stars ttdesign.vn 5 stars Cám ơn TT Design, chất lượng tốt, thiết kế đẹp, đội ngũ chuyên nghiệp. Sẽ hợp tác với TT Design ở các dự án sau! Thanks! Máy Lọc nước Amazon 5 stars Máy lọc nước Amazon, mang lại nguồn nước tinh khiết, an toàn cho mọi gia đình!",
 "contents": "null"
}