{
 "UID": "100004860785074",
 "name": "Lan Anh",
 "education": " MakeUpMe Academy High School THPT CẨM BÌNH High School",
 "work": " Trường THPT Cẩm Bình Học sinh 5 September 2013 - Present Hanoi, Vietnam Make Up",
 "placelive": " Cam Xuyen Current town/city Hà Tĩnh Home town",
 "contact_info": " /lebaominh041117 Facebook",
 "basic_info": " Female Gender",
 "relationship": "null",
 "bio": "null",
 "checkin": " Studio Quốc Đại Hà Tĩnh Visited on 9 March 2017 Studio Quốc Đại Hà Tĩnh Visited on 6 March 2017 Mộc Mộc_ make up & hair Hanoi, Vietnam Visited on 17 November 2016 Mộc Mộc_ make up & hair Hanoi, Vietnam Visited on 16 November 2016",
 "sport": "SPORTS Manchester United",
 "music": " Đặng Thế Chí Music video",
 "films": " Lấy Danh Nghĩa Người Nhà VNFanPage Interest",
 "television": " TIN NÓNG 24H TV Programme Truyền hình FPT Play Sport",
 "books": " Đọc Truyện Online Library",
 "app": " Chắn Online - Thapthanh.com",
 "likes": " 1 9 9 6 19.December 24 STORE - Watch Authentic 2hand siêu rẻ 360 Boutique 38 Degree Flowers",
 "backup_info": " 2 9+ Lan Anh WORK Trường THPT Cẩm Bình Học sinh 5 September 2013 - Present Hanoi, Vietnam Make Up EDUCATION MakeUpMe Academy High School THPT CẨM BÌNH High School PLACES LIVED Cam Xuyen Current town/city Hà Tĩnh Home town CONTACT INFO /lebaominh041117 Facebook BASIC INFO Female Gender OTHER NAMES Mama Lê Bảo Minh Nickname ME Nickname Forever Nickname Mami Bon Other FAMILY MEMBERS Hiền Nguyễn Older sister LIFE EVENTS FAVOURITE QUOTES Làm điều mình thích Và thích điều mình làm PHOTOS VIDEOS CHECK-INS Studio Quốc Đại Hà Tĩnh Visited on 9 March 2017 Studio Quốc Đại Hà Tĩnh Visited on 6 March 2017 Mộc Mộc_ make up & hair Hanoi, Vietnam Visited on 17 November 2016 Mộc Mộc_ make up & hair Hanoi, Vietnam Visited on 16 November 2016 MUSIC Đặng Thế Chí Music video FILMS Lấy Danh Nghĩa Người Nhà VNFanPage Interest TV PROGRAMMES TIN NÓNG 24H TV Programme Truyền hình FPT Play Sport BOOKS Đọc Truyện Online Library APPS AND GAMES Chắn Online - Thapthanh.com LIKES 1 9 9 6 19.December 24 STORE - Watch Authentic 2hand siêu rẻ 360 Boutique 38 Degree Flowers",
 "contents": "null"
}