{
 "UID": "1681796512",
 "name": "Le Nghia",
 "education": "null",
 "work": "null",
 "placelive": "null",
 "contact_info": " /le.d.nghia.7 Facebook",
 "basic_info": " Men Interested in",
 "relationship": "null",
 "bio": "ABOUT LE \"Khi cùng nhau, không có gì là không thể \"",
 "checkin": " Sinh tố 142 Lý Chính Thắng Ho Chi Minh City, Vietnam Visited on 26 February 2018",
 "sport": "SPORTS Arsenal",
 "music": " Rock and Jazz Music",
 "films": " Jiro Dreams of Sushi Film",
 "television": " Shark Tank Việt Nam TV Programme Discovery Channel India TV network CEO - Chìa khóa thành công Just for fun Thời Sự TV",
 "books": " Real Kid Books Book Sống và Khát Vọng Community LifeBook - Cuốn Sách Cuộc Đời Book Mọt sách's confession Book",
 "app": " Garena Liên Quân Mobile",
 "likes": " 100PLUS ABA Journal ABC News ABF Journal AConcept Vietnam AIESEC in Vietnam",
 "backup_info": " 3 9+ Le Nghia CONTACT INFO /le.d.nghia.7 Facebook BASIC INFO Men Interested in ABOUT LE \"Khi cùng nhau, không có gì là không thể \" LIFE EVENTS FAVOURITE QUOTES ...etc PHOTOS CHECK-INS Sinh tố 142 Lý Chính Thắng Ho Chi Minh City, Vietnam Visited on 26 February 2018 SPORTS Arsenal MUSIC Rock and Jazz Music FILMS Jiro Dreams of Sushi Film TV PROGRAMMES Shark Tank Việt Nam TV Programme Discovery Channel India TV network CEO - Chìa khóa thành công Just for fun Thời Sự TV LIKES 100PLUS ABA Journal ABC News ABF Journal AConcept Vietnam AIESEC in Vietnam REVIEWS GIVEN Le Cong Vinh 5 stars Love Unconditionally 5 stars",
 "contents": "null"
}