{
 "UID": "100002759003763",
 "name": "Lee Doanh",
 "education": " Phương Đông Kiến trúc công trình School year 2008",
 "work": " Aura ceiling and Acoustic",
 "placelive": " Hanoi, Vietnam Current town/city Nam Định, Nam Định, Vietnam Home town",
 "contact_info": " /lee.doanh.1 Facebook",
 "basic_info": " Male Gender",
 "relationship": "null",
 "bio": "null",
 "checkin": " Phố Đêm-Phố Cổ Hội An Hội An Visited on 29 June 2017 21 Lê Nổ Da Nang, Vietnam Visited on 22 April 2017 Đê Trần Khát Chân Hanoi, Vietnam Visited on 21 January 2017 Nhà hàng - Thế Giới Bia Chiến Hữu Hanoi, Vietnam Visited on 17 December 2016",
 "sport": "SPORTS Blog Nhà Đẹp",
 "music": " Mật Ong Rừng Hà Đặng Health/Beauty",
 "films": " Review phim hay Film B9 Studio Product/Service Các câu nói hay - ý nghĩa và hài hước trong phim TVB Film God's Not Dead Film",
 "television": " Heirs Vietnam Interest ZTV Vietnam Video creator Vietnam's Next Top Model TV Programme",
 "books": " ღ Quà Tặng Cuộc Sống ಌ Interest",
 "app": " CÔNG TY BẤT ĐỘNG SẢN THIÊN KHÔI Tây Du Ký",
 "likes": " 110 Design 1Second ADAM shop - Thời trang NAM Hà Nội ADEER ALC KIDS - Nội thất BÉ YÊU Achino Shop",
 "backup_info": " 4 5 9+ 45 Lee Doanh EDUCATION Phương Đông Kiến trúc công trình School year 2008 WORK Aura ceiling and Acoustic PLACES LIVED Hanoi, Vietnam Current town/city Nam Định, Nam Định, Vietnam Home town CONTACT INFO /lee.doanh.1 Facebook BASIC INFO Male Gender LIFE EVENTS PHOTOS VIDEOS CHECK-INS Phố Đêm-Phố Cổ Hội An Hội An Visited on 29 June 2017 21 Lê Nổ Da Nang, Vietnam Visited on 22 April 2017 Đê Trần Khát Chân Hanoi, Vietnam Visited on 21 January 2017 Nhà hàng - Thế Giới Bia Chiến Hữu Hanoi, Vietnam Visited on 17 December 2016 SPORTS Blog Nhà Đẹp MUSIC Mật Ong Rừng Hà Đặng Health/Beauty TV PROGRAMMES Heirs Vietnam Interest ZTV Vietnam Video creator Vietnam's Next Top Model TV Programme BOOKS ღ Quà Tặng Cuộc Sống ಌ Interest APPS AND GAMES CÔNG TY BẤT ĐỘNG SẢN THIÊN KHÔI Tây Du Ký LIKES 110 Design 1Second ADAM shop - Thời trang NAM Hà Nội ADEER ALC KIDS - Nội thất BÉ YÊU Achino Shop REVIEWS GIVEN DNA architect studio 5 stars",
 "contents": "null"
}