{
 "UID": "100002539657783",
 "name": "Lyli White",
 "education": " Đại Học Lâm Nghiệp University School year 2011",
 "work": " Công ty cổ phần tập đoàn Austdoor Kinh doanh dự án",
 "placelive": " Hanoi, Vietnam Current town/city",
 "contact_info": " /sakurateo Facebook",
 "basic_info": " Female Gender Men Interested in",
 "relationship": " In an open relationship",
 "bio": "ABOUT LYLI Bạn hãy nhìn vào một nhánh Violet nhé! It's me!",
 "checkin": " Văn Trì Minh Khai Hanoi, Vietnam Visited on 4 February 2017 Văn Trì Minh Khai Hanoi, Vietnam Visited on 4 February 2017 Thung Nai - Hoà Bình Hanoi, Vietnam Visited on 27 April 2015 Cảm Thấy Thật Hạnh Phúc Vietnam Visited on 23 May 2014",
 "sport": "SPORTS Manchester United",
 "music": " Dam Vinh Hung Artist Kpop Style Shoe shop The Men Local business Nothing's Gonna Change My Love for You Song",
 "films": " Nhactoday.net Product/Service Titanic Film",
 "television": " Xem Bóng Đá TV channel Tivi24h.com TV network Cooking Arts and entertainment",
 "books": " The Fountainhead Book",
 "app": " Texas HoldEm Poker",
 "likes": " 12 cung hoàng đạo 68Nhanh.com===>>> ANH NGUYỄN MAKEUP ACADEMY AT Shop AYLA - Học Viện Bellydance hàng đầu VN Ai Rồi Cũng Phải Bán Hàng",
 "backup_info": " 4 5 9+ 45 Lyli White EDUCATION Đại Học Lâm Nghiệp University School year 2011 WORK Công ty cổ phần tập đoàn Austdoor Kinh doanh dự án PLACES LIVED Hanoi, Vietnam Current town/city CONTACT INFO /sakurateo Facebook BASIC INFO Female Gender Men Interested in OTHER NAMES Mộc Other RELATIONSHIP In an open relationship ABOUT LYLI Bạn hãy nhìn vào một nhánh Violet nhé! It's me! LIFE EVENTS FAVOURITE QUOTES Cuộc sống là không bao giờ dừng lại PHOTOS VIDEOS CHECK-INS Văn Trì Minh Khai Hanoi, Vietnam Visited on 4 February 2017 Văn Trì Minh Khai Hanoi, Vietnam Visited on 4 February 2017 Thung Nai - Hoà Bình Hanoi, Vietnam Visited on 27 April 2015 Cảm Thấy Thật Hạnh Phúc Vietnam Visited on 23 May 2014 SPORTS Manchester United MUSIC Dam Vinh Hung Artist Kpop Style Shoe shop The Men Local business Nothing's Gonna Change My Love for You Song FILMS Nhactoday.net Product/Service Titanic Film TV PROGRAMMES Xem Bóng Đá TV channel Tivi24h.com TV network Cooking Arts and entertainment APPS AND GAMES Texas HoldEm Poker LIKES 12 cung hoàng đạo 68Nhanh.com===>>> ANH NGUYỄN MAKEUP ACADEMY AT Shop AYLA - Học Viện Bellydance hàng đầu VN Ai Rồi Cũng Phải Bán Hàng REVIEWS GIVEN Ngọc Hà shop - Chuyên cung cấp các loại xốp dán tường Hàn Quốc Mẫu mã đa dạng, giá cả phải chăng, nhân viên tư vấn nhiệt tình",
 "contents": "null"
}