{
 "UID": "100003302688120",
 "name": "Lê Hà",
 "education": " Bách Khoa- Đại Học Đà Nẵng University THPT Hai Bà Trưng, TP Huế, Thừa Thiên Huế High School",
 "work": " 3V Group Giám đốc Ho Chi Minh City, Vietnam",
 "placelive": " Ho Chi Minh City, Vietnam Current town/city",
 "contact_info": " /Ha3Vgroup Facebook",
 "basic_info": " 7 October Date of birth Male Gender",
 "relationship": "null",
 "bio": "null",
 "checkin": " Sân Bay Phú Bài, Hương Thuỷ, Huế Hue, Vietnam Visited on 27 October 2020",
 "sport": "SPORTS T1 League of Legends / T1 리그오브레전드",
 "music": " Happy Birthday Happy Birthday",
 "films": " Góc Cười Media/news company",
 "television": " ĐÀ NẴNG CUỐI TUẦN TV Programme",
 "books": " Bookademy - Viện Sách News & media website Đọc Truyện Online Interest Tiểu Thuyết Lãng Mạn Book",
 "app": " SKT Faker",
 "likes": " 123Food.vn 3V Group 3vshop.vn 5Q SPORT Amazing An Vu Huy",
 "backup_info": " 9+ 80 Lê Hà EDUCATION Bách Khoa- Đại Học Đà Nẵng University THPT Hai Bà Trưng, TP Huế, Thừa Thiên Huế High School WORK 3V Group Giám đốc Ho Chi Minh City, Vietnam PLACES LIVED Ho Chi Minh City, Vietnam Current town/city CONTACT INFO /Ha3Vgroup Facebook BASIC INFO 7 October Date of birth Male Gender LIFE EVENTS FAVOURITE QUOTES Không gì là không thể, người ta làm được mình cũng làm được, không những làm được mà còn làm tốt hơn PHOTOS VIDEOS CHECK-INS Sân Bay Phú Bài, Hương Thuỷ, Huế Hue, Vietnam Visited on 27 October 2020 SPORTS T1 League of Legends / T1 리그오브레전드 TV PROGRAMMES ĐÀ NẴNG CUỐI TUẦN TV Programme APPS AND GAMES SKT Faker LIKES 123Food.vn 3V Group 3vshop.vn 5Q SPORT Amazing An Vu Huy EVENTS",
 "contents": "null"
}