{
 "UID": "100000425830670",
 "name": "Lê Công Vinh",
 "education": "null",
 "work": "null",
 "placelive": "null",
 "contact_info": " /vinh.le.31 Facebook",
 "basic_info": " Male Gender English language and Japanese language Languages",
 "relationship": "null",
 "bio": "ABOUT VINH sinh vien Bach khoa hanoi",
 "checkin": " 苑裡車站 Miaoli Visited on 22 April 2017 苗栗苑里 Miaoli Visited on 15 October 2016 苗栗苑里 Miaoli Visited on 18 June 2016 苗栗苑里 Miaoli Visited on 1 June 2016",
 "sport": "SPORTS 統一獅官方粉絲團",
 "music": " Zenio Jewellery/Watches Quang Le Music Lê Hiếu Music Nhạc Trịnh Music",
 "films": " Forest Gump Film Áo Lụa Hà Đông Local business Hay đấy Sport and recreation",
 "television": " Nhân Duyên Interest Café Khởi Nghiệp TV Programme Nhịp Sống Ô Tô - Autolife TV Programme 24h VTV News Newspaper",
 "books": " RY Book Sống Thực Tế Giữa Đời Thực Dụng Book Những câu nên ngẫm mỗi ngày Interest Mê Đọc Sách Book shop",
 "app": " AoE",
 "likes": " 1 Phút Thay Đổi Tư Duy Để Thành Công 1C Việt Nam 24h VTV News 3Design Technologies 60giay.com 7 Ngày Công Nghệ",
 "backup_info": " 4 5 9+ 45 Lê Công Vinh CONTACT INFO /vinh.le.31 Facebook BASIC INFO Male Gender English language and Japanese language Languages ABOUT VINH sinh vien Bach khoa hanoi LIFE EVENTS PHOTOS VIDEOS MUSIC Zenio Jewellery/Watches Quang Le Music Lê Hiếu Music Nhạc Trịnh Music FILMS Forest Gump Film Áo Lụa Hà Đông Local business Hay đấy Sport and recreation TV PROGRAMMES Nhân Duyên Interest Café Khởi Nghiệp TV Programme Nhịp Sống Ô Tô - Autolife TV Programme 24h VTV News Newspaper BOOKS RYBOOKS Book Sống Thực Tế Giữa Đời Thực Dụng Book Những câu nên ngẫm mỗi ngày Interest Mê Đọc Sách Book shop APPS AND GAMES AoE LIKES 1 Phút Thay Đổi Tư Duy Để Thành Công 1C Việt Nam 24h VTV News 3Design Technologies 60giay.com 7 Ngày Công Nghệ",
 "contents": "null"
}