{
 "UID": "100001782934987",
 "name": "Lê Thắm",
 "education": " Tuổi trẻ trường Đại học Kinh tế - ĐHQG HN University 2009 - 16 November 2013 Kinh tế Chính trị và Tài chính Ngân Hàng",
 "work": " FWD Vietnam 10 March 2020 - Present Hanoi, Vietnam Mình luôn nghĩ là mình sẽ làm 1 việc gì đấy, có ý nghĩa, một việc thật tâm huyết và thấy vui vẻ. Và cuối cùng mình chọn Bảo hiểm nhân thọ, Xuất phát từ chính nhu cầu của gia đình mình, Từ khi sinh...",
 "placelive": " Hanoi, Vietnam Current town/city",
 "contact_info": " /le.tham.1654 Facebook",
 "basic_info": " Female Gender",
 "relationship": "null",
 "bio": "ABOUT LÊ Những ngày trời nắng đẹp: đi chơi,thăm quan (thường là Bảo tàng Dân tộc học), khám phá cái mới... Những ngày râm mát: đi chơi, thường tự kỉ ở Công viên Hòa Bình, và Công viên Linh Đàm..cũng có thể đến lăng Bác đếm ô cỏ.. Những ngày trời mưa: ở nhà, lướt mạng, đọc báo, xem tình hình bạn bè, kiếm tìm 1 công thức nấu ăn mới, và xí xớn tập làm luôn..(kể cả tất cả các loại bánh, bún, chè...) Những ngày còn lại không thuộc các ngày trên: tùy hứng..:))).. cũng có thể hơi khác người 1 tý như leo lên xe bus, đeo headphone, bật to hết cỡ.. đi đến hết bến ngắm phố xá.. rồi đi chuyến xe ngược về..:(..:))",
 "checkin": " Halong Bay Vietnam - Du Lịch Vịnh Hạ Long Bãi Cháy Visited on 30 May 2020 Hanoi, Vietnam Vietnam Visited on 11 March 2020 Hanoi, Vietnam Vietnam Visited on 10 March 2020 Hoàng Thành Thăng Long - Bắc Môn Hanoi, Vietnam Visited on 12 April 2015",
 "sport": "SPORTS KhonkaenStar vc fanclub - แฟนคลับสโมสรขอนแก่นสตาร์ วีซี Thai Volleyball",
 "music": " Anh Sẽ Đến Trinh Thang Binh",
 "films": " The Longest Ride Film The Notebook Film The Vow Film",
 "television": " HIT THE SPOT 2012 TV Programme Thông tin Kiến thức Tài chính kinh doanh TV Programme STEVE on Watch TV Programme Game of Thrones TV Programme",
 "books": " Sách truyện tiếng Anh cho bé Book Đọc sách hay là chết? Book shop Tiếng Anh Cô Duyên Uông Local service Tường vi đêm đầu tiên Book",
 "app": " Half-Life 2",
 "likes": " 1 Phút Thay Đổi Tư Duy Để Thành Công 1924 Gallery 30 Phút Tiếng Anh Mỗi Ngày Accommodation Saigon Advance English Club AlexD Music Insight",
 "backup_info": " 1 9+ Lê Thắm WORK FWD Vietnam 10 March 2020 - Present Hanoi, Vietnam Mình luôn nghĩ là mình sẽ làm 1 việc gì đấy, có ý nghĩa, một việc thật tâm huyết và thấy vui vẻ. Và cuối cùng mình chọn Bảo hiểm nhân thọ, Xuất phát từ chính nhu cầu của gia đình mình, Từ khi sinh... EDUCATION Tuổi trẻ trường Đại học Kinh tế - ĐHQG HN University 2009 - 16 November 2013 Kinh tế Chính trị và Tài chính Ngân Hàng PLACES LIVED Hanoi, Vietnam Current town/city CONTACT INFO /le.tham.1654 Facebook BASIC INFO Female Gender FAMILY MEMBERS Lê Hằng Sister Vũ Thị Thanh Huyền Niece ABOUT LÊ Những ngày trời nắng đẹp: đi chơi,thăm quan (thường là Bảo tàng Dân tộc học), khám phá cái mới... Những ngày râm mát: đi chơi, thường tự kỉ ở Công viên Hòa Bình, và Công viên Linh Đàm..cũng có thể đến lăng Bác đếm ô cỏ.. Những ngày trời mưa: ở nhà, lướt mạng, đọc báo, xem tình hình bạn bè, kiếm tìm 1 công thức nấu ăn mới, và xí xớn tập làm luôn..(kể cả tất cả các loại bánh, bún, chè...) Những ngày còn lại không thuộc các ngày trên: tùy hứng..:))).. cũng có thể hơi khác người 1 tý như leo lên xe bus, đeo headphone, bật to hết cỡ.. đi đến hết bến ngắm phố xá.. rồi đi chuyến xe ngược về..:(..:)) LIFE EVENTS FAVOURITE QUOTES Accept your past without regrets Handle your present with confidence And face your future without fear PHOTOS VIDEOS CHECK-INS Halong Bay Vietnam - Du Lịch Vịnh Hạ Long Bãi Cháy Visited on 30 May 2020 Hanoi, Vietnam Vietnam Visited on 11 March 2020 Hanoi, Vietnam Vietnam Visited on 10 March 2020 Hoàng Thành Thăng Long - Bắc Môn Hanoi, Vietnam Visited on 12 April 2015 MUSIC Anh Sẽ Đến Trinh Thang Binh FILMS The Longest Ride Film The Notebook Film The Vow Film TV PROGRAMMES HIT THE SPOT 2012 TV Programme Thông tin Kiến thức Tài chính kinh doanh TV Programme STEVE on Watch TV Programme Game of Thrones TV Programme BOOKS Sách truyện tiếng Anh cho bé Book Đọc sách hay là chết? Book shop Tiếng Anh Cô Duyên Uông Local service Tường vi đêm đầu tiên Book LIKES 1 Phút Thay Đổi Tư Duy Để Thành Công 1924 Gallery 30 Phút Tiếng Anh Mỗi Ngày Accommodation Saigon Advance English Club AlexD Music Insight REVIEWS GIVEN Peoplelink Hà Nội 5 stars Cơ Hội Cho Ai - Whose Chance 5 stars Tuyet Voi Ti vi Internet Onlinetv T8",
 "contents": "null"
}