{
 "UID": "100013112043340",
 "name": "Mai Kim Anh",
 "education": " Truong Vinh Ky private high school High School",
 "work": " Cty TNHH xd tm xnk Hoàng Long Osin cao cấp August 2013 - Present Ho Chi Minh City, Vietnam Osin cao cấp TPHCM Osin",
 "placelive": " Ho Chi Minh City, Vietnam Current town/city Ho Chi Minh City, Vietnam Home town",
 "contact_info": " /ka.mai.7370 Facebook",
 "basic_info": " 12 April Date of birth Female Gender",
 "relationship": " Divorced",
 "bio": "ABOUT ANH Gái 2 con",
 "checkin": " Đường Thạnh Xuân 25 P. Thạnh Xuân Quận 12 Thành Phố Hồ Chí Minh Việt Nam Ho Chi Minh City, Vietnam Visited on 27 March 2022 Pathway Tuệ Đức Ho Chi Minh City, Vietnam Visited on 14 February 2022 Pathway Tuệ Đức Ho Chi Minh City, Vietnam Visited on 18 September 2021 Xã Thọ Cường, Huyện Triệu Sơn, Thanh Hoá Khong Tao, Thanh Hóa, Vietnam Visited on 26 December 2020",
 "sport": "SPORTS Điện máy quang sáng",
 "music": " Thuy Nga - Paris By Night Record label",
 "films": " Phimletoday Interest Thiên đường phim Thái - T zone Kites.vn Interest Yêu cổ trang Trung Quốc Interest Ghiền Phim Hoa Ngữ Video creator",
 "television": " Milo Murphy's Law Vietnam Fanclub TV Programme Miraculous TV Programme We Bare Bears TV Programme Amphibia Vietnam Fansub TV Programme",
 "books": " Tủ truyện gối đầu giường Book",
 "app": " Mykingdom ĐỒ CHƠI TRÍ TUỆ",
 "likes": " 21Six 23 March Store 2Sisters 3 Đậu Đậu 31 Boutique Women 4Kid - Thời Trang Cho Bé",
 "backup_info": " 3 9+ Mai Kim Anh WORK Cty TNHH xd tm xnk Hoàng Long Osin cao cấp August 2013 - Present Ho Chi Minh City, Vietnam Osin cao cấp TPHCM Osin EDUCATION Truong Vinh Ky private high school High School PLACES LIVED Ho Chi Minh City, Vietnam Current town/city Ho Chi Minh City, Vietnam Home town RESIDENCES Cty của tui Ho Chi Minh City, Vietnam Nhà của Anh Ho Chi Minh City, Vietnam CONTACT INFO /ka.mai.7370 Facebook BASIC INFO 12 April Date of birth Female Gender OTHER NAMES Mai Ka Nickname RELATIONSHIP Divorced FAMILY MEMBERS Bảo Trân Younger sister Như Quỳnh Nguyễn Younger sister ABOUT ANH Gái 2 con LIFE EVENTS PHOTOS VIDEOS CHECK-INS Đường Thạnh Xuân 25 P. Thạnh Xuân Quận 12 Thành Phố Hồ Chí Minh Việt Nam Ho Chi Minh City, Vietnam Visited on 27 March 2022 Pathway Tuệ Đức Ho Chi Minh City, Vietnam Visited on 14 February 2022 Pathway Tuệ Đức Ho Chi Minh City, Vietnam Visited on 18 September 2021 Xã Thọ Cường, Huyện Triệu Sơn, Thanh Hoá Khong Tao, Thanh Hóa, Vietnam Visited on 26 December 2020 MUSIC Thuy Nga - Paris By Night Record label FILMS Phimletoday Interest Thiên đường phim Thái - T zone Kites.vn Interest Yêu cổ trang Trung Quốc Interest Ghiền Phim Hoa Ngữ Video creator APPS AND GAMES Mykingdom ĐỒ CHƠI TRÍ TUỆ LIKES 21Six 23 March Store 2Sisters 3 Đậu Đậu 31 Boutique Women 4Kid - Thời Trang Cho Bé REVIEWS GIVEN Pathway School Sắp kết thúc năm học, một số học sinh ( xuất sắc, giỏi) trong lớp sẽ nhận được rất nhiều bằng khen, quà tặng cho thành tích học tập của mình. Nhưng mình vẫn ước ao, em học sinh nào trong lớp cũng sẽ nhận được một bằng khen hoặc chứng nhận gì đó không liên quan đến điểm số. Ví dụ như: 1. Bằng khen cho em học sinh giỏi thể dục nhất. Em có thể chạy, nhảy, bơi hay gì đó rất tuyệt hoặc đơn giản là em rất say mê môn thể dục. 2. Bằng khen cho những học sinh thân thiện nhất. Cái này có thể do cả lớp bình chọn cho một bạn nào rất hay giúp đỡ bạn khác, biết lắng nghe và chia sẻ. 3. Bằng khen cho bạn học sinh vui vẻ hài hước nhất. Bình chọn cái này sẽ vui đó vì tiêu chí để bình chọn có thể là bạn học sinh hay làm cho cả lớp bật cười hoặc cô giáo tổ chức cho học sinh thi kể truyện cười. 4. Bằng khen cho bạn học sinh sạch sẽ nhất, có thể sạch sẽ trong vệ sinh cá nhân hoặc sạch sẽ vì luôn có ý thức dọn dẹp lớp học. 5. Bằng khen cho bạn học sinh tham gia đầy đủ tất cả các ngày học trong năm. 6. Bằng khen cho bạn học sinh không đi muộn buổi học nào trong năm. 7. Bằng khen cho những bạn học sinh luôn ngủ trưa say tít. 8. Bằng khen cho những bạn học sinh hay xung phong phát biểu. 9. Bằng khen cho những bạn học sinh chịu khó đọc sách. 10. Bằng khen cho những bạn học sinh thường xuyên mang đầy đủ dụng cụ học tập khi đến lớp và sẵn sàng cho bạn mượn. 11. Bằng khen cho những học sinh khéo tay nhất/ làm đồ thủ công đẹp nhất 12. Bằng khen cho những học sinh có bộ sưu tầm vui mắt/ độc đáo 13. Bằng khen cho những học sinh thích hát nhất. 14. Bằng khen cho những học sinh hay bảo vệ bạn nhất. 15. Bằng khen cho học sinh có trí nhớ tốt nhất. 16. Bằng khen cho bạn thích nấu ăn và có thể nấu nướng tốt nhất… Kiểu như vậy, hoàn toàn do sự sáng tạo của giáo viên và của tất cả các học sinh trong lớp. Nếu tất cả đều làm điều này, mình tin phụ huynh cũng sẽ có cái nhìn rộng mở hơn về “bằng khen”. Và mỗi học sinh trong lớp đều cảm thấy phấn khích, tin tưởng vào bản thân. Những niềm vui về những thứ đơn giản như vậy, bố mẹ và thầy cô có thể tạo ra cho các con. Vì không cần cứ phải giỏi toán, tiếng Việt, tiếng Anh mới là giỏi phải không bạn? Bạn định trao “bằng khen” gì cho con cuối năm học này? Nguồn: Fb Phan Hồ Điệp",
 "contents": "null"
}