{
 "UID": "100004694165156",
 "name": "Muoi Truong",
 "education": " Vietnam Maritime University University Trường Trung Học Phổ Thông Nguyễn Đình Chiểu High School",
 "work": " ABC News",
 "placelive": " Hai Phong, Vietnam Current town/city Hai Phong, Vietnam Home town",
 "contact_info": " /muoi.truong.148 Facebook",
 "basic_info": " Male Gender",
 "relationship": "null",
 "bio": "null",
 "checkin": " Language Link Hải Dương Hải Dương Visited on 13 February 2020",
 "sport": "SPORTS Manchester United",
 "music": " Nude Interest",
 "films": " Porn films Interest Babysitters (film) Local business",
 "television": " XXL Sports team No Bra Local business",
 "books": " Credit Default Swaps Book",
 "app": " Hay Day Sexy Poker",
 "likes": " 3Bang Babydoll Babysitters (film) Balomayanh.com Bikini contest Bột lá Neem Snell",
 "backup_info": " 9+ 9 9+ 57 Muoi Truong EDUCATION Vietnam Maritime University University Trường Trung Học Phổ Thông Nguyễn Đình Chiểu High School WORK ABC News PLACES LIVED Hai Phong, Vietnam Current town/city Hai Phong, Vietnam Home town CONTACT INFO /muoi.truong.148 Facebook BASIC INFO Male Gender LIFE EVENTS FRIENDS Nguyễn Đức Hiếu Bích Loan Lê Lê Phương Phan Dương Hữu Thắng PHOTOS MUSIC Nude Interest FILMS Porn films Interest Babysitters (film) Local business TV PROGRAMMES XXL Sports team No Bra Local business APPS AND GAMES Hay Day Sexy Poker LIKES 3Bang Babydoll Babysitters (film) Balomayanh.com Bikini contest Bột lá Neem Snell REVIEWS GIVEN Bột lá Neem Snell 5 stars",
 "contents": "null"
}