{
 "UID": "100003667973209",
 "name": "Nguyen Trong Tien",
 "education": " Trường Đại Học Công nghiệp Hà Nội University Trường THPT Nguyễn Thị Minh Khai - Hà Nội High School",
 "work": " Toho",
 "placelive": " Hanoi, Vietnam Current town/city Hanoi, Vietnam Home town",
 "contact_info": " /nguyentrong.tien.796 Facebook",
 "basic_info": " Male Gender",
 "relationship": "null",
 "bio": "null",
 "checkin": " MuongHum-BatXat-LaoCai Huong Hum, Hoang Lien Son, Vietnam Visited on 17 June 2016 Sapa - Thị Trấn Mờ Sương Lào Cai Visited on 17 June 2016 Fansipan 2800m Rest Stop Sa Pa Visited on 26 December 2015 Bản Khoang-Sa Pa Lào Cai Visited on 26 December 2015",
 "sport": "SPORTS Bóng Đá Cười Ghost Riderz Bangladesh Real Madrid C.F. Europa Football Dream Through Movement [DTM Freerun] Vovinam Viet Vo Dao",
 "music": " Katy Channel Music video",
 "films": " Fast & Furious Film The Expendables 3 Film Shades of Blue (Sombras de Azul) Film Pooja Kiven AA Film",
 "television": " Gương Mặt Thân Quen TV Programme",
 "books": " TTND Comic Book",
 "app": " BAOAN Game & Puzzles Tam Sinh Tam Thế H5 Letarie Chuyên sỉ lồng đèn trung thu việt nam Hoa Cải Non Sense9 - Tranh Tối Giản",
 "likes": " Alpha FDI - Tập đoàn kết hợp Ban liên lạc cựu HSSV Cơ Khí Haui Cafe - Trà Lâm Hoa California Fitness & Yoga Centre Pico Plaza 173 Xuân Thuỷ Check in Phu Quoc Chia sẻ kinh nghiệm du lịch bốn phương -",
 "backup_info": " 9+ 9 9+ 57 Nguyen Trong Tien EDUCATION Trường Đại Học Công nghiệp Hà Nội University Trường THPT Nguyễn Thị Minh Khai - Hà Nội High School WORK Toho PLACES LIVED Hanoi, Vietnam Current town/city Hanoi, Vietnam Home town CONTACT INFO /nguyentrong.tien.796 Facebook BASIC INFO Male Gender LIFE EVENTS FRIENDS Hạt Cát Nhỏ Nguyen Thi Hien Nguyen Dang Van Minh Nguyen PHOTOS CHECK-INS MuongHum-BatXat-LaoCai Huong Hum, Hoang Lien Son, Vietnam Visited on 17 June 2016 Sapa - Thị Trấn Mờ Sương Lào Cai Visited on 17 June 2016 Fansipan 2800m Rest Stop Sa Pa Visited on 26 December 2015 Bản Khoang-Sa Pa Lào Cai Visited on 26 December 2015 MUSIC Katy Channel Music video BOOKS TTND Comic Book LIKES Alpha FDI - Tập đoàn kết hợp Ban liên lạc cựu HSSV Cơ Khí Haui Cafe - Trà Lâm Hoa California Fitness & Yoga Centre Pico Plaza 173 Xuân Thuỷ Check in Phu Quoc Chia sẻ kinh nghiệm du lịch bốn phương -",
 "contents": "null"
}