{
 "UID": "100003122054401",
 "name": "Nguyễn Dung",
 "education": " cao đẳng nghề kĩ thuật công nghệ thành phố hồ chí minh Quản Trị C10_QTD2 with Nguyễn Đình Tiến and 3 others HO CHI MINH Vocational College of technology Administrative Body C10_QTD2 with My Ngoc Nguyen HO CHI MINH Vocational College of technology Quản trị doanh nghiệp THPT Tam Phú High School 2010 - Present 12A10",
 "work": " Manulife Vietnam 15 December 2017 - Present Ho Chi Minh City, Vietnam Sales",
 "placelive": " Thành phố Hồ Chí Minh, Hồ Chí Minh, Vietnam Current town/city Ho Chi Minh City, Vietnam Home town",
 "contact_info": " /nguyen.dung.90813 Facebook",
 "basic_info": " Female Gender Men and women Interested in",
 "relationship": " It's complicated",
 "bio": "ABOUT NGUYỄN Mạnh mẽ trong cuộc sống hok có gì làm tui chùn bước^^",
 "checkin": " Cánh đồng diều quận 2 Ho Chi Minh City, Vietnam Visited on 18 March 2021 Tháp Bà Ponagar Nha Trang Nha Trang Visited on 26 July 2018 Da Lat Lâm Đồng Province Visited on 8 May 2018 Dankia, Lâm Ðồng, Vietnam Lâm Đồng Province Visited on 15 April 2018",
 "sport": "SPORTS Official Supporters Club Of Chelsea In Vietnam",
 "music": " Gala Royale The Event Hall Wedding venue Nhac Han Quoc Music",
 "films": " Phim Plus+ Interest Mọt Phim Thái Interest Hot Cine Film",
 "television": " Nhân Duyên Interest On-Going with Matilde Keizer TV Programme Running Man Vietsub Livestream Public figure Thử tài siêu nhí Media",
 "books": " Giải trí 24h Book",
 "app": " EverMerge PUBG Vĩnh Tường Hội những người đam mê Kantai Collection - Móe Fleet Nhật Ký Tình Yêu - Gamota Iron Force Pokémon Play It!",
 "likes": " 1 Phút Thay Đổi Tư Duy Để Thành Công 198it - Hàng ở bển về 1990 Studio 24h Đẹp 24hshop 4MEN",
 "backup_info": " 9+ 9 9+ 57 Nguyễn Dung EDUCATION cao đẳng nghề kĩ thuật công nghệ thành phố hồ chí minh Quản Trị C10_QTD2 with Nguyễn Đình Tiến and 3 others HO CHI MINH Vocational College of technology Administrative Body C10_QTD2 with My Ngoc Nguyen HO CHI MINH Vocational College of technology Quản trị doanh nghiệp THPT Tam Phú High School 2010 - Present 12A10 WORK Manulife Vietnam 15 December 2017 - Present Ho Chi Minh City, Vietnam Sales PLACES LIVED Thành phố Hồ Chí Minh, Hồ Chí Minh, Vietnam Current town/city Ho Chi Minh City, Vietnam Home town CONTACT INFO /nguyen.dung.90813 Facebook BASIC INFO Female Gender Men and women Interested in OTHER NAMES Nguyễn Dung Other RELATIONSHIP It's complicated ABOUT NGUYỄN Mạnh mẽ trong cuộc sống hok có gì làm tui chùn bước^^ LIFE EVENTS FRIENDS Hiệp Nguyễn Trần Hằng Thanh Hiền Vo Thị Nhiều PHOTOS VIDEOS CHECK-INS Cánh đồng diều quận 2 Ho Chi Minh City, Vietnam Visited on 18 March 2021 Tháp Bà Ponagar Nha Trang Nha Trang Visited on 26 July 2018 Da Lat Lâm Đồng Province Visited on 8 May 2018 Dankia, Lâm Ðồng, Vietnam Lâm Đồng Province Visited on 15 April 2018 MUSIC Gala Royale The Event Hall Wedding venue Nhac Han Quoc Music FILMS Phim Plus+ Interest Mọt Phim Thái Interest Hot Cine Film TV PROGRAMMES Nhân Duyên Interest On-Going with Matilde Keizer TV Programme Running Man Vietsub Livestream Public figure Thử tài siêu nhí Media BOOKS Giải trí 24h Book APPS AND GAMES EverMerge PUBG Vĩnh Tường Hội những người đam mê Kantai Collection - Móe Fleet Nhật Ký Tình Yêu - Gamota Iron Force Pokémon Play It! LIKES 1 Phút Thay Đổi Tư Duy Để Thành Công 198it - Hàng ở bển về 1990 Studio 24h Đẹp 24hshop 4MEN REVIEWS GIVEN DongHai Nhân viên nhiệt tình, chu đáo Factory Outlet 4 stars Phong Cua-Thanh Da 5 stars FWD Vietnam",
 "contents": "null"
}