{
 "UID": "100003834999563",
 "name": "Nguyen Duc Minh",
 "education": "null",
 "work": "null",
 "placelive": " Hanoi, Vietnam Current town/city Hung Yen, Hưng Yên, Vietnam Home town",
 "contact_info": " /ducminh301 Facebook",
 "basic_info": " Male Gender",
 "relationship": " Minh Tu Married See photos of Nguyen Duc and Tu",
 "bio": "null",
 "checkin": " Sapa - Thị Trấn Mờ Sương Lào Cai Visited on 4 February 2022 Roma, Italia / Rome, Italy Rome, Italy Visited on 3 February 2022 TPC Trading & Production Hanoi, Vietnam Visited on 23 April 2021 TPC Trading & Production Hanoi, Vietnam Visited on 18 March 2021",
 "sport": "SPORTS Matrix Boxing Fishing fishing Liverpool FC in Việt Nam Arsenal Boxing Cầu Giấy",
 "music": " SOL - Greenfield Music Club Musician/Band Hẹn Hò Radio Radio station Giang Nhạc Xưa - Turntable & Vinyl Album Học Nhảy Múa tại Clb Pha Lê Performance and event venue",
 "films": " Rambo Film",
 "television": " XBMC Open Source Discussion TV network Truyền hình AVG TV network Showtime Sports TV network MTV Vietnam TV network",
 "books": " FamilyBooks - Tủ Sách Gia Đình Interest",
 "app": " HTCGame - Máy chơi game 100% chính hãng",
 "likes": " 26FIT Yoga & Pool Center 3D Megastock 3DMAKER 5-Minute Crafts 5-Minute Crafts Play 5-Minute Crafts Teens",
 "backup_info": " 2 9+ Nguyen Duc Minh PLACES LIVED Hanoi, Vietnam Current town/city Hung Yen, Hưng Yên, Vietnam Home town CONTACT INFO /ducminh301 Facebook BASIC INFO Male Gender RELATIONSHIP Minh Tu Married See photos of Nguyen Duc and Tu LIFE EVENTS PHOTOS VIDEOS CHECK-INS Sapa - Thị Trấn Mờ Sương Lào Cai Visited on 4 February 2022 Roma, Italia / Rome, Italy Rome, Italy Visited on 3 February 2022 TPC Trading & Production Hanoi, Vietnam Visited on 23 April 2021 TPC Trading & Production Hanoi, Vietnam Visited on 18 March 2021 SPORTS Matrix Boxing Fishing fishing Liverpool FC in Việt Nam Arsenal Boxing Cầu Giấy MUSIC SOL - Greenfield Music Club Musician/Band Hẹn Hò Radio Radio station Giang Nhạc Xưa - Turntable & Vinyl Album Học Nhảy Múa tại Clb Pha Lê Performance and event venue FILMS Rambo Film TV PROGRAMMES XBMC Open Source Discussion TV network Truyền hình AVG TV network Showtime Sports TV network MTV Vietnam TV network BOOKS FamilyBooks - Tủ Sách Gia Đình Interest APPS AND GAMES HTCGame - Máy chơi game 100% chính hãng LIKES 26FIT Yoga & Pool Center 3D Megastock 3DMAKER 5-Minute Crafts 5-Minute Crafts Play 5-Minute Crafts Teens",
 "contents": "null"
}