{
 "UID": "100020485336287",
 "name": "Nguyễn Hạnh",
 "education": "null",
 "work": "null",
 "placelive": "null",
 "contact_info": " /silejogger76 Facebook",
 "basic_info": " Female Gender",
 "relationship": "null",
 "bio": "null",
 "checkin": " Jeju Island, South Korea Jeju City Visited on 19 January 2018",
 "sport": "SPORTS Juve Stabia Nel Cuore",
 "music": " Cedeel Indignado Comedy club Hustlelooyah, LLC Arts and entertainment Benja Khan Musician/Band Damna Records Record label",
 "films": " Thích xem phim Film Học Thanh Nhạc Giọng Ca Việt Arts and entertainment SV Movies Just for fun Baby Kids Film",
 "television": " Sports Live Now TV network La Angy Interest Dios Es Amor y Paz Interest Pro DZ Gaming video creator",
 "books": " Le Tenebre dell'Anima Book The Green Phantasm Book Il canto dei rapsodi erranti - Libro di Piero Stradella Book",
 "app": " Football Hero GameXD XGN Ur Dose Of League E-Ride On Toys PH Hỏi Ngu",
 "likes": " 1199 Handmade 123cafe.com.vn 19Aquarium 2 Build Wealth Online 3Ddecor.vn 4Everyone Gioielli",
 "backup_info": " 9+ 9 9+ 57 Nguyễn Hạnh CONTACT INFO /silejogger76 Facebook BASIC INFO Female Gender LIFE EVENTS FRIENDS Hương Giang Nguyễn Thị Thanh Lam Lam Hiro Thanh Anh PHOTOS SPORTS Juve Stabia Nel Cuore MUSIC Cedeel Indignado Comedy club Hustlelooyah, LLC Arts and entertainment Benja Khan Musician/Band Damna Records Record label FILMS Thích xem phim Film Học Thanh Nhạc Giọng Ca Việt Arts and entertainment SV Movies Just for fun Baby Kids Film TV PROGRAMMES Sports Live Now TV network La Angy Interest Dios Es Amor y Paz Interest Pro DZ Gaming video creator BOOKS Le Tenebre dell'Anima Book The Green Phantasm Book Il canto dei rapsodi erranti - Libro di Piero Stradella Book APPS AND GAMES Football Hero GameXD XGN Ur Dose Of League E-Ride On Toys PH Hỏi Ngu LIKES 1199 Handmade 123cafe.com.vn 19Aquarium 2 Build Wealth Online 3Ddecor.vn 4Everyone Gioielli REVIEWS GIVEN Mỹ phẩm Uni 5 stars Kem tan mỡ Massage Gừng Ớt 5 stars Phá 5 stars Thuốc trị hôi miệng 5 stars",
 "contents": "null"
}