{
 "UID": "100002780945638",
 "name": "Nguyễn Quang Hưng",
 "education": " truong dai hoc lao dong xa hoi University THPT Hùng Vương - Thị Xã Phú Thọ High School",
 "work": " Hà Nội Phố",
 "placelive": " Hanoi, Vietnam Current town/city Hai Phong, Vietnam Home town",
 "contact_info": " /hung.nguyenquang.58726 Facebook nguyenquanghung27784@gmail.com Email address",
 "basic_info": " 27 July 1984 Date of birth Male Gender",
 "relationship": " Engaged",
 "bio": "null",
 "checkin": " Xóm Núi, Sóc Sơn Hanoi, Vietnam Visited on 7 May 2021 Sóc Sơn, Hà Nội Hanoi, Vietnam Visited on 11 October 2016 Tôi Bán Hanoi, Vietnam Visited on 18 November 2013 Tôi Bán Hanoi, Vietnam Visited on 1 October 2013",
 "sport": "SPORTS Blog Nhà Đẹp",
 "music": " Mật Ong Rừng Hà Đặng Health/Beauty",
 "films": " Review phim hay Film B9 Studio Product/Service Các câu nói hay - ý nghĩa và hài hước trong phim TVB Film God's Not Dead Film",
 "television": " Cười+ Just for fun Gương Mặt Thân Quen TV Programme",
 "books": " Tự Tay Làm Lấy (TTLL) Book",
 "app": " Mobigame 3Q 360mobi Gunny",
 "likes": " 1,000,000 Mẫu Tóc Đẹp 3000 Từ Vựng Tiếng Anh Thông Dụng Nhất 3Q 360mobi 5-Minute Crafts 5-Minute Crafts GIRLY 50mm Vietnam",
 "backup_info": " 4 5 9+ 45 Nguyễn Quang Hưng EDUCATION truong dai hoc lao dong xa hoi University THPT Hùng Vương - Thị Xã Phú Thọ High School WORK Hà Nội Phố PLACES LIVED Hanoi, Vietnam Current town/city Hai Phong, Vietnam Home town CONTACT INFO /hung.nguyenquang.58726 Facebook nguyenquanghung27784@gmail.com Email address BASIC INFO 27 July 1984 Date of birth Male Gender RELATIONSHIP Engaged FAMILY MEMBERS Lan Anh Do Wife LIFE EVENTS FRIENDS Nguyễn Văn Hùng Lê Phương Dung Kiên Hoàng Thành Long OrChid PHOTOS VIDEOS CHECK-INS Xóm Núi, Sóc Sơn Hanoi, Vietnam Visited on 7 May 2021 Sóc Sơn, Hà Nội Hanoi, Vietnam Visited on 11 October 2016 Tôi Bán Hanoi, Vietnam Visited on 18 November 2013 Tôi Bán Hanoi, Vietnam Visited on 1 October 2013 TV PROGRAMMES Cười+ Just for fun Gương Mặt Thân Quen TV Programme BOOKS Tự Tay Làm Lấy (TTLL) Book APPS AND GAMES Mobigame 3Q 360mobi Gunny LIKES 1,000,000 Mẫu Tóc Đẹp 3000 Từ Vựng Tiếng Anh Thông Dụng Nhất 3Q 360mobi 5-Minute Crafts 5-Minute Crafts GIRLY 50mm Vietnam REVIEWS GIVEN Nhà hàng IC 5 stars Good Tôi Bán 5 stars Ngon-bo-re... Thiết bị khách sạn nhà hàng cao cấp Star Solutions Đẳng cấp 5*",
 "contents": "null"
}