{
 "UID": "1795448319",
 "name": "Nguyen Ly Dac",
 "education": " Cao học: Thất Học chuyên ngành ăn chơi School year 2009 Trung học chuyên \"bùng\" High School School year 2010",
 "work": " ASEM VIETNAM",
 "placelive": " Ho Chi Minh City, Vietnam Current town/city Ho Chi Minh City, Vietnam Home town",
 "contact_info": " /anh.dac.9 Facebook",
 "basic_info": " Male Gender Women Interested in",
 "relationship": "null",
 "bio": "null",
 "checkin": " Sài Gòn Ho Chi Minh City, Vietnam Visited on 14 June 2021 Nhà Hàng Yến Sào Cam Ranh. Trạm Dừng Chân Bắc-Nam Cam Ranh Port, Khánh Hòa, Vietnam Visited on 22 April 2020 Ana Marina Nha Trang Nha Trang Visited on 18 April 2020 Ana Marina Nha Trang Nha Trang Visited on 10 March 2020",
 "sport": "SPORTS Dạy Tennis Cương An Phú -Trung Tâm dạy Tennis Uy Tín,Chất Lượng,TPHCM",
 "music": " TDCEntertainment Music award Radio MỰC TÍM Online Society & culture website",
 "films": " Phim Rạp Entertainment website",
 "television": " MTV Vietnam TV network Hội Quán Cười Community",
 "books": " Real Kid Books Book Sống và Khát Vọng Community LifeBook - Cuốn Sách Cuộc Đời Book Mọt sách's confession Book",
 "app": " Chrysopelea FPV",
 "likes": " 8.SECONDS ANN Maternity ASEM VIETNAM Acoustic Bar - Ngô Thời Nhiệm Anh Duy Audio Aqua Palace",
 "backup_info": " 9+ 82 Nguyen Ly Dac EDUCATION Cao học: Thất Học chuyên ngành ăn chơi School year 2009 Trung học chuyên \"bùng\" High School School year 2010 WORK ASEM VIETNAM PLACES LIVED Ho Chi Minh City, Vietnam Current town/city Ho Chi Minh City, Vietnam Home town CONTACT INFO /anh.dac.9 Facebook BASIC INFO Male Gender Women Interested in FAMILY MEMBERS Chau Nguyen Younger sister Alex Truong Younger brother Trâm Anh Trương Younger sister Sanh Nguyen Uncle Florence Do Cousin Uyên Hồ Wife Thinh La Family member LIFE EVENTS PHOTOS VIDEOS CHECK-INS Sài Gòn Ho Chi Minh City, Vietnam Visited on 14 June 2021 Nhà Hàng Yến Sào Cam Ranh. Trạm Dừng Chân Bắc-Nam Cam Ranh Port, Khánh Hòa, Vietnam Visited on 22 April 2020 Ana Marina Nha Trang Nha Trang Visited on 18 April 2020 Ana Marina Nha Trang Nha Trang Visited on 10 March 2020 SPORTS Dạy Tennis Cương An Phú -Trung Tâm dạy Tennis Uy Tín,Chất Lượng,TPHCM MUSIC TDCEntertainment Music award Radio MỰC TÍM Online Society & culture website FILMS Phim Rạp Entertainment website APPS AND GAMES Chrysopelea FPV LIKES 8.SECONDS ANN Maternity ASEM VIETNAM Acoustic Bar - Ngô Thời Nhiệm Anh Duy Audio Aqua Palace",
 "contents": "null"
}