{
 "UID": "100003031727219",
 "name": "Nguyen Dat",
 "education": " Dai Hoc Thuong Mai thuong mai dien tu School year 2007 THPT Tran Khai Nguyen High School School year 1993",
 "work": " Ho Chi Minh City, Vietnam phó thường dân",
 "placelive": " Ho Chi Minh City, Vietnam Current town/city Ho Chi Minh City, Vietnam Home town",
 "contact_info": " /nguyen.dat.58910 Facebook",
 "basic_info": " Male Gender",
 "relationship": "null",
 "bio": "null",
 "checkin": " Xã Thanh Phú, Huyện Bến Lức Ben Luc Visited on 19 September 2019 Ho Chi Minh City, Vietnam Ho Chi Minh City Visited on 15 September 2019 Ở Đâu Đó Trên Bầu Trời Ho Chi Minh City, Vietnam Visited on 8 August 2019 Công Ty Cổ Phần Dược Phẩm Dược Liệu Pharmedic Ho Chi Minh City, Vietnam Visited on 15 May 2017",
 "sport": "SPORTS Chân Tình 308 FC Manchester United Arsenal Chelsea Football Club Vietnam national football team Chelsea Football Club Women",
 "music": " Viện Thẩm Mỹ Sora Luxury Health spa Bòn Bon shop Album Crescendo Band Musician/Band Mập Coffee Acoustic Performance and event venue",
 "films": " Review phim hay Film B9 Studio Product/Service Các câu nói hay - ý nghĩa và hài hước trong phim TVB Film God's Not Dead Film",
 "television": " Solo Cùng Bolero TV Programme PHAN HIẾU Performing arts Thời sự VTV Media/news company America's Funniest Home Videos TV Programme",
 "books": "",
 "app": " Thiên Long Tam Quốc - Tendo Ngọa Long Truyện - Funtap Vua Thủy Chiến - Funtap",
 "likes": " 1991 Rooftop Coffee & More 30 Shop 5-Minute Crafts ABER VIỆT NAM AE SOLAR America's Funniest Home Videos",
 "backup_info": " 9+ 9 9+ 57 Nguyen Dat EDUCATION Dai Hoc Thuong Mai thuong mai dien tu School year 2007 THPT Tran Khai Nguyen High School School year 1993 WORK Ho Chi Minh City, Vietnam phó thường dân PLACES LIVED Ho Chi Minh City, Vietnam Current town/city Ho Chi Minh City, Vietnam Home town CONTACT INFO /nguyen.dat.58910 Facebook BASIC INFO Male Gender LIFE EVENTS PHOTOS VIDEOS CHECK-INS Xã Thanh Phú, Huyện Bến Lức Ben Luc Visited on 19 September 2019 Ho Chi Minh City, Vietnam Ho Chi Minh City Visited on 15 September 2019 Ở Đâu Đó Trên Bầu Trời Ho Chi Minh City, Vietnam Visited on 8 August 2019 Công Ty Cổ Phần Dược Phẩm Dược Liệu Pharmedic Ho Chi Minh City, Vietnam Visited on 15 May 2017 SPORTS Chân Tình 308 FC Manchester United Arsenal Chelsea Football Club Vietnam national football team Chelsea Football Club Women MUSIC Viện Thẩm Mỹ Sora Luxury Health spa Bòn Bon shop Album Crescendo Band Musician/Band Mập Coffee Acoustic Performance and event venue TV PROGRAMMES Solo Cùng Bolero TV Programme PHAN HIẾU Performing arts Thời sự VTV Media/news company America's Funniest Home Videos TV Programme APPS AND GAMES Thiên Long Tam Quốc - Tendo Ngọa Long Truyện - Funtap Vua Thủy Chiến - Funtap LIKES 1991 Rooftop Coffee & More 30 Shop 5-Minute Crafts ABER VIỆT NAM AE SOLAR America's Funniest Home Videos REVIEWS GIVEN Tien Nguyen Quang 5 stars Hội Nhà Thuốc 5 stars Công Đoàn Pharmedic 5 stars Sân Bay Phú Quốc 5 stars",
 "contents": "null"
}