{
 "UID": "100004099772207",
 "name": "Nguyễn Hồng",
 "education": " Đại Học Điện Lực University Trường THPT Cổ Loa High School",
 "work": " Làm việc tại Công ty Las Beauty 1 April 2019 - Present Trường THPT Cổ Loa",
 "placelive": " Hanoi, Vietnam Current town/city Hanoi, Vietnam Home town",
 "contact_info": "null",
 "basic_info": " Female Gender",
 "relationship": " Phi Tòng Married Since 25 January 2013 See photos of Hồng and Phi",
 "bio": "null",
 "checkin": " Thiết Bị Điện Minh Khôi Hanoi, Vietnam Visited on 28 November 2021 Ruby Home Hanoi, Vietnam Visited on 7 June 2021 Bên Bờ Sông Đuống Hanoi, Vietnam Visited on 2 May 2021 Bãi Bồi Ven Sông Hồng Hanoi, Vietnam Visited on 2 May 2021",
 "sport": "SPORTS Arsenal Women",
 "music": " Thuy Nga - Paris By Night Record label Thu Thuỷ Musician/Band Diệp Bảo Ngọc Interest",
 "films": " Mê phim Hàn Interest",
 "television": " Giọng Hát Việt Nhí TV Programme 5Plus Online TV Programme",
 "books": " Sách Cho Con Book Tủ Sách Tinh Hoa Book",
 "app": " PopFishing",
 "likes": " 5Plus Online AN THANH - chuyên trị mụn, thâm, nám, làm trắng da Aquafina Vietnam BABY STORE BAMBOO Beauti Citi",
 "backup_info": " 4 5 9+ 45 Nguyễn Hồng EDUCATION Đại Học Điện Lực University Trường THPT Cổ Loa High School WORK Làm việc tại Công ty Las Beauty 1 April 2019 - Present Trường THPT Cổ Loa PLACES LIVED Hanoi, Vietnam Current town/city Hanoi, Vietnam Home town BASIC INFO Female Gender RELATIONSHIP Phi Tòng Married Since 25 January 2013 See photos of Hồng and Phi LIFE EVENTS FRIENDS Bút Vũ Nguyễn Thảo Trần Tuyết Như Nguyệt Gia Dụng PHOTOS VIDEOS FILMS Mê phim Hàn Interest TV PROGRAMMES Giọng Hát Việt Nhí TV Programme 5Plus Online TV Programme APPS AND GAMES PopFishing LIKES 5Plus Online AN THANH - chuyên trị mụn, thâm, nám, làm trắng da Aquafina Vietnam BABY STORE BAMBOO Beauti Citi",
 "contents": "null"
}