{
 "UID": "100004031031743",
 "name": "Nguyễn Hồng Phúc",
 "education": " HUTECH - Đại học Công nghệ Tp.HCM University Trung Học Phổ Thông Đinh Tiên Hoàng Thành Phố Vũng Tàu High School School year 2013 12A5 with Nguyễn Văn Nghĩa and Jubidah Bi Vi THCS Duy Tân - Vũng Tàu High School School year 2009 6-7",
 "work": "null",
 "placelive": " Ho Chi Minh City, Vietnam Current town/city Vung Tau Home town",
 "contact_info": " /pu.peo1211 Facebook",
 "basic_info": " Female Gender Men Interested in",
 "relationship": " Single",
 "bio": "null",
 "checkin": " Havana Night Club Nha Trang Visited on 25 May 2018 Đen Đá Coffee Ho Chi Minh City, Vietnam Visited on 18 May 2018 ICoffee - Coffee & Tea Express Ho Chi Minh City, Vietnam Visited on 18 May 2018 Vườn Hoa Bãi Đá Sông Hồng Hanoi, Vietnam Visited on 17 May 2018",
 "sport": "SPORTS Armychess",
 "music": " Thế Giới Âm Nhạc Online Performing arts",
 "films": " H&L store Product/Service Khophim.vn Nóng Bỏng Interest Minions Film",
 "television": " Heirs Vietnam Interest Asian Amazing - Legend of the Blue Sea TV Programme Running Man Vietsub Fan Page MTV Vietnam TV network",
 "books": " Sách Cho Con Book Tủ Sách Tinh Hoa Book",
 "app": " Máy bay điều khiển từ xa Câu lạc bộ Montessori Giáo cụ Montessori - Oreka Ludojocus",
 "likes": " 12 cung hoàng đạo 1719 Wedding Studio 19.degrees 1992 s t u d i o 19_December 2 USD",
 "backup_info": " 9+ 80 Nguyễn Hồng Phúc EDUCATION HUTECH - Đại học Công nghệ Tp.HCM University Trung Học Phổ Thông Đinh Tiên Hoàng Thành Phố Vũng Tàu High School School year 2013 12A5 with Nguyễn Văn Nghĩa and Jubidah Bi Vi THCS Duy Tân - Vũng Tàu High School School year 2009 6-7 PLACES LIVED Ho Chi Minh City, Vietnam Current town/city Vung Tau Home town CONTACT INFO /pu.peo1211 Facebook BASIC INFO Female Gender Men Interested in RELATIONSHIP Single LIFE EVENTS FRIENDS Đao Tran Tuyen Pham Quỳnhh Quỳnhh Nguyễn Đạt PHOTOS VIDEOS CHECK-INS Havana Night Club Nha Trang Visited on 25 May 2018 Đen Đá Coffee Ho Chi Minh City, Vietnam Visited on 18 May 2018 ICoffee - Coffee & Tea Express Ho Chi Minh City, Vietnam Visited on 18 May 2018 Vườn Hoa Bãi Đá Sông Hồng Hanoi, Vietnam Visited on 17 May 2018 MUSIC Thế Giới Âm Nhạc Online Performing arts FILMS H&L store Product/Service Khophim.vn Nóng Bỏng Interest Minions Film TV PROGRAMMES Heirs Vietnam Interest Asian Amazing - Legend of the Blue Sea TV Programme Running Man Vietsub Fan Page MTV Vietnam TV network LIKES 12 cung hoàng đạo 1719 Wedding Studio 19.degrees 1992 s t u d i o 19_December 2 USD REVIEWS GIVEN W - Real - M 5 stars Kabi Contact Lens Store 5 stars Fresh Origin Coffee",
 "contents": "null"
}