{
 "UID": "100002995025962",
 "name": "Nguyễn Văn Hưng",
 "education": " Đại học Dân lập Hải Phòng Tài Chính Ngân Hàng QT1301T THPT Đông Triều High School School year 2009 12 C6",
 "work": "null",
 "placelive": " Khê Mao, Quảng Ninh, Vietnam Current town/city Khê Mao, Quảng Ninh, Vietnam Home town",
 "contact_info": " /traiquang.ninh.1 Facebook",
 "basic_info": " Male Gender Women Interested in",
 "relationship": " Married since 2013",
 "bio": "null",
 "checkin": " Hai Phong, Vietnam Vietnam Visited on 14 January 2021 Sân Vận Động TP Uông Bí Uông Bí Visited on 29 August 2020 Nanning Guangxi Visited on 21 March 2019 Xiqiao, Guangdong, China Foshan Visited on 15 March 2019",
 "sport": "SPORTS Than Quảng Ninh Football Club Bún Cá, Bún Cá Rô Đồng",
 "music": " Latest Pop Songs 最新流行歌曲 Interest",
 "films": " Review phim hay Film B9 Studio Product/Service Các câu nói hay - ý nghĩa và hài hước trong phim TVB Film God's Not Dead Film",
 "television": " Tài Năng Online TV Programme",
 "books": "",
 "app": " Mobigame 3Q 360mobi Gunny",
 "likes": " 1,000,000 Mẫu Tóc Đẹp 3000 Từ Vựng Tiếng Anh Thông Dụng Nhất 3Q 360mobi 5-Minute Crafts 5-Minute Crafts GIRLY 50mm Vietnam",
 "backup_info": " 4 5 9+ 45 Nguyễn Văn Hưng EDUCATION Đại học Dân lập Hải Phòng Tài Chính Ngân Hàng QT1301T THPT Đông Triều High School School year 2009 12 C6 PLACES LIVED Khê Mao, Quảng Ninh, Vietnam Current town/city Khê Mao, Quảng Ninh, Vietnam Home town CONTACT INFO /traiquang.ninh.1 Facebook BASIC INFO Male Gender Women Interested in OTHER NAMES Hưng Ceramic Other RELATIONSHIP Married since 2013 FAMILY MEMBERS Hiếu Nguyễn Older brother A Li Ti Giang Younger brother Đỗ Ngân Giang Younger sister Chu Hồng Giang Younger brother Kún Kun Older brother Linh Anh Niece Lap Nguyen Family member LIFE EVENTS PHOTOS VIDEOS CHECK-INS Hai Phong, Vietnam Vietnam Visited on 14 January 2021 Sân Vận Động TP Uông Bí Uông Bí Visited on 29 August 2020 Nanning Guangxi Visited on 21 March 2019 Xiqiao, Guangdong, China Foshan Visited on 15 March 2019 SPORTS Than Quảng Ninh Football Club Bún Cá, Bún Cá Rô Đồng MUSIC Latest Pop Songs 最新流行歌曲 Interest TV PROGRAMMES Tài Năng Online TV Programme BOOKS",
 "contents": "null"
}