{
 "UID": "100003179506429",
 "name": "Ngô Vương",
 "education": " Đại học Bách khoa Hà Nội - Hanoi University of Science and Technology University Trường THPT Yên Mô A High School 12M with Trần Văn Toàn",
 "work": "null",
 "placelive": " Hanoi, Vietnam Current town/city Ninh Bình Home town",
 "contact_info": " /vuong.ngo.545 Facebook",
 "basic_info": " 14 May Date of birth Male Gender Women Interested in",
 "relationship": " In a relationship since 8 June 2016",
 "bio": "ABOUT VƯƠNG moi thu deu binh thuong",
 "checkin": " Khu Du Lịch Hồ Kim Đĩnh Phú Binh, Ha Son Binh, Vietnam Visited on 22 August 2020 Bãi Bụt-Bán Đảo Sơn Trà-Đà Nẵng Da Nang, Vietnam Visited on 22 July 2020 Da Nang, Vietnam Da Nang Visited on 21 July 2020 T+ Beer, 139 Cầu Giấy - Hà Nội Hanoi, Vietnam Visited on 8 June 2019",
 "sport": "SPORTS BA ĐÌNH KIDS Real Madrid C.F.",
 "music": " VOV Giao Thông Radio station Bài hát yêu thích Music video Bạn đang nghe bài hát nào? Playlist Gift of Tongues Musician/Band",
 "films": " Phim Godzilla Film HDViet Entertainment website hai, hanh dong, kinh di Film",
 "television": " Dự báo thời tiết VTV TV Programme IELTS Face-Off TV Programme Unknown Streetwear Clothing (brand) Hỏi xoáy đáp xoay TV",
 "books": "",
 "app": " EverMerge PUBG Vĩnh Tường Hội những người đam mê Kantai Collection - Móe Fleet Nhật Ký Tình Yêu - Gamota Iron Force Pokémon Play It!",
 "likes": " 1 Phút Thay Đổi Tư Duy Để Thành Công 198it - Hàng ở bển về 1990 Studio 24h Đẹp 24hshop 4MEN",
 "backup_info": " 9+ 9 9+ 57 Ngô Vương EDUCATION Đại học Bách khoa Hà Nội - Hanoi University of Science and Technology University Trường THPT Yên Mô A High School 12M with Trần Văn Toàn PLACES LIVED Hanoi, Vietnam Current town/city Ninh Bình Home town CONTACT INFO /vuong.ngo.545 Facebook BASIC INFO 14 May Date of birth Male Gender Women Interested in RELATIONSHIP In a relationship since 8 June 2016 FAMILY MEMBERS Ngô Huyền Younger sister Ngô Thế Tài Younger brother Ngô Thu Hường Older sister Ngô Trang Younger sister Ngô Thanh Hoa Older sister Ngô Minh Đại Older brother Xuan Hanh Ngo Uncle Đinh Quốc Toản Family member ABOUT VƯƠNG moi thu deu binh thuong LIFE EVENTS FRIENDS Ngô Thanh Hoa Nguyen Duy Chung Pham Hong Nhung Vũ Quỳnh Mai PHOTOS VIDEOS CHECK-INS Khu Du Lịch Hồ Kim Đĩnh Phú Binh, Ha Son Binh, Vietnam Visited on 22 August 2020 Bãi Bụt-Bán Đảo Sơn Trà-Đà Nẵng Da Nang, Vietnam Visited on 22 July 2020 Da Nang, Vietnam Da Nang Visited on 21 July 2020 T+ Beer, 139 Cầu Giấy - Hà Nội Hanoi, Vietnam Visited on 8 June 2019 SPORTS BA ĐÌNH KIDS Real Madrid C.F. MUSIC VOV Giao Thông Radio station Bài hát yêu thích Music video Bạn đang nghe bài hát nào? Playlist Gift of Tongues Musician/Band FILMS Phim Godzilla Film HDViet Entertainment website hai, hanh dong, kinh di Film TV PROGRAMMES Dự báo thời tiết VTV TV Programme IELTS Face-Off TV Programme Unknown Streetwear Clothing (brand) Hỏi xoáy đáp xoay TV BOOKS",
 "contents": "null"
}