{
 "UID": "100017780170835",
 "name": "Nhieu Tran",
 "education": " THPT Ban Cong vinh long High School",
 "work": " FAPV",
 "placelive": " Vĩnh Long Current town/city Vĩnh Long Home town",
 "contact_info": "null",
 "basic_info": " Male Gender",
 "relationship": "null",
 "bio": "null",
 "checkin": " Ấp Mỹ Điền, Xã Phú Điền , Huyện Tháp Mười , Tỉnh Đồng Tháp Ho Chi Minh City, Vietnam Visited on 1 March 2019 Tp Vinh Long ,viet Nam. Vietnam Visited on 15 December 2018",
 "sport": "SPORTS Manchester United Fc Manchester United in Việt Nam Real Madrid C.F.",
 "music": " Nắng Music Music video Ca Sĩ Nhí Music video",
 "films": " Phimletoday Interest Thiên đường phim Thái - T zone Kites.vn Interest Yêu cổ trang Trung Quốc Interest Ghiền Phim Hoa Ngữ Video creator",
 "television": " Bolero Cùng Năm Tháng Local business",
 "books": " Từ Tốt Đến Vĩ Đại Book Suy Nghĩ Và Làm Giàu Book ATP BOOK Book Sách Hay Hãy Cùng Nhau Đọc Book",
 "app": " Vipplay",
 "likes": " ANNs Jewelry Blog Tâm Sự Blogtamsu Chuyện Chúng Mình Blogtin.com Bolero Cùng Năm Tháng Bongdavietnam.vn",
 "backup_info": " 9+ 82 Nhieu Tran EDUCATION THPT Ban Cong vinh long High School WORK FAPV PLACES LIVED Vĩnh Long Current town/city Vĩnh Long Home town BASIC INFO Male Gender FAMILY MEMBERS Ngọc Yến Family member LIFE EVENTS FRIENDS Út Một Trang Koy Thu Thao Phong Thanh PHOTOS VIDEOS CHECK-INS Ấp Mỹ Điền, Xã Phú Điền , Huyện Tháp Mười , Tỉnh Đồng Tháp Ho Chi Minh City, Vietnam Visited on 1 March 2019 Tp Vinh Long ,viet Nam. Vietnam Visited on 15 December 2018 SPORTS Manchester United Fc Manchester United in Việt Nam Real Madrid C.F. MUSIC Nắng Music Music video Ca Sĩ Nhí Music video TV PROGRAMMES Bolero Cùng Năm Tháng Local business APPS AND GAMES Vipplay LIKES ANNs Jewelry Blog Tâm Sự Blogtamsu Chuyện Chúng Mình Blogtin.com Bolero Cùng Năm Tháng Bongdavietnam.vn",
 "contents": "null"
}