{
 "UID": "100000001500785",
 "name": "Pham Hoang Son",
 "education": " University of Illinois Springfield Marketing · Business Administration 2011 - December 2013 Ho Chi Minh City University of Technology University",
 "work": " Jelly Key Navigator April 2016 - Present Ho Chi Minh City, Vietnam We Jelly Managing director Ho Chi Minh City, Vietnam Chúng Tôi Là Rau Câu Abbott Father in training July 2014 - 1 January 2016 Ho Chi Minh City, Vietnam Training to become a great father, especially for kid from 1 to 6. Pfizer(Thailand)Co.,Ltd May 2012 - 11 August 2012 Ho Chi Minh City, Vietnam",
 "placelive": " Ho Chi Minh City, Vietnam Current town/city Springfield, Illinois Moved in 2011",
 "contact_info": " /phamhoangson Facebook",
 "basic_info": " Male Gender",
 "relationship": "null",
 "bio": "null",
 "checkin": " Hang động Tú Làn Đồng Hới Visited on 30 March 2021 Ariyana Convention Centre Danang Da Nang, Vietnam Visited on 23 January 2021 Cao Nguyên Đá Đồng Văn - Hà Giang Dồng Văn, Hà Giang, Vietnam Visited on 17 November 2020 Xa My Luong Cai Be Tien Vietnam Visited on 25 April 2020",
 "sport": "SPORTS Thanh Hóa FC Since 1962",
 "music": " NGUYENQUAN-Studio Record label The Violin Channel Arts and entertainment Techcombank Ho Chi Minh City International Marathon Sport YOUNG  Interest",
 "films": " Cô Ba Sài Gòn Film Star Wars Film Nhắm Mắt Thấy Mùa Hè Film DẤU ẤN HÒA BÌNH Film",
 "television": " Love Death + Robots TV Programme Agents of S.H.I.E.L.D. TV Programme American Crime Story: The Assassination of Gianni Versace TV Programme Rick and Morty TV Programme",
 "books": " Người Lữ hành Kỳ Dị Book Hiểu về trái tim - Chữa lành trái tim Arts & humanities website Harry Potter Town/city The Five Dysfunctions of a Team Book",
 "app": " Hoa Dota 2 Nintendo Switch Scratch Maps in Vietnam - Bản Đồ Cào Lost Compass Hearthstone Bejeweled",
 "likes": " 1001 Chuyện Cân Nặng 1001 câu chuyện về Designer 15 Năm SHTP 1973 Workshop 20th Century Studios 3DMAKER",
 "backup_info": " 9+ 82 Pham Hoang Son EDUCATION University of Illinois Springfield Marketing · Business Administration 2011 - December 2013 Ho Chi Minh City University of Technology University WORK Jelly Key Navigator April 2016 - Present Ho Chi Minh City, Vietnam We Jelly Managing director Ho Chi Minh City, Vietnam Chúng Tôi Là Rau Câu Abbott Father in training July 2014 - 1 January 2016 Ho Chi Minh City, Vietnam Training to become a great father, especially for kid from 1 to 6. Pfizer(Thailand)Co.,Ltd May 2012 - 11 August 2012 Ho Chi Minh City, Vietnam PLACES LIVED Ho Chi Minh City, Vietnam Current town/city Springfield, Illinois Moved in 2011 CONTACT INFO /phamhoangson Facebook BASIC INFO Male Gender OTHER NAMES Patrick Other LIFE EVENTS PHOTOS VIDEOS CHECK-INS Hang động Tú Làn Đồng Hới Visited on 30 March 2021 Ariyana Convention Centre Danang Da Nang, Vietnam Visited on 23 January 2021 Cao Nguyên Đá Đồng Văn - Hà Giang Dồng Văn, Hà Giang, Vietnam Visited on 17 November 2020 Xa My Luong Cai Be Tien Vietnam Visited on 25 April 2020 SPORTS Thanh Hóa FC Since 1962 MUSIC NGUYENQUAN-Studio Record label The Violin Channel Arts and entertainment Techcombank Ho Chi Minh City International Marathon Sport YOUNG MUSIC Interest FILMS Cô Ba Sài Gòn Film Star Wars Film Nhắm Mắt Thấy Mùa Hè Film DẤU ẤN HÒA BÌNH Film TV PROGRAMMES Love Death + Robots TV Programme Agents of S.H.I.E.L.D. TV Programme American Crime Story: The Assassination of Gianni Versace TV Programme Rick and Morty TV Programme BOOKS Người Lữ hành Kỳ Dị Book Hiểu về trái tim - Chữa lành trái tim Arts & humanities website Harry Potter Town/city The Five Dysfunctions of a Team Book APPS AND GAMES Hoa Dota 2 Nintendo Switch Scratch Maps in Vietnam - Bản Đồ Cào Lost Compass Hearthstone Bejeweled LIKES 1001 Chuyện Cân Nặng 1001 câu chuyện về Designer 15 Năm SHTP 1973 Workshop 20th Century Studios 3DMAKER REVIEWS GIVEN Giao Giao Wonderland 5 stars The value you receive is more than what you spend. It isn't the cost of the paper or the ink. It's the dedication of the artist, fill with joy and love. Similac Vietnam 5 stars University of Illinois Springfield 5 stars Nước Bình An 5 stars",
 "contents": "null"
}