{
 "UID": "1478648780",
 "name": "Pham Minh Hieu",
 "education": " Hanoi University of Technology Machine learning School year 2010 THPT Trần Phú - Hoàn Kiếm High School",
 "work": " Tcty CP Thiết Bị Điện VN 1 October 2010 - Present",
 "placelive": " Hanoi, Vietnam Current town/city",
 "contact_info": " /hieu.phamminh.5 Facebook",
 "basic_info": " Male Gender English language Languages",
 "relationship": "null",
 "bio": "null",
 "checkin": " Pane e Vino - 3 Nguyễn Khắc Cần Hanoi, Vietnam Visited on 23 April 2019 Pane e Vino - 3 Nguyễn Khắc Cần Hanoi, Vietnam Visited on 1 January 2019 Intercontinental West Lake Hotel and Resort Hanoi, Vietnam Visited on 23 October 2018 Pane e Vino - 3 Nguyễn Khắc Cần Hanoi, Vietnam Visited on 23 October 2018",
 "sport": "SPORTS Giày Hoka Running Order - Xách tay - SALES",
 "music": " Monsoon Music Festival Festival Ruby and Jewelry Product/Service",
 "films": " Người phán xử Interest Giải Pháp Hàng Đầu Cho Bệnh Nhân Mỡ Máu Mỡ Gan Home decor Ma Thổi Đèn 网剧鬼吹灯 Film Grimm in Vietnam Film",
 "television": " Dự báo thời tiết VTV TV Programme Thời sự VTV Media/news company Khi cần chia sẻ Motivational speaker",
 "books": " Bác sỹ Aibôlít Book",
 "app": " 34Game Shop Thủ Lĩnh Đồ Chơi - Hot Wheels tiNiStore Mykingdom tiNiToy Mother Garden - đồ chơi gỗ an toàn của Nhật",
 "likes": " 1983's Wine & more 1986 Watch 1ship.vn - Sàn giao dịch hàng xách tay tiện lợi 247Express 34Game Shop 39 Concept",
 "backup_info": " 3 9+ Pham Minh Hieu WORK Tcty CP Thiết Bị Điện VN 1 October 2010 - Present EDUCATION Hanoi University of Technology Machine learning School year 2010 THPT Trần Phú - Hoàn Kiếm High School PLACES LIVED Hanoi, Vietnam Current town/city CONTACT INFO /hieu.phamminh.5 Facebook BASIC INFO Male Gender English language Languages OTHER NAMES Phạm Minh Hiếu Other LIFE EVENTS PHOTOS VIDEOS CHECK-INS Pane e Vino - 3 Nguyễn Khắc Cần Hanoi, Vietnam Visited on 23 April 2019 Pane e Vino - 3 Nguyễn Khắc Cần Hanoi, Vietnam Visited on 1 January 2019 Intercontinental West Lake Hotel and Resort Hanoi, Vietnam Visited on 23 October 2018 Pane e Vino - 3 Nguyễn Khắc Cần Hanoi, Vietnam Visited on 23 October 2018 SPORTS Giày Hoka Running Order - Xách tay - SALES MUSIC Monsoon Music Festival Festival Ruby and Jewelry Product/Service FILMS Người phán xử Interest Giải Pháp Hàng Đầu Cho Bệnh Nhân Mỡ Máu Mỡ Gan Home decor Ma Thổi Đèn 网剧鬼吹灯 Film Grimm in Vietnam Film TV PROGRAMMES Dự báo thời tiết VTV TV Programme Thời sự VTV Media/news company Khi cần chia sẻ Motivational speaker APPS AND GAMES 34Game Shop Thủ Lĩnh Đồ Chơi - Hot Wheels tiNiStore Mykingdom tiNiToy Mother Garden - đồ chơi gỗ an toàn của Nhật LIKES 1983's Wine & more 1986 Watch 1ship.vn - Sàn giao dịch hàng xách tay tiện lợi 247Express 34Game Shop 39 Concept REVIEWS GIVEN Trâm Nguyễn - Mỹ Phẩm Authentic 5 stars Thảo Dược Thiên Nhiên An Toàn Hiệu Quả 5 stars Quán ăn ngon, nhân viên thân thiện, địa điểm đẹp. Phở KAO - 374 Thái Hà Phở ngon, nhân viên chuyên nghiệp",
 "contents": "null"
}