{
 "UID": "100003353207245",
 "name": "Phan Tuấn Anh",
 "education": "null",
 "work": " ĐẠI ANH - Xây Dựng & Nội Thất operator 2020 - Present Cai Rong, Quảng Ninh, Vietnam",
 "placelive": " Hanoi, Vietnam Current town/city Thái Bình, Thái Bình, Vietnam Home town",
 "contact_info": " /tjkontb.phantuananh Facebook",
 "basic_info": " 5 October Date of birth Male Gender Tiếng Việt Languages",
 "relationship": "null",
 "bio": "ABOUT ANH không chỉ sống cho riêng mình",
 "checkin": " Cai Rong, Quảng Ninh, Vietnam Quảng Ninh Province Visited on 28 July 2021 Cai Rong, Quảng Ninh, Vietnam Quảng Ninh Province Visited on 31 December 2020 TP Vũng Tàu, Bà Rịa - Vũng Tàu Xa Vung Tau, Bà Rịa-Vũng Tàu, Vietnam Visited on 15 May 2016",
 "sport": "SPORTS Zumba Euroland",
 "music": " Happy Birthday Happy Birthday",
 "films": " Góc Cười Media/news company",
 "television": " ĐÔNG TRIỀU TÔI YÊU TV Programme",
 "books": " Thế Giới Truyện Interest",
 "app": " SKT Faker",
 "likes": " A One - Thi Công Nội Thất AGV Studio Atlantic Design - Thiết Kế & Thi Công Nội Thất/Kiến Trúc Autodaily.vn Azerbaycan+ Beautiful jewelry trend",
 "backup_info": " 4 5 9+ 45 Phan Tuấn Anh WORK ĐẠI ANH - Xây Dựng & Nội Thất operator 2020 - Present Cai Rong, Quảng Ninh, Vietnam PLACES LIVED Hanoi, Vietnam Current town/city Thái Bình, Thái Bình, Vietnam Home town CONTACT INFO /tjkontb.phantuananh Facebook BASIC INFO 5 October Date of birth Male Gender Tiếng Việt Languages OTHER NAMES Phan Tuấn Anh Other ABOUT ANH không chỉ sống cho riêng mình LIFE EVENTS FAVOURITE QUOTES sẽ là những khám phá PHOTOS VIDEOS CHECK-INS Cai Rong, Quảng Ninh, Vietnam Quảng Ninh Province Visited on 28 July 2021 Cai Rong, Quảng Ninh, Vietnam Quảng Ninh Province Visited on 31 December 2020 TP Vũng Tàu, Bà Rịa - Vũng Tàu Xa Vung Tau, Bà Rịa-Vũng Tàu, Vietnam Visited on 15 May 2016 SPORTS Zumba Euroland TV PROGRAMMES ĐÔNG TRIỀU TÔI YÊU TV Programme BOOKS Thế Giới Truyện Interest LIKES A One - Thi Công Nội Thất AGV Studio Atlantic Design - Thiết Kế & Thi Công Nội Thất/Kiến Trúc Autodaily.vn Azerbaycan+ Beautiful jewelry trend",
 "contents": "null"
}