{
 "UID": "100018447676794",
 "name": "Phận Bạc",
 "education": " THPT AN DUONG High School",
 "work": " Ho Chi Minh City, Vietnam Giám Đốc",
 "placelive": " Ho Chi Minh City, Vietnam Current town/city Hải Dương Home town",
 "contact_info": " /quan.vuvan.3979 Facebook",
 "basic_info": " Male Gender",
 "relationship": "null",
 "bio": "null",
 "checkin": " Bến Xe Đức Long, Gia Lai Pleiku Visited on 2 March 2022 Sân Bay Vinh Nghệ An Visited on 21 February 2022 Đền Thánh An-tôn, Linh địa Trại Gáo Vinh Visited on 18 January 2022 Highlands Coffee Lý Thường Kiệt Dĩ An Ho Chi Minh City, Vietnam Visited on 21 April 2021",
 "sport": "SPORTS FL.Gấu",
 "music": " CLB Âm Nhạc Đại Học Kiến Trúc Hà Nội Musician/Band Xuân Đỉnh Audio Electronics shop",
 "films": " Phimletoday Interest Thiên đường phim Thái - T zone Kites.vn Interest Yêu cổ trang Trung Quốc Interest Ghiền Phim Hoa Ngữ Video creator",
 "television": " Thần Tượng Tương Lai TV Programme Nước Gạo SunHee Food and drink Bách khoa Hàn Quốc Cosmetics shop",
 "books": " 책속의 처세 Book 오다가다 읽는 구절 Book 밑줄을 긋다 Book 달콤한책 Book",
 "app": " Coin Master",
 "likes": " 12.destiny 81 Gia Lai Atheneq Aubase Viet Nam Basics Vietnam Bà Chủ Ăn Vặt",
 "backup_info": " 9+ 82 Phận Bạc EDUCATION THPT AN DUONG High School WORK Ho Chi Minh City, Vietnam Giám Đốc PLACES LIVED Ho Chi Minh City, Vietnam Current town/city Hải Dương Home town CONTACT INFO /quan.vuvan.3979 Facebook BASIC INFO Male Gender OTHER NAMES Quân Thiểu Năng Nickname LIFE EVENTS FRIENDS Hoàng Trang Phan Thúy An Hanh Le Nguyễn Cường PHOTOS VIDEOS CHECK-INS Bến Xe Đức Long, Gia Lai Pleiku Visited on 2 March 2022 Sân Bay Vinh Nghệ An Visited on 21 February 2022 Đền Thánh An-tôn, Linh địa Trại Gáo Vinh Visited on 18 January 2022 Highlands Coffee Lý Thường Kiệt Dĩ An Ho Chi Minh City, Vietnam Visited on 21 April 2021 SPORTS FL.Gấu APPS AND GAMES Coin Master LIKES 12.destiny 81 Gia Lai Atheneq Aubase Viet Nam Basics Vietnam Bà Chủ Ăn Vặt REVIEWS GIVEN MUA BÁN NHÀ ĐẤT HỐC MÔN Quận 12 sdadsddsdsdsdsdsdsdsdsdsd Nhỏ TV vui hòa đồng rất ôkê về tác phong củng như chơi găme",
 "contents": "null"
}