{
 "UID": "1606146525",
 "name": "Phạm Đức Quân",
 "education": " Đại học Bách Khoa IT programming School year 2012 BK HA NOI University DHBK Ha Noi I.T. / Computer Technology Trường THPT Tứ Kỳ High School",
 "work": " ムサシベトナム CE0 1 May 2017 - Present Hanoi, Vietnam https://www.facebook.com/Musashi-250631562133933 株式会社ブリスウェル Briswell Ltd Software engineer 4 August 2015 - Present ビナヤマト 開発者 15 April 2014 - 1 August 2015 Koto Monstarlab Vietnam - Hanoi Software engineer Hanoi, Vietnam",
 "placelive": " Chiyoda Current town/city Hanoi, Vietnam Moved in 2017 Hải Dương Home town",
 "contact_info": " /boydiebylove Facebook",
 "basic_info": " Male Gender",
 "relationship": " Single",
 "bio": "null",
 "checkin": " Chiêu Lầu Thi - Hà Giang 2402M Hà Giang Visited on 27 March 2021 Sống lưng khủng long - tà xùa thiên đường mây Son La Visited on 13 June 2020 Sống lưng khủng long - Tà Xùa Vietnam Visited on 13 June 2020 Cửa Khẩu Lóng Sập-Mộc Châu Moc Chau Visited on 16 May 2020",
 "sport": "SPORTS Fashion Tira chuyen hang thiet ke",
 "music": " Thuy Nga - Paris By Night Record label Ca Sĩ Nhí Music video Sony Music Brasil Record label",
 "films": " Mọt Phim Ngôn Tình Trung Quốc Interest",
 "television": " Tastemade Japan Community Bạn Muốn Hẹn Hò? Arts and entertainment Hay.tv Publisher Nông nghiệp sạch Community organisation",
 "books": " Đường hai ngả, người thương thành lạ School/university Nếu biết trăm năm là hữu hạn Community",
 "app": " Temple Run HAYABUSA-CYBER",
 "likes": " 12 cung hoàng đạo 2Sao.vn 360 Boutique AGORA Vietnam - Mua Hàng Trực Tuyến Giá Tốt AGOS Japan　アゴスジャパン ALC PRESS INC. （株式会社アルク）",
 "backup_info": " 3 9+ Phạm Đức Quân WORK ムサシベトナム CE0 1 May 2017 - Present Hanoi, Vietnam https://www.facebook.com/Musashi-250631562133933 株式会社ブリスウェル Briswell Ltd Software engineer 4 August 2015 - Present ビナヤマト 開発者 15 April 2014 - 1 August 2015 Koto Monstarlab Vietnam - Hanoi Software engineer Hanoi, Vietnam EDUCATION Đại học Bách Khoa IT programming School year 2012 BK HA NOI University DHBK Ha Noi I.T. / Computer Technology Trường THPT Tứ Kỳ High School PLACES LIVED Chiyoda Current town/city Hanoi, Vietnam Moved in 2017 Hải Dương Home town CONTACT INFO /boydiebylove Facebook BASIC INFO Male Gender RELATIONSHIP Single LIFE EVENTS FRIENDS Phạm Hồng Sơn Sarah Anna Thành Phạm Bí Thúy PHOTOS VIDEOS CHECK-INS Chiêu Lầu Thi - Hà Giang 2402M Hà Giang Visited on 27 March 2021 Sống lưng khủng long - tà xùa thiên đường mây Son La Visited on 13 June 2020 Sống lưng khủng long - Tà Xùa Vietnam Visited on 13 June 2020 Cửa Khẩu Lóng Sập-Mộc Châu Moc Chau Visited on 16 May 2020 TV PROGRAMMES Tastemade Japan Community Bạn Muốn Hẹn Hò? Arts and entertainment Hay.tv Publisher Nông nghiệp sạch Community organisation APPS AND GAMES Temple Run HAYABUSA-CYBER LIKES 12 cung hoàng đạo 2Sao.vn 360 Boutique AGORA Vietnam - Mua Hàng Trực Tuyến Giá Tốt AGOS Japan　アゴスジャパン ALC PRESS INC. （株式会社アルク） REVIEWS GIVEN Chill Garden Ao có cá và siêu béo☺️",
 "contents": "null"
}