{
 "UID": "100004481976015",
 "name": "Quang Bui",
 "education": " Khoa CN Điện tử Thông tin - Viện Đại học Mở Hà Nội University School year 2005 vien dai hoc mo ha noi High School",
 "work": " Doanh Nghiệp TN Thanh Phú Manager Huong Canh, Vinh Phu, Vietnam",
 "placelive": " Vinh Yen Current town/city Phú Xuyên, Ha Noi, Vietnam Home town",
 "contact_info": " /quang.bui.1297943 Facebook",
 "basic_info": " Male Gender Men Interested in",
 "relationship": " Married",
 "bio": "null",
 "checkin": " Cổng Chợ Hương Canh Huong Canh, Vinh Phu, Vietnam Visited on 13 August 2021 Nha Tho Go Kontum Kon Tum Visited on 29 March 2021 Đại học Quốc Gia TP.HCM Ho Chi Minh City, Vietnam Visited on 4 March 2021 Muong So Phong Tho Lai Chau Phong Tho Visited on 23 January 2021",
 "sport": "SPORTS Manchester United",
 "music": " 365daband Musician/Band",
 "films": " Học Viện Sách Book Harry Potter Film",
 "television": " Hội những người thích xem TV Show TV Programme Street Food Around The World TV Programme アリティーヴィー株式会社(ariTV,inc.) Internet company",
 "books": " Nhật Ký Yêu Thương Arts and entertainment",
 "app": " Webgame Chân Long Giáng Thế",
 "likes": " 365daband Anna LaLa Ban tư vấn tuyển sinh vào 10 - Chuyên Hùng Vương BĐS TUY HÒA Bất Động Sản Thành Tín TP.HCM Cho thuê chung cư Hà Nội",
 "backup_info": " 2 9+ Quang Bui WORK Doanh Nghiệp TN Thanh Phú Manager Huong Canh, Vinh Phu, Vietnam EDUCATION Khoa CN Điện tử Thông tin - Viện Đại học Mở Hà Nội University School year 2005 vien dai hoc mo ha noi High School PLACES LIVED Vinh Yen Current town/city Phú Xuyên, Ha Noi, Vietnam Home town CONTACT INFO /quang.bui.1297943 Facebook BASIC INFO Male Gender Men Interested in RELATIONSHIP Married LIFE EVENTS FAVOURITE QUOTES mot nu cuoi bang muoi thang thuoc bo FRIENDS Nguyễn Hổ Châu Bùi Nguyễn Hữu Lợi Vũ Đạt PHOTOS VIDEOS CHECK-INS Cổng Chợ Hương Canh Huong Canh, Vinh Phu, Vietnam Visited on 13 August 2021 Nha Tho Go Kontum Kon Tum Visited on 29 March 2021 Đại học Quốc Gia TP.HCM Ho Chi Minh City, Vietnam Visited on 4 March 2021 Muong So Phong Tho Lai Chau Phong Tho Visited on 23 January 2021 SPORTS Manchester United MUSIC 365daband Musician/Band LIKES 365daband Anna LaLa Ban tư vấn tuyển sinh vào 10 - Chuyên Hùng Vương BĐS TUY HÒA Bất Động Sản Thành Tín TP.HCM Cho thuê chung cư Hà Nội",
 "contents": "null"
}