{
 "UID": "100002104286058",
 "name": "Quang Nguyen",
 "education": " Đại Học Công Nghiệp Hà Nội (HaUI) Điện tử - công nghệ viễn thông Quoc Oai High School, Ha Tay High School",
 "work": " SOJI Electronics 24 October 2015 - Present Hanoi, Vietnam Lisatech.vn",
 "placelive": " Hanoi, Vietnam Current town/city Hanoi, Vietnam Home town",
 "contact_info": " /Quangnguyen.haui Facebook",
 "basic_info": " Male Gender Women Interested in English language Languages",
 "relationship": " Single",
 "bio": "ABOUT QUANG About me: Họ: Nguyễn Đệm: Hữu Tên: Quang Tên đầy đủ là Nguyễn Hữu Quang.Sinh ngày 20-10-1992(trong giấy khai sinh là 21-10) là con cả trong một gia đình thuần nông, ông nội làm giáo viên. Cả bố và mẹ đều là nông dân nhưng do nhà không cấy nhiều ruộng nên từ nhỏ đã không phải đi cấy gặt. Cấp 1 học tập tập trường tiểu học nghĩa hương đây cũng là khoảng thời gian vô tư nhất không suy nghĩ gì nhiều và hầu như cuộc sống chỉ là ăn, ngủ, học và chơi. 5 năm học tập tại đây cũng đã đem lại một số thành quả đáng tự hào như 4 năm học sinh giỏi, thi học sinh giỏi cấp huyện các năm lớp 3,4. Lên cấp 2 học tại trường trung học cơ sở nghĩa hương do mải chơi nên không học được gì nhiều trong 4 năm học ở đây ngoại trừ một lần đi thi học sinh giỏi môn toán năm lớp 6 nhưng không đạt kết quả như mong muốn. Và đó cũng là lần đi thi học sinh giỏi cuối cùng trong thời học sinh. Lên cấp 3 may măn được học tại trường trung học phổ thông Quốc Oai. Đây là một ngôi trường mà tôi rất yêu quý cho đến tận bây giờ vì nó mang lại cho mình rất nhiều thứ từ kiến thức, tình cảm bạn bè và cả sự trải nghiệm. Tuy đi học xa nhà khoảng 3km nhưng đi cùng bạn bè nên vẫn cảm thấy vui. Thường rủ nhau ăn chè mỗi khi đi học về mỗi buổi trưa. Bắt đầu có sự đam mê học các môn tự nhiên toán lý hoá sinh từ đây nhưng chưa xác định thi vào trường gì vì lúc đó có niềm đam mê kinh doanh, buôn bán. Sau khi chị nhà bác động viên thi vào khoa điện tử tại trường đại học Công Nghiệp Hà Nội thì bắt đầu xác định từ đó. Sau khi thi đỗ vài trường đại học công nghiệp hà nội với 21 điểm, thừa 6 điêm và đứng thứ 11 của khoa cũng thấy tự hào sau bao năm vất vả học tập. Và hiện tại vẫn đang tiếp tục học tập và nghiên cứu tại trường đại học công nghiệp hà nội với chuyên ngành điện tử. Với hi vọng sau này áp dụng được những gì đã học vào cuộc sống, mong muốn xây dựng một hệ thống điều khiển tự động hoàn chỉnh cho một ngôi nhà thông minh... với tôi cuộc sống đơn giản là một cuộc chơi, nó như một cuộc hành trình để làm những việc mình thích, trải nghiệm và khám phá cuộc sống, có nhiều cách để nghĩ về cuộc sống và điều quan trọng nhất là chúng ta làm sao cho nó trở nên tốt đẹp hơn mà thôi. Sở thích: thích nghiên cứu khoa học, khám phá vũ trụ. Xem phim tài liệu, phim khoa học,phim về thiên nhiên, thế giới động vật... - thích theo dõi tin tức công nghệ trên thế giới. đặc biệt là các tin tức về công nghệ mới được áp dụng vào cuộc sông. - yêu thích lập trình, thiết kế, kinh doanh, buôn bán... nghề nào cũng có thể làm được miễn là hợp pháp và cái quan trọng nhất là nghề đó đem lại... nhiều lợi nhuận. - thích tìm tòi khám phá những cái mới, không ngừng tìm tòi những ý tưởng mới với hi vọng mọi thứ của ngày mai sẽ hoàn hảo hơn ngày hôm nay. - thích ngồi một mình, đi dạo một mình hoặc đi cùng người yêu. - thích xem đá bóng và đá bóng. Thích đánh cầu lông, Quần vợt,đá cầu, bơi lội... môn nào cũng biết nhưng không giỏi môn nào. -tính tình: thật thà, giúp đỡ người khác khi khó khăn. Được con gái nhận xét là chung tình. Không muốn làm hại ai cả. luôn luôn vui vẻ với mọi người vì trong cuộc sống không ai có thể làm cho mình buồn trừ khi mình cho phép. - mong muốn: mọi thứ đều tốt lên!",
 "checkin": " Hanoi, Vietnam Vietnam Visited on 24 October 2018 Bệnh viện đa khoa quốc tế Hồng Ngọc tầng 11 Landmark 72 Keangnam Hanoi, Vietnam Visited on 11 October 2017 Hanoi, Vietnam Vietnam Visited on 24 October 2015",
 "sport": "SPORTS Manchester United",
 "music": " theoyeucau Radio station",
 "films": " Walt Disney Studios Film Vietlike SHOP_Học tiếng anh qua phim- Cung cấp đĩa học tiếng anh Film",
 "television": " Khoa Học & Đời Sống TV Programme America's Got Talent TV Programme",
 "books": " The Fountainhead Book",
 "app": " Wartune at R2Games.com",
 "likes": " 30 Phút Tiếng Anh Mỗi Ngày 3E Rapid Prototyping Limited Adioma Infographics Alpha Books Altium America's Got Talent",
 "backup_info": " 4 5 9+ 45 Quang Nguyen EDUCATION Đại Học Công Nghiệp Hà Nội (HaUI) Điện tử - công nghệ viễn thông Quoc Oai High School, Ha Tay High School WORK SOJI Electronics 24 October 2015 - Present Hanoi, Vietnam Lisatech.vn PLACES LIVED Hanoi, Vietnam Current town/city Hanoi, Vietnam Home town CONTACT INFO /Quangnguyen.haui Facebook BASIC INFO Male Gender Women Interested in English language Languages RELATIONSHIP Single FAMILY MEMBERS Ngọc Giàu Older sister Vương Minh Phương Younger sister Trịnh Quốc Công Family member ABOUT QUANG About me: Họ: Nguyễn Đệm: Hữu Tên: Quang Tên đầy đủ là Nguyễn Hữu Quang.Sinh ngày 20-10-1992(trong giấy khai sinh là 21-10) là con cả trong một gia đình thuần nông, ông nội làm giáo viên. Cả bố và mẹ đều là nông dân nhưng do nhà không cấy nhiều ruộng nên từ nhỏ đã không phải đi cấy gặt. Cấp 1 học tập tập trường tiểu học nghĩa hương đây cũng là khoảng thời gian vô tư nhất không suy nghĩ gì nhiều và hầu như cuộc sống chỉ là ăn, ngủ, học và chơi. 5 năm học tập tại đây cũng đã đem lại một số thành quả đáng tự hào như 4 năm học sinh giỏi, thi học sinh giỏi cấp huyện các năm lớp 3,4. Lên cấp 2 học tại trường trung học cơ sở nghĩa hương do mải chơi nên không học được gì nhiều trong 4 năm học ở đây ngoại trừ một lần đi thi học sinh giỏi môn toán năm lớp 6 nhưng không đạt kết quả như mong muốn. Và đó cũng là lần đi thi học sinh giỏi cuối cùng trong thời học sinh. Lên cấp 3 may măn được học tại trường trung học phổ thông Quốc Oai. Đây là một ngôi trường mà tôi rất yêu quý cho đến tận bây giờ vì nó mang lại cho mình rất nhiều thứ từ kiến thức, tình cảm bạn bè và cả sự trải nghiệm. Tuy đi học xa nhà khoảng 3km nhưng đi cùng bạn bè nên vẫn cảm thấy vui. Thường rủ nhau ăn chè mỗi khi đi học về mỗi buổi trưa. Bắt đầu có sự đam mê học các môn tự nhiên toán lý hoá sinh từ đây nhưng chưa xác định thi vào trường gì vì lúc đó có niềm đam mê kinh doanh, buôn bán. Sau khi chị nhà bác động viên thi vào khoa điện tử tại trường đại học Công Nghiệp Hà Nội thì bắt đầu xác định từ đó. Sau khi thi đỗ vài trường đại học công nghiệp hà nội với 21 điểm, thừa 6 điêm và đứng thứ 11 của khoa cũng thấy tự hào sau bao năm vất vả học tập. Và hiện tại vẫn đang tiếp tục học tập và nghiên cứu tại trường đại học công nghiệp hà nội với chuyên ngành điện tử. Với hi vọng sau này áp dụng được những gì đã học vào cuộc sống, mong muốn xây dựng một hệ thống điều khiển tự động hoàn chỉnh cho một ngôi nhà thông minh... với tôi cuộc sống đơn giản là một cuộc chơi, nó như một cuộc hành trình để làm những việc mình thích, trải nghiệm và khám phá cuộc sống, có nhiều cách để nghĩ về cuộc sống và điều quan trọng nhất là chúng ta làm sao cho nó trở nên tốt đẹp hơn mà thôi. Sở thích: thích nghiên cứu khoa học, khám phá vũ trụ. Xem phim tài liệu, phim khoa học,phim về thiên nhiên, thế giới động vật... - thích theo dõi tin tức công nghệ trên thế giới. đặc biệt là các tin tức về công nghệ mới được áp dụng vào cuộc sông. - yêu thích lập trình, thiết kế, kinh doanh, buôn bán... nghề nào cũng có thể làm được miễn là hợp pháp và cái quan trọng nhất là nghề đó đem lại... nhiều lợi nhuận. - thích tìm tòi khám phá những cái mới, không ngừng tìm tòi những ý tưởng mới với hi vọng mọi thứ của ngày mai sẽ hoàn hảo hơn ngày hôm nay. - thích ngồi một mình, đi dạo một mình hoặc đi cùng người yêu. - thích xem đá bóng và đá bóng. Thích đánh cầu lông, Quần vợt,đá cầu, bơi lội... môn nào cũng biết nhưng không giỏi môn nào. -tính tình: thật thà, giúp đỡ người khác khi khó khăn. Được con gái nhận xét là chung tình. Không muốn làm hại ai cả. luôn luôn vui vẻ với mọi người vì trong cuộc sống không ai có thể làm cho mình buồn trừ khi mình cho phép. - mong muốn: mọi thứ đều tốt lên! LIFE EVENTS FAVOURITE QUOTES - Ước mơ khiến con người trở nên vĩ đại!  - Cuộc sống không phải là làm sao để chịu đựng cho qua cơn bão, mà là làm sao để biết nhảy múa trong những cơn mưa.  - Cuộc sống rất công bằng, nếu bạn cảm thấy nó bất công với bạn thì chỉ tại bạn chưa tìm thấy sự công bằng với bản thân mà thôi. PHOTOS CHECK-INS Hanoi, Vietnam Vietnam Visited on 24 October 2018 Bệnh viện đa khoa quốc tế Hồng Ngọc tầng 11 Landmark 72 Keangnam Hanoi, Vietnam Visited on 11 October 2017 Hanoi, Vietnam Vietnam Visited on 24 October 2015 SPORTS Manchester United MUSIC theoyeucau Radio station FILMS Walt Disney Studios Film Vietlike SHOP_Học tiếng anh qua phim- Cung cấp đĩa học tiếng anh Film TV PROGRAMMES Khoa Học & Đời Sống TV Programme America's Got Talent TV Programme BOOKS The Fountainhead Book LIKES 30 Phút Tiếng Anh Mỗi Ngày 3E Rapid Prototyping Limited Adioma Infographics Alpha Books Altium America's Got Talent",
 "contents": "null"
}