{
 "UID": "100000109610362",
 "name": "Quan Vu Hoang",
 "education": " Chu Van An High School (Hanoi) High School",
 "work": " AA Corporation",
 "placelive": " Hanoi, Vietnam Current town/city Hanoi, Vietnam Home town",
 "contact_info": " /quan.vuhoang.94 Facebook",
 "basic_info": " Male Gender",
 "relationship": " Married",
 "bio": "null",
 "checkin": "null",
 "sport": "null",
 "music": "null",
 "films": "null",
 "television": "null",
 "books": "null",
 "app": "null",
 "likes": "null",
 "backup_info": " 1 5 9+ 32 Quan Vu Hoang EDUCATION Chu Van An High School (Hanoi) High School WORK AA Corporation PLACES LIVED Hanoi, Vietnam Current town/city Hanoi, Vietnam Home town CONTACT INFO /quan.vuhoang.94 Facebook BASIC INFO Male Gender RELATIONSHIP Married LIFE EVENTS FRIENDS Bùi Thảo Linh Dương Thúy Nga Hoang Bac Bui Hoàng Phương PHOTOS CHECK-INS Mochi Sweets Lotte Center Hanoi, Vietnam Visited on 11 November 2018 Klever Fruits 23b Phan Đình Phùng Hanoi, Vietnam Visited on 14 July 2017 MUSIC Nhạc Trịnh Công Sơn Musician LIKES Alo2buy - Hàng authentic nội địa Châu Âu Architecture & Design Batdongsan.com.vn BoConcept Công ty Cổ Phần PVT Studio Gốm Thổ Hoàng - Bát Tràng REVIEWS GIVEN Klever Fruit 21B Phan Đình Phùng 5 stars"
}