{
 "UID": "100003216738969",
 "name": "Quân Lê Ceramics",
 "education": " NEU - National Economic University Kinh tế học School year 2001 Đại học Công Đoàn Administration cấp 3 việt trì High School School year 2002 Truong trung hoc pho thong Viet Tri High School",
 "work": " Công Ty TNHH Quân Anh Ceramic Chủ tịch hội đồng quản trị - Giám đốc 4 December 2017 - Present Thành phố Việt Trì, tỉnh Phú Thọ Viet Tri Chief executive officer 6 August 2002 - 6 October 2012 Đường Đinh Tiên Hoàng, Phường Nông Trang, TP Việt Trì TỔNG KHO GẠCH MEN VIỆT TRÌ PHÚ THỌ",
 "placelive": " Viet Tri Current town/city Viet Tri Home town",
 "contact_info": " 039 876 5555 Mobile 093 406 68 66 Mobile Hanoi, Vietnam Address /quancmc Facebook quancmc.vt@gmail.com Email address",
 "basic_info": " 3 September Date of birth Male Gender Men and women Interested in English language Languages",
 "relationship": " In an open relationship",
 "bio": "null",
 "checkin": " Chùa Hải Hội Mân Quang Da Nang, Vietnam Visited on 3 February 2022 Trạm Thu Phí - IC8 Phù Ninh Phú Thọ Phù Ninh Visited on 15 June 2021 Trạm Thu Phí - IC8 Phù Ninh Phú Thọ Phù Ninh Visited on 14 January 2021 Khách sạn 5 sao Tân Sơn Nhất Ho Chi Minh City, Vietnam Visited on 8 January 2021",
 "sport": "SPORTS Bích Câu PL Manchester United FC Barcelona",
 "music": " Happy Birthday Happy Birthday",
 "films": " Top Phim Hay Film Breaking Dawn Film James Bond 007 Film HBO TV network",
 "television": " Cung Xem TV network Mua Nhà ở Nhật - Tobama 不動産 Estate agents Thời sự VTV Media/news company Ơn Giời Cậu Đây Rồi Arts and entertainment",
 "books": " FB STAR Interest The New York Times Media/news company",
 "app": " League of Stickman slither.io Clash of Clans",
 "likes": " 30 Phút Tiếng Anh Mỗi Ngày 666.ST Adam Store Việt Trì Admin Mỹ Tâm ▷ Hiệp Hội Mất Ngủ Aladin Cafe Alibaba.com",
 "backup_info": " 9+ 80 Quân Lê Ceramics EDUCATION NEU - National Economic University Kinh tế học School year 2001 Đại học Công Đoàn Administration cấp 3 việt trì High School School year 2002 Truong trung hoc pho thong Viet Tri High School WORK Công Ty TNHH Quân Anh Ceramic Chủ tịch hội đồng quản trị - Giám đốc 4 December 2017 - Present Thành phố Việt Trì, tỉnh Phú Thọ Viet Tri Chief executive officer 6 August 2002 - 6 October 2012 Đường Đinh Tiên Hoàng, Phường Nông Trang, TP Việt Trì TỔNG KHO GẠCH MEN VIỆT TRÌ PHÚ THỌ PLACES LIVED Viet Tri Current town/city Viet Tri Home town CONTACT INFO 039 876 5555 Mobile 093 406 68 66 Mobile Hanoi, Vietnam Address /quancmc Facebook quancmc.vt@gmail.com Email address BASIC INFO 3 September Date of birth Male Gender Men and women Interested in English language Languages RELATIONSHIP In an open relationship LIFE EVENTS FAVOURITE QUOTES yêu cuộc sống của người mỹ...:X PHOTOS VIDEOS CHECK-INS Chùa Hải Hội Mân Quang Da Nang, Vietnam Visited on 3 February 2022 Trạm Thu Phí - IC8 Phù Ninh Phú Thọ Phù Ninh Visited on 15 June 2021 Trạm Thu Phí - IC8 Phù Ninh Phú Thọ Phù Ninh Visited on 14 January 2021 Khách sạn 5 sao Tân Sơn Nhất Ho Chi Minh City, Vietnam Visited on 8 January 2021 SPORTS Bích Câu PL Manchester United FC Barcelona MUSIC Happy Birthday Happy Birthday FILMS Top Phim Hay Film Breaking Dawn Film James Bond 007 Film HBO TV network TV PROGRAMMES Cung Xem TV network Mua Nhà ở Nhật - Tobama 不動産 Estate agents Thời sự VTV Media/news company Ơn Giời Cậu Đây Rồi Arts and entertainment BOOKS FB STAR Interest The New York Times Media/news company APPS AND GAMES League of Stickman slither.io Clash of Clans LIKES 30 Phút Tiếng Anh Mỗi Ngày 666.ST Adam Store Việt Trì Admin Mỹ Tâm ▷ Hiệp Hội Mất Ngủ Aladin Cafe Alibaba.com REVIEWS GIVEN Sci Barbershop & Studio ok shop, cần thay đổi không gian shop",
 "contents": "null"
}