{
 "UID": "100003734094240",
 "name": "Thach Nguyen",
 "education": " Nha Trang University University 12A1 Nha Trang University University Trường THPT Số 2 Phù Cát High School",
 "work": "null",
 "placelive": " Nha Trang Current town/city Binh Dinh, Nghia Binh, Vietnam Home town",
 "contact_info": " /thach.nguyen.186 Facebook",
 "basic_info": " Male Gender",
 "relationship": " Married since 4 January 2014",
 "bio": "null",
 "checkin": " Đề Gi Binh Dinh, Nghia Binh, Vietnam Visited on 22 June 2018 Nha Trang Khánh Hòa Province Visited on 9 May 2018 Đề Gi Quy Nhon Visited on 28 May 2015 Đề Gi Cát Khánh Phù Cát Bình Định Vietnam Visited on 28 May 2015",
 "sport": "SPORTS Manchester United",
 "music": " Sưu tầm Động vật Charitable organisation",
 "films": " Fast & Furious Film The Expendables 3 Film Shades of Blue (Sombras de Azul) Film Pooja Kiven AA Film",
 "television": " Nhân Duyên Interest",
 "books": " TTND Comic Book",
 "app": " BAOAN Game & Puzzles Tam Sinh Tam Thế H5 Letarie Chuyên sỉ lồng đèn trung thu việt nam Hoa Cải Non Sense9 - Tranh Tối Giản",
 "likes": " Ambassador Corporation Bão Trên \"Tây Bắc Thái Bình Dương\". Capnangluongmattroi Chè Liên Đà Nẵng - CN Đông Hà, Đồng Hới Công Ty TNHH Nguồn Sáng Công Ty Vệ Sinh Hoàng Anh",
 "backup_info": " 9+ 9 9+ 57 Thach Nguyen EDUCATION Nha Trang University University 12A1 Nha Trang University University Trường THPT Số 2 Phù Cát High School PLACES LIVED Nha Trang Current town/city Binh Dinh, Nghia Binh, Vietnam Home town CONTACT INFO /thach.nguyen.186 Facebook BASIC INFO Male Gender RELATIONSHIP Married since 4 January 2014 LIFE EVENTS PHOTOS CHECK-INS Đề Gi Binh Dinh, Nghia Binh, Vietnam Visited on 22 June 2018 Nha Trang Khánh Hòa Province Visited on 9 May 2018 Đề Gi Quy Nhon Visited on 28 May 2015 Đề Gi Cát Khánh Phù Cát Bình Định Vietnam Visited on 28 May 2015 MUSIC Sưu tầm Động vật Charitable organisation TV PROGRAMMES Nhân Duyên Interest LIKES Ambassador Corporation Bão Trên \"Tây Bắc Thái Bình Dương\". Capnangluongmattroi Chè Liên Đà Nẵng - CN Đông Hà, Đồng Hới Công Ty TNHH Nguồn Sáng Công Ty Vệ Sinh Hoàng Anh REVIEWS GIVEN Đề Gi 2 stars",
 "contents": "null"
}