{
 "UID": "100001317862011",
 "name": "Thang Huu",
 "education": " HUTECH - Trường Đại học Công nghệ TP.HCM University cao dang xay dung so 2 University THPT Nguyen Viet Xuan High School nguyen viet xuan High School",
 "work": " Coteccons ENGINEER ANNA SHOPS Structural Engineer",
 "placelive": " Ho Chi Minh City, Vietnam Current town/city Ap Tan Ha, Lâm Ðồng, Vietnam Home town",
 "contact_info": " /thang.huu.50 Facebook",
 "basic_info": " Male Gender",
 "relationship": "null",
 "bio": "ABOUT THANG thu sinh chinh hang",
 "checkin": " Vườn Ẩm thực Lộc Ấn Ho Chi Minh City, Vietnam Visited on 27 December 2019 Lo Lu Quan 9 Tp Hcm Ho Chi Minh City, Vietnam Visited on 15 April 2019 The Grand Ho Tram Strip Ap My An, Vietnam Visited on 8 July 2018 Pullman Saigon Centre Ho Chi Minh City, Vietnam Visited on 31 March 2018",
 "sport": "SPORTS FC Bayern München Arsenal Stretty News Manchester United",
 "music": " Đinh Kiến Phong Album",
 "films": " Onlyu.info nơi clip thăng hoa Interest Thiết kế web - vjn.vn Local business Chung Tử đơn Film",
 "television": " Charm Beauty Shopping and retail",
 "books": " Truyện Tranh Online Interest",
 "app": " Công Thành Chiến Đế Chế Soha Võ Lâm Chi Mộng Say mê Bóng Đá FIFA",
 "likes": " 1 triệu Like kêu gọi ông Nguyễn Bá Thanh lên làm thủ tướng A Vui ALC Corporation AMZship: Nhận order - ship hàng từ Mỹ về Việt Nam ANICCA READY-MADE Alisia Group",
 "backup_info": " 1 9+ Thang Huu WORK Coteccons ENGINEER ANNA SHOPS Structural Engineer EDUCATION HUTECH - Trường Đại học Công nghệ TP.HCM University cao dang xay dung so 2 University THPT Nguyen Viet Xuan High School nguyen viet xuan High School PLACES LIVED Ho Chi Minh City, Vietnam Current town/city Ap Tan Ha, Lâm Ðồng, Vietnam Home town CONTACT INFO /thang.huu.50 Facebook BASIC INFO Male Gender ABOUT THANG thu sinh chinh hang LIFE EVENTS FAVOURITE QUOTES du co sao di chang nua thi cung chang sao, nhau van say binh thuong PHOTOS VIDEOS CHECK-INS Vườn Ẩm thực Lộc Ấn Ho Chi Minh City, Vietnam Visited on 27 December 2019 Lo Lu Quan 9 Tp Hcm Ho Chi Minh City, Vietnam Visited on 15 April 2019 The Grand Ho Tram Strip Ap My An, Vietnam Visited on 8 July 2018 Pullman Saigon Centre Ho Chi Minh City, Vietnam Visited on 31 March 2018 SPORTS FC Bayern München Arsenal Stretty News Manchester United MUSIC Đinh Kiến Phong Album FILMS Onlyu.info nơi clip thăng hoa Interest Thiết kế web - vjn.vn Local business Chung Tử đơn Film TV PROGRAMMES Charm Beauty Shopping and retail BOOKS Truyện Tranh Online Interest APPS AND GAMES Công Thành Chiến Đế Chế Soha Võ Lâm Chi Mộng Say mê Bóng Đá FIFA LIKES 1 triệu Like kêu gọi ông Nguyễn Bá Thanh lên làm thủ tướng A Vui ALC Corporation AMZship: Nhận order - ship hàng từ Mỹ về Việt Nam ANICCA READY-MADE Alisia Group REVIEWS GIVEN Newtecons 5 stars",
 "contents": "null"
}