{
 "UID": "100005699526229",
 "name": "Thanh Nguyễn",
 "education": "null",
 "work": "null",
 "placelive": " Cao Lãnh Current town/city Cao Lãnh Home town",
 "contact_info": "null",
 "basic_info": " Male Gender",
 "relationship": "null",
 "bio": "null",
 "checkin": " Ho Chi Minh City, Vietnam Ho Chi Minh City Visited on 16 November 2017 Đồi chè Đăk Nông Buon Dong Ding, Đắc Lắk, Vietnam Visited on 10 November 2017 Bến Thuyền Tam Cốc, Ninh Bình Van Lam Visited on 13 October 2017 Hon Da Bac, Ca Mau Cà Mau Visited on 8 December 2016",
 "sport": "SPORTS Câu Lạc Bộ Bóng Đá Đồng Tháp",
 "music": " Dạy Thanh Nhạc Grace Arts and entertainment",
 "films": " Universal Pictures Film/Television studio",
 "television": " Phật Pháp Nhiệm Màu Interest Bạn Muốn Hẹn Hò? Arts and entertainment Gương Mặt Thân Quen TV Programme Vì Yêu Mà Đến Public figure",
 "books": " Người Lữ hành Kỳ Dị Book",
 "app": " Làng Danh Vọng Liên Quân Mini World",
 "likes": " Amulet Shop - Xăm phép Sak Yant nổi tiếng Thái Lan Bakichquangninh Bao 1 Biển Đông Seafood-Grill Blogtamsu Món Ngon Hàng Ngày Bluesea - Dịch Vụ Cho Thuê Đầu Số",
 "backup_info": " 9+ 9 9+ 57 Thanh Nguyễn PLACES LIVED Cao Lãnh Current town/city Cao Lãnh Home town BASIC INFO Male Gender OTHER NAMES Nguyễn quốc Thanh Other LIFE EVENTS PHOTOS VIDEOS CHECK-INS Ho Chi Minh City, Vietnam Ho Chi Minh City Visited on 16 November 2017 Đồi chè Đăk Nông Buon Dong Ding, Đắc Lắk, Vietnam Visited on 10 November 2017 Bến Thuyền Tam Cốc, Ninh Bình Van Lam Visited on 13 October 2017 Hon Da Bac, Ca Mau Cà Mau Visited on 8 December 2016 SPORTS Câu Lạc Bộ Bóng Đá Đồng Tháp MUSIC Dạy Thanh Nhạc Grace Arts and entertainment TV PROGRAMMES Phật Pháp Nhiệm Màu Interest Bạn Muốn Hẹn Hò? Arts and entertainment Gương Mặt Thân Quen TV Programme Vì Yêu Mà Đến Public figure APPS AND GAMES Làng Danh Vọng Liên Quân Mini World LIKES Amulet Shop - Xăm phép Sak Yant nổi tiếng Thái Lan Bakichquangninh Bao 1 Biển Đông Seafood-Grill Blogtamsu Món Ngon Hàng Ngày Bluesea - Dịch Vụ Cho Thuê Đầu Số",
 "contents": "null"
}