{
 "UID": "100023016603634",
 "name": "Thanh Trà",
 "education": " Trường Đời University Trường Đời High School",
 "work": " Hanoi, Vietnam",
 "placelive": " Hanoi, Vietnam Current town/city Hanoi, Vietnam Home town",
 "contact_info": " /nhim.xinh.3382 Facebook",
 "basic_info": " Female Gender",
 "relationship": "null",
 "bio": "null",
 "checkin": " Bãi Biển Thịnh Long - Nam Định Ninh Hai, Ha Nam Ninh, Vietnam Visited on 11 August 2019 Khu Du Lịch Biển Thịnh Long Khu Du Lich Bien Thinh Long Vietnam Visited on 21 July 2019 Bãi Biển Thịnh Long - Nam Định Ninh Hai, Ha Nam Ninh, Vietnam Visited on 9 June 2019 KIÊN XOĂN.Hair Salon 82Hậu Dưỡng Hanoi, Vietnam Visited on 27 December 2018",
 "sport": "SPORTS Juve Stabia Nel Cuore",
 "music": " BAR TV Entertainment Clothes shop Deep Love Entertainment Media/news company Việt Mix Plus Music video",
 "films": " Gãy TV Interest",
 "television": " 秀姐美食领域者 Episode",
 "books": " Namiko - Namiko From Japan Book",
 "app": " Football Hero GameXD XGN Ur Dose Of League E-Ride On Toys PH Hỏi Ngu",
 "likes": " An Lành BAR TV Entertainment Blog Tâm Sự Blog Tâm Sự TV Blogtamsu Chuyện Chúng Mình Báo Vietnamnet",
 "backup_info": " 3 9+ Thanh Trà WORK Hanoi, Vietnam EDUCATION Trường Đời University Trường Đời High School PLACES LIVED Hanoi, Vietnam Current town/city Hanoi, Vietnam Home town CONTACT INFO /nhim.xinh.3382 Facebook BASIC INFO Female Gender OTHER NAMES Nhím Nickname LIFE EVENTS PHOTOS VIDEOS CHECK-INS Bãi Biển Thịnh Long - Nam Định Ninh Hai, Ha Nam Ninh, Vietnam Visited on 11 August 2019 Khu Du Lịch Biển Thịnh Long Khu Du Lich Bien Thinh Long Vietnam Visited on 21 July 2019 Bãi Biển Thịnh Long - Nam Định Ninh Hai, Ha Nam Ninh, Vietnam Visited on 9 June 2019 KIÊN XOĂN.Hair Salon 82Hậu Dưỡng Hanoi, Vietnam Visited on 27 December 2018 MUSIC BAR TV Entertainment Clothes shop Deep Love Entertainment Media/news company Việt Mix Plus Music video FILMS Gãy TV Interest LIKES An Lành BAR TV Entertainment Blog Tâm Sự Blog Tâm Sự TV Blogtamsu Chuyện Chúng Mình Báo Vietnamnet",
 "contents": "null"
}