{
 "UID": "100000698321988",
 "name": "Thuan Vu",
 "education": " 崑山科技大學 Kun Shan University University School year 2010 IMBA Trường ĐH BKHN University School year 2008 Trường ĐH CNTN University School year 1994 THPT Hòn Gai High School School year 1989",
 "work": " thuanvublog.com ad 1 August 2019 - Present Hanoi, Vietnam My blog here: https://thuanvublog.com/ Thiết bị y tế - Chăm sóc sức khỏe - Halongsky.com www.halongsky.com 2013 - Present Thiết bị y tế - Chăm sóc sức khỏe - Halongsky.com Managing Director 2012 - Present Hanoi, Vietnam Công ty TNHH Tư vấn và Công nghệ Bầu trời Hạ long (Halong Sky Consulting & Technology Company Limited, Halongsky Co., Ltd.) chuyên nhập khẩu hàng chính hãng và phân phối các thiết bị y tế, thiết bị... Petrolimex Consultant In 2012 Hanoi, Vietnam Piacom PM 2010 - 2012",
 "placelive": " Hanoi, Vietnam Current town/city",
 "contact_info": " /thuan.vuthanh.7 Facebook",
 "basic_info": " Male Gender English language and Mandarin Chinese Languages",
 "relationship": " Married",
 "bio": "ABOUT THUAN no dream is ever too small, no dream is ever too big",
 "checkin": " Hanoi, Vietnam Vietnam Visited on 27 August 2019 Hanoi, Vietnam Vietnam Visited on 1 August 2019 Bệnh Viện Đa Khoa Tỉnh Quảng Ninh Ha Long Visited on 28 January 2019 Masteri Thảo Điền Visited on 10 March 2018",
 "sport": "SPORTS Chelsea Football Club",
 "music": " Nhung nguoi cao tuoi Radio station",
 "films": " Tử Vi Mỗi Ngày Just for fun",
 "television": " Chợ Tốt Local business CEO - Chìa khóa thành công TV Programme",
 "books": " Linh Nguyen Personal blog Vô Thường Interest",
 "app": " 泰坦之戰：暗黑戰神 War of Titans",
 "likes": " \bDanco Thời trang thể thao Đa Dụng - SUF 10s Thư Giãn 15 phút một ngày 29 Hàn Thuyên 30s NÓNG 6,700 người vì 6,700 cây xanh",
 "backup_info": " 9+ 80 Thuan Vu EDUCATION 崑山科技大學 Kun Shan University University School year 2010 IMBA Trường ĐH BKHN University School year 2008 Trường ĐH CNTN University School year 1994 THPT Hòn Gai High School School year 1989 WORK thuanvublog.com ad 1 August 2019 - Present Hanoi, Vietnam My blog here: https://thuanvublog.com/ Thiết bị y tế - Chăm sóc sức khỏe - Halongsky.com www.halongsky.com 2013 - Present Thiết bị y tế - Chăm sóc sức khỏe - Halongsky.com Managing Director 2012 - Present Hanoi, Vietnam Công ty TNHH Tư vấn và Công nghệ Bầu trời Hạ long (Halong Sky Consulting & Technology Company Limited, Halongsky Co., Ltd.) chuyên nhập khẩu hàng chính hãng và phân phối các thiết bị y tế, thiết bị... Petrolimex Consultant In 2012 Hanoi, Vietnam Piacom PM 2010 - 2012 PLACES LIVED Hanoi, Vietnam Current town/city CONTACT INFO /thuan.vuthanh.7 Facebook BASIC INFO Male Gender English language and Mandarin Chinese Languages OTHER NAMES Vũ Thành Thuấn Maiden name RELATIONSHIP Married FAMILY MEMBERS Nguyen Phuong Anh Family member ABOUT THUAN no dream is ever too small, no dream is ever too big LIFE EVENTS PHOTOS VIDEOS CHECK-INS Hanoi, Vietnam Vietnam Visited on 27 August 2019 Hanoi, Vietnam Vietnam Visited on 1 August 2019 Bệnh Viện Đa Khoa Tỉnh Quảng Ninh Ha Long Visited on 28 January 2019 Masteri Thảo Điền Visited on 10 March 2018 SPORTS Chelsea Football Club MUSIC Nhung nguoi cao tuoi Radio station FILMS Tử Vi Mỗi Ngày Just for fun TV PROGRAMMES Chợ Tốt Local business CEO - Chìa khóa thành công TV Programme BOOKS Linh Nguyen Personal blog Vô Thường Interest LIKES \bDanco Thời trang thể thao Đa Dụng - SUF 10s Thư Giãn 15 phút một ngày 29 Hàn Thuyên 30s NÓNG 6,700 người vì 6,700 cây xanh REVIEWS GIVEN Liquid Nano Curcumin OIC 5 stars LNCO cực kỳ tốt cho người bị tiểu cầu mãn , mọi người tìm LNCO mà mua nhé Du lịch Hồ Núi Cốc 3 stars",
 "contents": "null"
}