{
 "UID": "100004027043772",
 "name": "Thuy Pham",
 "education": " dai hoc cong doan University School year 2004",
 "work": " Vietracimex",
 "placelive": " Hanoi, Vietnam Current town/city Hải Dương Home town",
 "contact_info": "null",
 "basic_info": " Female Gender",
 "relationship": "null",
 "bio": "null",
 "checkin": " Quận Hai Bà Trưng Hà Nội Hanoi, Vietnam Visited on 18 November 2017 Times City Hanoi, Vietnam Visited on 28 December 2015 Royal City Hanoi, Vietnam Visited on 7 December 2015 Phạm Studio 25 Quán Thánh Vietnam Visited on 5 June 2015",
 "sport": "SPORTS Armychess",
 "music": " Grandmusic - HH3C Linh Đàm Musician/Band",
 "films": " Rambo Film",
 "television": " Her Voice Health/Beauty VTV7 KIDS TV channel Quà tặng cuộc sống TV Programme Phật Tại Tâm Interest",
 "books": " Sách Cho Con Book Tủ Sách Tinh Hoa Book",
 "app": " Máy bay điều khiển từ xa Câu lạc bộ Montessori Giáo cụ Montessori - Oreka Ludojocus",
 "likes": " 1001 Bí kíp Dạy con trưởng thành 5-Minute Crafts 60giay.com A365 ADCBookiz AEON MALL Long Bien",
 "backup_info": " 9+ 80 Thuy Pham EDUCATION dai hoc cong doan University School year 2004 WORK Vietracimex PLACES LIVED Hanoi, Vietnam Current town/city Hải Dương Home town BASIC INFO Female Gender FAMILY MEMBERS Daisy Pham Family member LIFE EVENTS PHOTOS VIDEOS CHECK-INS Quận Hai Bà Trưng Hà Nội Hanoi, Vietnam Visited on 18 November 2017 Times City Hanoi, Vietnam Visited on 28 December 2015 Royal City Hanoi, Vietnam Visited on 7 December 2015 Phạm Studio 25 Quán Thánh Vietnam Visited on 5 June 2015 SPORTS Armychess MUSIC Grandmusic - HH3C Linh Đàm Musician/Band TV PROGRAMMES Her Voice Health/Beauty VTV7 KIDS TV channel Quà tặng cuộc sống TV Programme Phật Tại Tâm Interest BOOKS Sách Cho Con Book Tủ Sách Tinh Hoa Book APPS AND GAMES Máy bay điều khiển từ xa Câu lạc bộ Montessori Giáo cụ Montessori - Oreka Ludojocus LIKES 1001 Bí kíp Dạy con trưởng thành 5-Minute Crafts 60giay.com A365 ADCBookiz AEON MALL Long Bien REVIEWS GIVEN Hinode City",
 "contents": "null"
}