{
 "UID": "100000207724577",
 "name": "Thuy Mai",
 "education": " Phan Ngoc Hien High School",
 "work": " Dịch vụ cưới hỏi, đám tiệc, trang trí trọn gói Minh Minh Thúy 29 April 2015 - Present Cty Tổ Chức Sự Kiện - Dịch vụ cưới hỏi trọn gói Minh Thuý. Số 162/24 Trần Ngọc Quế, Xuân Khánh, Ninh Kiều, Cần Thơ",
 "placelive": " Can Tho Current town/city Can Tho Home town",
 "contact_info": " /thuymai1981 Facebook",
 "basic_info": " Men and women Interested in",
 "relationship": " Married since 23 November 2002",
 "bio": "null",
 "checkin": " Răng Hàm Mặt Sài Gòn - Cần Thơ Can Tho Visited on 11 January 2022 DV Cưới Hỏi MMT Cần Thơ Can Tho Visited on 24 May 2018 Công Viên Lưu Hữu Phước Can Tho Visited on 14 March 2016 Dịch vụ cưới hỏi, đám tiệc, trang trí trọn gói Minh Minh Thúy Can Tho Visited on 31 January 2016",
 "sport": "SPORTS Real Madrid C.F.",
 "music": " Nơi yêu cầu sheet nhạc Community Vương Nhất Bác 王一博 - UNIQ's Wang Yibo 1st Vietnamese Fanpage Actor TVXQ \\ DBSK \\ Tohoshinki Musician/Band Super Junior Interest",
 "films": " Bébés fashion Interest",
 "television": " John Constantine Fanpage Việt Nam TV Programme Thiếu Niên Nói TV network",
 "books": " FamilyBooks - Tủ Sách Gia Đình Interest Kiếp trước em đã chôn cất cho anh Book Anh Có Thích Nước Mỹ Không Book Chuyện Tình New York Book",
 "app": " Unimob Games Game Resort",
 "likes": " 1994 Coffee ABI HOUSE - Chăn ga gối Alibaba.com Alifis Home & Decor Angel studio Angiaphat's Bedding - Chăn Drap Gối Cao Cấp",
 "backup_info": " 1 9+ Thuy Mai WORK Dịch vụ cưới hỏi, đám tiệc, trang trí trọn gói Minh Minh Thúy 29 April 2015 - Present Cty Tổ Chức Sự Kiện - Dịch vụ cưới hỏi trọn gói Minh Thuý. Số 162/24 Trần Ngọc Quế, Xuân Khánh, Ninh Kiều, Cần Thơ EDUCATION Phan Ngoc Hien High School PLACES LIVED Can Tho Current town/city Can Tho Home town CONTACT INFO /thuymai1981 Facebook BASIC INFO Men and women Interested in RELATIONSHIP Married since 23 November 2002 LIFE EVENTS 2021 Cột mốc thay đổi bản thân PHOTOS VIDEOS CHECK-INS Răng Hàm Mặt Sài Gòn - Cần Thơ Can Tho Visited on 11 January 2022 DV Cưới Hỏi MMT Cần Thơ Can Tho Visited on 24 May 2018 Công Viên Lưu Hữu Phước Can Tho Visited on 14 March 2016 Dịch vụ cưới hỏi, đám tiệc, trang trí trọn gói Minh Minh Thúy Can Tho Visited on 31 January 2016 FILMS Bébés fashion Interest TV PROGRAMMES John Constantine Fanpage Việt Nam TV Programme Thiếu Niên Nói TV network APPS AND GAMES Unimob Games Game Resort LIKES 1994 Coffee ABI HOUSE - Chăn ga gối Alibaba.com Alifis Home & Decor Angel studio Angiaphat's Bedding - Chăn Drap Gối Cao Cấp",
 "contents": "null"
}