{
 "UID": "722219993",
 "name": "Tien Hi",
 "education": " ĐH SƯ PHẠM KỸ THUẬT TP HCM University (postgraduate) Le Quy Don High School High School",
 "work": " Innovus JSC Driver Thiết Bị Khí Nén Aignep Delivery Driver Ho Chi Minh City, Vietnam FESTO VIETNAM Giải trí viên kiêm Trút giận viên",
 "placelive": " Ho Chi Minh City, Vietnam Current town/city Da Nang, Vietnam Home town",
 "contact_info": " /tien.hi.7 Facebook",
 "basic_info": " Male Gender",
 "relationship": "null",
 "bio": "null",
 "checkin": " Sân Bay Quốc Tế Nội Bài Hanoi, Vietnam Visited on 20 March 2022 Vinpearl Hotel Hue Hue, Vietnam Visited on 7 February 2022 ด่านสากนพูเกีอ.lao-Vietnam Dak Le Kram, Gia Lai-Cong Tum, Vietnam Visited on 7 February 2022 Măng Đen Đại Ngàn Kon Tum Visited on 6 February 2022",
 "sport": "SPORTS Bbchoichoi Team Real Madrid C.F. Manchester United",
 "music": " Heroboard Interest",
 "films": " Cô Gái Xấu Xí Film",
 "television": " Nông nghiệp sạch Community organisation",
 "books": " Đọc sách hay là chết? Book shop",
 "app": "",
 "likes": " 43 Foods 5-Minute Crafts GIRLY AEON Vietnam AZB Joint Stock Company Aacons AiHealth: Ứng dụng tìm bác sĩ",
 "backup_info": " 3 9+ Tien Hi WORK Innovus JSC Driver Thiết Bị Khí Nén Aignep Delivery Driver Ho Chi Minh City, Vietnam FESTO VIETNAM Giải trí viên kiêm Trút giận viên EDUCATION ĐH SƯ PHẠM KỸ THUẬT TP HCM University (postgraduate) Le Quy Don High School High School PLACES LIVED Ho Chi Minh City, Vietnam Current town/city Da Nang, Vietnam Home town CONTACT INFO /tien.hi.7 Facebook BASIC INFO Male Gender FAMILY MEMBERS Cỏ Đêm Younger sister LIFE EVENTS FRIENDS Nghia Ngo Nt Hieu Nguyen Tai Hieu Nguyen PHOTOS SPORTS Bbchoichoi Team Real Madrid C.F. Manchester United TV PROGRAMMES Nông nghiệp sạch Community organisation BOOKS Đọc sách hay là chết? Book shop LIKES 43 Foods 5-Minute Crafts GIRLY AEON Vietnam AZB Joint Stock Company Aacons AiHealth: Ứng dụng tìm bác sĩ REVIEWS GIVEN INEST JSC 4 stars Camera Robot Amaryllo 5 stars Một phương thức an toàn - giúp bảo vệ chính bạn và người thân của bạn....",
 "contents": "null"
}