{
 "UID": "100005430906301",
 "name": "Tony Tai",
 "education": " THPT Vũng Tàu University Trung Học Phổ Thông Đinh Tiên Hoàng Thành Phố Vũng Tàu High School",
 "work": " OSC Vietnam",
 "placelive": " Xa Vung Tau, Bà Rịa-Vũng Tàu, Vietnam Current town/city Cho Thu Thua, Long An, Vietnam Home town",
 "contact_info": " /tai.leminh.9659 Facebook",
 "basic_info": " Male Gender",
 "relationship": "null",
 "bio": "null",
 "checkin": " Ngôi Nhà Nhỏ Trong Cái Hẻm Nhỏ Xíu Vung Tau Visited on 7 March 2015 Bàu Lâm Xuyên Mộc Bà Rịa Vũng Tàu Xom Xa Nam, Vietnam Visited on 10 October 2013 Bàu Lâm Xuyên Mộc Bà Rịa Vũng Tàu Xom Xa Nam, Vietnam Visited on 9 October 2013",
 "sport": "SPORTS Bóng Đá Cười",
 "music": " Hey TV Just for fun",
 "films": " Phim hài - HÃNG PHIM BÌNH MINH Interest",
 "television": " Hay.tv Publisher Vietnam Idol TV Programme Clip Hot Trên Mạng Just for fun",
 "books": " Đọc Truyện Online Library",
 "app": " Hay Day",
 "likes": " Acoustic.com.vn - Coffee and live Music Alibaba.com Angel Cat Shop Baby&Mommy - Hàng Úc Xách Tay Blog Tâm Sự Giải Trí Btalk",
 "backup_info": " 9+ 9 9+ 57 Tony Tai EDUCATION THPT Vũng Tàu University Trung Học Phổ Thông Đinh Tiên Hoàng Thành Phố Vũng Tàu High School WORK OSC Vietnam PLACES LIVED Xa Vung Tau, Bà Rịa-Vũng Tàu, Vietnam Current town/city Cho Thu Thua, Long An, Vietnam Home town CONTACT INFO /tai.leminh.9659 Facebook BASIC INFO Male Gender FAMILY MEMBERS Chu La Daughter LIFE EVENTS FRIENDS Nguyễn Nga Đỗ Xuân Tâm Đỗ Vinh Ễn Nguyễn Thanh Phượng PHOTOS VIDEOS CHECK-INS Ngôi Nhà Nhỏ Trong Cái Hẻm Nhỏ Xíu Vung Tau Visited on 7 March 2015 Bàu Lâm Xuyên Mộc Bà Rịa Vũng Tàu Xom Xa Nam, Vietnam Visited on 10 October 2013 Bàu Lâm Xuyên Mộc Bà Rịa Vũng Tàu Xom Xa Nam, Vietnam Visited on 9 October 2013 SPORTS Bóng Đá Cười MUSIC Hey TV Just for fun TV PROGRAMMES Hay.tv Publisher Vietnam Idol TV Programme Clip Hot Trên Mạng Just for fun APPS AND GAMES Hay Day LIKES Acoustic.com.vn - Coffee and live Music Alibaba.com Angel Cat Shop Baby&Mommy - Hàng Úc Xách Tay Blog Tâm Sự Giải Trí Btalk",
 "contents": "null"
}