{
 "UID": "100005409643865",
 "name": "Toán Bùi",
 "education": " Khoa Kế Toán, Đại học Điện lực Kế toán Trung hoc pho thong Xuan Truong a High School",
 "work": " Cổ phần xây dựng vận tải Trường Tân",
 "placelive": " Nam Định, Nam Định, Vietnam Current town/city Xuan Truong Home town",
 "contact_info": "null",
 "basic_info": " Male Gender",
 "relationship": "null",
 "bio": "null",
 "checkin": " Sân Bay Quốc Tế Tân Sơn Nhất - Tan Son Nhat International Airport Ho Chi Minh City, Vietnam Visited on 1 May 2019 Lac Quan, Ha Nam Ninh, Vietnam Nam Định Province Visited on 12 March 2018 Điện máy Toán Thơm- ngã ba Cầu Lạc Quần , huyện Xuân Trường , tỉnh Nam Định Ngoc Tinh, Ha Nam Ninh, Vietnam Visited on 16 February 2018 Chùa Keo La Xuyên, Thái Bình, Vietnam Visited on 2 November 2017",
 "sport": "SPORTS Sắc Màu Jotun - NPP Hồng Nhâm Chicago Bulls",
 "music": " Làm mái che di động Quảng Ngãi bạt mái hiên che nắng trượt tự cuốn xếp kéo Album",
 "films": " Phim hài - HÃNG PHIM BÌNH MINH Interest",
 "television": " DIYbaby- Đồ chơi tự làm TV network Dự báo thời tiết VTV TV Programme Truyền hình FPT Play Sport AUTO TV - Trong Thế Giới Xe TV Programme",
 "books": " Đọc Truyện Online Library",
 "app": " Drag Racing",
 "likes": " AUTO TV - Trong Thế Giới Xe Alibaba.com An Phước - Pierre Cardin AnphatHouse Ariston Arra79",
 "backup_info": " 9+ 9 9+ 57 Toán Bùi EDUCATION Khoa Kế Toán, Đại học Điện lực Kế toán Trung hoc pho thong Xuan Truong a High School WORK Cổ phần xây dựng vận tải Trường Tân PLACES LIVED Nam Định, Nam Định, Vietnam Current town/city Xuan Truong Home town BASIC INFO Male Gender LIFE EVENTS FRIENDS Cử Son Trần Toán Phạm Nam Nguyễn Đạt PHOTOS VIDEOS CHECK-INS Sân Bay Quốc Tế Tân Sơn Nhất - Tan Son Nhat International Airport Ho Chi Minh City, Vietnam Visited on 1 May 2019 Lac Quan, Ha Nam Ninh, Vietnam Nam Định Province Visited on 12 March 2018 Điện máy Toán Thơm- ngã ba Cầu Lạc Quần , huyện Xuân Trường , tỉnh Nam Định Ngoc Tinh, Ha Nam Ninh, Vietnam Visited on 16 February 2018 Chùa Keo La Xuyên, Thái Bình, Vietnam Visited on 2 November 2017 SPORTS Sắc Màu Jotun - NPP Hồng Nhâm Chicago Bulls FILMS Phim hài - HÃNG PHIM BÌNH MINH Interest TV PROGRAMMES DIYbaby- Đồ chơi tự làm TV network Dự báo thời tiết VTV TV Programme Truyền hình FPT Play Sport AUTO TV - Trong Thế Giới Xe TV Programme LIKES AUTO TV - Trong Thế Giới Xe Alibaba.com An Phước - Pierre Cardin AnphatHouse Ariston Arra79",
 "contents": "null"
}