{
 "UID": "100003298645350",
 "name": "Trinh Nguyễn",
 "education": " Học viện Tư pháp Đào tạo nghề Luật sư Đại học Sài Gòn ( Saigon University - SGU ) Luật",
 "work": "null",
 "placelive": " Ho Chi Minh City, Vietnam Current town/city",
 "contact_info": " /rosie.oncloud Facebook",
 "basic_info": " Female Gender",
 "relationship": " Single",
 "bio": "null",
 "checkin": " Học viện Tư pháp cơ sở TPHCM Ho Chi Minh City, Vietnam Visited on 19 March 2018 Học Viện Tư Pháp Tp HCM Ho Chi Minh City, Vietnam Visited on 4 June 2017 KFC Thanh Đa Ho Chi Minh City, Vietnam Visited on 8 March 2017 Trung tâm ngoại ngữ SGV Ho Chi Minh City, Vietnam Visited on 31 January 2016",
 "sport": "SPORTS FC_Khoa Luật",
 "music": " Happy Birthday Happy Birthday",
 "films": " Góc Cười Media/news company",
 "television": " Shark Tank Việt Nam TV Programme Hội cười 24h - vnfunz.vn Sport and recreation Phim Hoạt Hình Film",
 "books": " Bookademy - Viện Sách News & media website Đọc Truyện Online Interest Tiểu Thuyết Lãng Mạn Book",
 "app": " mạo hiểm",
 "likes": " 176.Nhà May HÀNG ĐẸP LẺ & SỈ 1988homeup.vn AN HÒA - đôˋ gia dụng AN VIÊN Cosmetics Co.,Ltd Aby's House - AbySkincare AlexD Music Insight",
 "backup_info": " 9+ 80 Trinh Nguyễn EDUCATION Học viện Tư pháp Đào tạo nghề Luật sư Đại học Sài Gòn ( Saigon University - SGU ) Luật PLACES LIVED Ho Chi Minh City, Vietnam Current town/city CONTACT INFO /rosie.oncloud Facebook BASIC INFO Female Gender OTHER NAMES Rosie Nickname RELATIONSHIP Single LIFE EVENTS PHOTOS VIDEOS CHECK-INS Học viện Tư pháp cơ sở TPHCM Ho Chi Minh City, Vietnam Visited on 19 March 2018 Học Viện Tư Pháp Tp HCM Ho Chi Minh City, Vietnam Visited on 4 June 2017 KFC Thanh Đa Ho Chi Minh City, Vietnam Visited on 8 March 2017 Trung tâm ngoại ngữ SGV Ho Chi Minh City, Vietnam Visited on 31 January 2016 SPORTS FC_Khoa Luật FILMS Góc Cười Media/news company TV PROGRAMMES Shark Tank Việt Nam TV Programme Hội cười 24h - vnfunz.vn Sport and recreation Phim Hoạt Hình Film BOOKS Bookademy - Viện Sách News & media website Đọc Truyện Online Interest Tiểu Thuyết Lãng Mạn Book APPS AND GAMES mạo hiểm LIKES 176.Nhà May HÀNG ĐẸP LẺ & SỈ 1988homeup.vn AN HÒA - đôˋ gia dụng AN VIÊN Cosmetics Co.,Ltd Aby's House - AbySkincare AlexD Music Insight REVIEWS GIVEN In hộp giấy số lượng ít 5 stars In giấy đẹp, hộp cứng cáp, tư vấn nhiệt tình ��� Summer Shop 5 stars Mình nhận được 2 set bikini rồi nhé. Nói thiệt là rất ưng ���. Tks shop � Trung Tâm Ngoại Ngữ Saigonvina Cơ Sở 4 5 stars Học phí rẻ, nhân viên dễ thương, giáo viên dạy tận tình. Mình rất thích (y) Karaoke Anh Thư 5 stars ���",
 "contents": "null"
}