{
 "UID": "100003567122532",
 "name": "Trung Pnt Phạm",
 "education": " TC VIET KHOA Design (kunst) THPT Nguyễn Trường Tộ High School",
 "work": " TEDA STORE Maketing manager 29 November 2020 to present Ho Chi Minh City, Vietnam Bán áo áo thun Đồng Phục Thiên Phước - May áo thun đồng phục chất lượng CEO Ho Chi Minh City, Vietnam Tshirts4u - Thời trang áo thun Designer Làm Áo Lớp Giá Rẻ TPHCM shiper",
 "placelive": " Thành phố Hồ Chí Minh, Hồ Chí Minh, Vietnam Current town/city Fantiet, Bình Thuận, Vietnam Home town",
 "contact_info": " /trung.pnt Facebook",
 "basic_info": " Male Gender Women Interested in",
 "relationship": " Married since 24 September 2015",
 "bio": "ABOUT PHẠM Sản xuất áo thun đồng phục, áo thun thời trang...",
 "checkin": " Đồng Phục Thiên Phước - TPuni Ho Chi Minh City, Vietnam Visited on 12 February 2022 Đồng Phục Thiên Phước - TPuni Ho Chi Minh City, Vietnam Visited on 14 January 2022 Cafe Lõm Xanh Ho Chi Minh City, Vietnam Visited on 1 January 2022 Đồng Phục Thiên Phước - TPuni Ho Chi Minh City, Vietnam Visited on 20 November 2021",
 "sport": "SPORTS Bóng Đá Cười Ghost Riderz Bangladesh Real Madrid C.F. Europa Football Dream Through Movement [DTM Freerun] Vovinam Viet Vo Dao",
 "music": " Mỹ Phẩm Skinaz Hàn Quốc Chính Hãng -Mari Hồ Cosmetics shop Fan Studio Music production studio ಌღ Hạnh Phúc Nhé - Người Lạ Tớ Từng Yêu ღಌ Personal blog Bài Học Cuộc Sống Community",
 "films": " Fast & Furious Film The Expendables 3 Film Shades of Blue (Sombras de Azul) Film Pooja Kiven AA Film",
 "television": " Ask A Wizard Magician BTN/GZSZ/DSDS/Frauentausch etc. - Der Smalltalk zur Sendung TV Programme Legends DTV TV network 123tv.vn - Video quảng cáo chuyên nghiệp Advertising agency",
 "books": " Nhật ký Cung Hoàng Đạo Home Tangled Passion Book 2012 Hurricane by Arnaldo Ricciulli Book Đọc sách hay là chết? Book shop",
 "app": " BAOAN Game & Puzzles Tam Sinh Tam Thế H5 Letarie Chuyên sỉ lồng đèn trung thu việt nam Hoa Cải Non Sense9 - Tranh Tối Giản",
 "likes": " \"Food Safety News & Business Strategies\" *'Ünlüler ~ Moda'* 1 2 3 Nụ Cười 104.5 The Beat - WBNY 123tv.vn - Video quảng cáo chuyên nghiệp 15s.vn",
 "backup_info": " 4 5 9+ 45 Trung Pnt Phạm EDUCATION TC VIET KHOA Design (kunst) THPT Nguyễn Trường Tộ High School WORK TEDA STORE Maketing manager 29 November 2020 to present Ho Chi Minh City, Vietnam Bán áo áo thun Đồng Phục Thiên Phước - May áo thun đồng phục chất lượng CEO Ho Chi Minh City, Vietnam Tshirts4u - Thời trang áo thun Designer Làm Áo Lớp Giá Rẻ TPHCM shiper PLACES LIVED Thành phố Hồ Chí Minh, Hồ Chí Minh, Vietnam Current town/city Fantiet, Bình Thuận, Vietnam Home town CONTACT INFO /trung.pnt Facebook BASIC INFO Male Gender Women Interested in OTHER NAMES Trung Đồng Phục Nickname RELATIONSHIP Married since 24 September 2015 ABOUT PHẠM Sản xuất áo thun đồng phục, áo thun thời trang... LIFE EVENTS FRIENDS Hồng Phước Indo Vương Ngọc Thành Nguyễn Thang Nguyen PHOTOS VIDEOS CHECK-INS Đồng Phục Thiên Phước - TPuni Ho Chi Minh City, Vietnam Visited on 12 February 2022 Đồng Phục Thiên Phước - TPuni Ho Chi Minh City, Vietnam Visited on 14 January 2022 Cafe Lõm Xanh Ho Chi Minh City, Vietnam Visited on 1 January 2022 Đồng Phục Thiên Phước - TPuni Ho Chi Minh City, Vietnam Visited on 20 November 2021 SPORTS Bóng Đá Cười Ghost Riderz Bangladesh Real Madrid C.F. Europa Football Dream Through Movement [DTM Freerun] Vovinam Viet Vo Dao MUSIC Mỹ Phẩm Skinaz Hàn Quốc Chính Hãng -Mari Hồ Cosmetics shop Fan Studio Music production studio ಌღ Hạnh Phúc Nhé - Người Lạ Tớ Từng Yêu ღಌ Personal blog Bài Học Cuộc Sống Community FILMS Fast & Furious Film The Expendables 3 Film Shades of Blue (Sombras de Azul) Film Pooja Kiven AA Film TV PROGRAMMES Ask A Wizard Magician BTN/GZSZ/DSDS/Frauentausch etc. - Der Smalltalk zur Sendung TV Programme Legends DTV TV network 123tv.vn - Video quảng cáo chuyên nghiệp Advertising agency BOOKS Nhật ký Cung Hoàng Đạo Home Tangled Passion Book 2012 Hurricane by Arnaldo Ricciulli Book Đọc sách hay là chết? Book shop APPS AND GAMES BAOAN Game & Puzzles Tam Sinh Tam Thế H5 Letarie Chuyên sỉ lồng đèn trung thu việt nam Hoa Cải Non Sense9 - Tranh Tối Giản LIKES \"Food Safety News & Business Strategies\" *'Ünlüler ~ Moda'* 1 2 3 Nụ Cười 104.5 The Beat - WBNY 123tv.vn - Video quảng cáo chuyên nghiệp 15s.vn REVIEWS GIVEN AN KHANG SPA 5 stars làm trắng da Bentula 5 stars Tshirts4u - Thời trang áo thun 5 stars áo đẹp, vải tốt, thích cái nhiệt tình... Good Kho Áo Thun Giá Sỉ 5 stars Áo thun đẹp, giá chất, tuyệt vời ông mặt trời :)",
 "contents": "null"
}