{
 "UID": "100016020376216",
 "name": "Trương Minh Trường",
 "education": " Trường Đại học Quang Trung University School year 2013 THPT Quang Trung, An Khê, Gia Lai High School",
 "work": " Ruvet Vietnam Managing Director 24 May 2017 - Present Da Lat Dalatmilk - Sữa Đà Lạt Quản Lý 22 March 2016 - 16 January 2018 Đức Long Gia Lai Group Quản Lý 18 September 2015 - 2016 Tập đoàn Hoàng Anh Gia Lai Engineer Technician 18 April 2014 - 7 December 2015",
 "placelive": " Phu Thanh, Lâm Ðồng, Vietnam Current town/city Banlung Moved in 2013 Tinh Pleiku, Gia Lai, Vietnam Home town",
 "contact_info": " /truongminhtruongmanager Facebook",
 "basic_info": " Male Gender Women Interested in",
 "relationship": " Phan Uyên Married Since 28 November 2021",
 "bio": "null",
 "checkin": " Kho Hang SCSC San Bay Tan Son Nhat Ho Chi Minh City, Vietnam Visited on 30 March 2022 Namban, Lâm Ðồng, Vietnam Lâm Đồng Province Visited on 28 March 2022 Mang Yang, Gia Lai, Vietnam Gia Lai, Gia Lai, Vietnam Visited on 15 March 2022 Ruvet Vietnam Djrott, Lâm Ðồng, Vietnam Visited on 5 March 2022",
 "sport": "SPORTS Điện máy quang sáng",
 "music": " Lao Youth Radio FM 90.0 Mhz Radio station Media Wedding Music video The Beef Space Playlist",
 "films": " Phimletoday Interest Thiên đường phim Thái - T zone Kites.vn Interest Yêu cổ trang Trung Quốc Interest Ghiền Phim Hoa Ngữ Video creator",
 "television": " Café Khởi Nghiệp TV Programme La Finca de Hoy TV Programme mitomchamtv Wholesale and supply shop Thuốc thú y GIANG HẰNG Episode",
 "books": " Từ Tốt Đến Vĩ Đại Book Suy Nghĩ Và Làm Giàu Book ATP BOOK Book Sách Hay Hãy Cùng Nhau Đọc Book",
 "app": " Thơ Nguyễn Family Shop",
 "likes": " 1001 Công Thức 123muahangmy.com Ship Hàng Amazon, Ebay 1985's Watches 2 Khánh trên Youtube 30 Phút Tiếng Anh Mỗi Ngày A Chanh Tran",
 "backup_info": " 3 9+ Trương Minh Trường WORK Ruvet Vietnam Managing Director 24 May 2017 - Present Da Lat Dalatmilk - Sữa Đà Lạt Quản Lý 22 March 2016 - 16 January 2018 Đức Long Gia Lai Group Quản Lý 18 September 2015 - 2016 Tập đoàn Hoàng Anh Gia Lai Engineer Technician 18 April 2014 - 7 December 2015 EDUCATION Trường Đại học Quang Trung University School year 2013 THPT Quang Trung, An Khê, Gia Lai High School PLACES LIVED Phu Thanh, Lâm Ðồng, Vietnam Current town/city Banlung Moved in 2013 Tinh Pleiku, Gia Lai, Vietnam Home town CONTACT INFO /truongminhtruongmanager Facebook BASIC INFO Male Gender Women Interested in OTHER NAMES Chăn bò tại Ruvet.vn Other Ruvet VietNam Birth name RELATIONSHIP Phan Uyên Married Since 28 November 2021 LIFE EVENTS FAVOURITE QUOTES Bạn sinh ra trong nghèo khổ không phải lỗi do bạn, nhưng khi bạn chết đi trong nghèo khổ đó là lỗi của bạn! FRIENDS Thú Y Công Luis Ecosafra Phúc Lương Mebipha Miền Bắc PHOTOS VIDEOS CHECK-INS Kho Hang SCSC San Bay Tan Son Nhat Ho Chi Minh City, Vietnam Visited on 30 March 2022 Namban, Lâm Ðồng, Vietnam Lâm Đồng Province Visited on 28 March 2022 Mang Yang, Gia Lai, Vietnam Gia Lai, Gia Lai, Vietnam Visited on 15 March 2022 Ruvet Vietnam Djrott, Lâm Ðồng, Vietnam Visited on 5 March 2022 MUSIC Lao Youth Radio FM 90.0 Mhz Radio station Media Wedding Music video The Beef Space Playlist TV PROGRAMMES Café Khởi Nghiệp TV Programme La Finca de Hoy TV Programme mitomchamtv Wholesale and supply shop Thuốc thú y GIANG HẰNG Episode BOOKS Từ Tốt Đến Vĩ Đại Book Suy Nghĩ Và Làm Giàu Book ATP BOOK Book Sách Hay Hãy Cùng Nhau Đọc Book LIKES 1001 Công Thức 123muahangmy.com Ship Hàng Amazon, Ebay 1985's Watches 2 Khánh trên Youtube 30 Phút Tiếng Anh Mỗi Ngày A Chanh Tran REVIEWS GIVEN Công Ty TNHH Viễn Thông Minh Khang 5 stars Ruvet Vietnam 5 stars Công ty dịch vụ thú y - giải pháp dinh dưỡng cho bò sữa, bò thịt chuyên nghiệp tại Việt Nam",
 "contents": "null"
}