{
 "UID": "1696707971",
 "name": "Trần Anh Tuấn",
 "education": " Trường Đại học Điện lực University THCS Mai Dich High School",
 "work": "null",
 "placelive": " Hanoi, Vietnam Current town/city Hanoi, Vietnam Home town",
 "contact_info": " /trantuan6890 Facebook",
 "basic_info": " Women Interested in",
 "relationship": " Single",
 "bio": "null",
 "checkin": " Lẩu Dê Nhất Ly Hanoi, Vietnam Visited on 21 January 2019 FPTShop 262 Tân Thành - Phú Thọ Phu Tho, Phú Thọ, Vietnam Visited on 11 November 2016 Fpt Shop 216 Thái Hà Hanoi, Vietnam Visited on 8 December 2015 Đảo Cô Tô Quảng Yên, Quảng Ninh, Vietnam Visited on 8 June 2015",
 "sport": "SPORTS ManUtd Việt Nam Manchester United",
 "music": " Kênh Nhạc Hay Video creator TV Smart home Interest My Tam Artist HQMusic.info - Chốn về của những tâm hồn yêu nhạc Album",
 "films": " Phim Rạp Entertainment website",
 "television": " MTV Vietnam TV network Hội Quán Cười Community",
 "books": " Real Kid Books Book Sống và Khát Vọng Community LifeBook - Cuốn Sách Cuộc Đời Book Mọt sách's confession Book",
 "app": " Saiyan Store Dragon Ball Shop TOYz - Premium Collectibles 34Game Shop TTGshop Trực Tiếp Game",
 "likes": " 2HandVn 34Game Shop 3D Bách Khoa A.Bê - Hair Salon - 트렌드에 ACFC Swooshlife AGOSTO Store",
 "backup_info": " 3 9+ Trần Anh Tuấn EDUCATION Trường Đại học Điện lực University THCS Mai Dich High School PLACES LIVED Hanoi, Vietnam Current town/city Hanoi, Vietnam Home town CONTACT INFO /trantuan6890 Facebook BASIC INFO Women Interested in RELATIONSHIP Single LIFE EVENTS FRIENDS Quỳnh Chi Hải Thuỷ Hải Xuân Vũ Khánh Toàn PHOTOS CHECK-INS Lẩu Dê Nhất Ly Hanoi, Vietnam Visited on 21 January 2019 FPTShop 262 Tân Thành - Phú Thọ Phu Tho, Phú Thọ, Vietnam Visited on 11 November 2016 Fpt Shop 216 Thái Hà Hanoi, Vietnam Visited on 8 December 2015 Đảo Cô Tô Quảng Yên, Quảng Ninh, Vietnam Visited on 8 June 2015 SPORTS ManUtd Việt Nam Manchester United MUSIC Kênh Nhạc Hay Video creator TV Smart home Interest My Tam Artist HQMusic.info - Chốn về của những tâm hồn yêu nhạc Album FILMS Phim Rạp Entertainment website TV PROGRAMMES MTV Vietnam TV network Hội Quán Cười Community APPS AND GAMES Saiyan Store Dragon Ball Shop TOYz - Premium Collectibles 34Game Shop TTGshop Trực Tiếp Game LIKES 2HandVn 34Game Shop 3D Bách Khoa A.Bê - Hair Salon - 트렌드에 ACFC Swooshlife AGOSTO Store",
 "contents": "null"
}