{
 "UID": "100000470516257",
 "name": "Tung Do Khanh",
 "education": "null",
 "work": "null",
 "placelive": " Hanoi, Vietnam Current town/city Bắc Ninh Home town",
 "contact_info": " /tung.dokhanh.7 Facebook",
 "basic_info": " Male Gender Women Interested in",
 "relationship": " Married",
 "bio": "null",
 "checkin": " Nguyên Khê- Đông Anh- Hà Nội Hanoi, Vietnam Visited on 8 October 2021 Miền Đông Nước Anh Hanoi, Vietnam Visited on 30 September 2021 Hanoi, Vietnam Vietnam Visited on 21 August 2021 Nguyên Khê- Đông Anh- Hà Nội Hanoi, Vietnam Visited on 10 July 2021",
 "sport": "SPORTS Fc Manchester United in Việt Nam ManUtd Việt Nam",
 "music": " Zenio Jewellery/Watches Quang Le Music Lê Hiếu Music Nhạc Trịnh Music",
 "films": " Phim Hành Động Võ Thuật Interest Câu Lạc Bộ Phim Hay Interest Phim Rạp Entertainment website",
 "television": " Ngày ấy mình đã yêu Interest Clip Hot Trên Mạng Just for fun Vietnam Idol Local business",
 "books": " Hội thích truyện trinh thám Book",
 "app": " Cyber Hunter An Shop - Xe Mô Hình Tomica S-Eleven CÔNG TY BẤT ĐỘNG SẢN THIÊN KHÔI",
 "likes": " 512TrươngĐịnh-Chuyên Mở khóa Icloud iPhone X 6S 7 8 Plus 10 Lấy Ngay 69Store - 16 Thợ Nhuộm 9 Cười ASE Vietnam CO., LTD ATTN: Video AX home",
 "backup_info": " 4 5 9+ 45 Tung Do Khanh PLACES LIVED Hanoi, Vietnam Current town/city Bắc Ninh Home town CONTACT INFO /tung.dokhanh.7 Facebook BASIC INFO Male Gender Women Interested in OTHER NAMES Dau Bac Other RELATIONSHIP Married LIFE EVENTS PHOTOS VIDEOS CHECK-INS Nguyên Khê- Đông Anh- Hà Nội Hanoi, Vietnam Visited on 8 October 2021 Miền Đông Nước Anh Hanoi, Vietnam Visited on 30 September 2021 Hanoi, Vietnam Vietnam Visited on 21 August 2021 Nguyên Khê- Đông Anh- Hà Nội Hanoi, Vietnam Visited on 10 July 2021 SPORTS Fc Manchester United in Việt Nam ManUtd Việt Nam FILMS Phim Hành Động Võ Thuật Interest Câu Lạc Bộ Phim Hay Interest Phim Rạp Entertainment website TV PROGRAMMES Ngày ấy mình đã yêu Interest Clip Hot Trên Mạng Just for fun Vietnam Idol Local business BOOKS Hội thích truyện trinh thám Book APPS AND GAMES Cyber Hunter An Shop - Xe Mô Hình Tomica S-Eleven CÔNG TY BẤT ĐỘNG SẢN THIÊN KHÔI LIKES 512TrươngĐịnh-Chuyên Mở khóa Icloud iPhone X 6S 7 8 Plus 10 Lấy Ngay 69Store - 16 Thợ Nhuộm 9 Cười ASE Vietnam CO., LTD ATTN: Video AX home",
 "contents": "null"
}