{
 "UID": "1515907443",
 "name": "Viet Dinh",
 "education": " ENS de Cachan University School year 2009 Hanoi University of Technology University School year 2003 Université de Rennes 1 University HNUE High school for gifted students High School",
 "work": " Microsoft 2020 - Present Experian August 2017 - 2020 Oracle March 2011 - July 2017 Viettel Telecom October 2010 - March 2011 INRIA September 2009 - June 2010 Oracle Vietnam June 2008 - July 2009",
 "placelive": " Ho Chi Minh City, Vietnam Current town/city Rennes, France Moved here Hanoi, Vietnam Home town",
 "contact_info": " /dinhtuanviet Facebook",
 "basic_info": " Male Gender",
 "relationship": " Mèo Thư Mèo Married See photos of Viet and Mèo",
 "bio": "null",
 "checkin": " St Mary's Cathedral, Sydney Darlinghurst, New South Wales Visited on 24 December 2021 Bango Patterson Park Gladesville, New South Wales, Australia Visited on 19 August 2021 Canberra, Australian Capital Territory Australian Capital Territory Visited on 19 May 2021 Sydney, Australia New South Wales Visited on 3 April 2021",
 "sport": "SPORTS Kenny Dalglish",
 "music": " Dạy Pha Chế Mở Quán - Passion Link Hà Nội Bartending service Piano Lovers Music school Nơi yêu cầu sheet nhạc Community Boi Ngoc Piano Music school",
 "films": " Ngôi Nhà Nhỏ Trên Thảo Nguyên Film",
 "television": " 9 News Melbourne TV Programme Shark Tank Việt Nam TV Programme 9 News Sydney TV Programme",
 "books": " Đường hai ngả, người thương thành lạ School/university Nếu biết trăm năm là hữu hạn Community",
 "app": " Sun World Blog Đường Phố",
 "likes": " 15s.vn 72+ Golf Academy 9 News Melbourne 9 News Sydney AIOTestking Support - Get free It Question & Answers APO Creative",
 "backup_info": " 3 9+ Viet Dinh WORK Microsoft 2020 - Present Experian August 2017 - 2020 Oracle March 2011 - July 2017 Viettel Telecom October 2010 - March 2011 INRIA September 2009 - June 2010 Oracle Vietnam June 2008 - July 2009 EDUCATION ENS de Cachan University School year 2009 Hanoi University of Technology University School year 2003 Université de Rennes 1 University HNUE High school for gifted students High School PLACES LIVED Ho Chi Minh City, Vietnam Current town/city Rennes, France Moved here Hanoi, Vietnam Home town CONTACT INFO /dinhtuanviet Facebook BASIC INFO Male Gender OTHER NAMES Steven Nickname RELATIONSHIP Mèo Thư Mèo Married See photos of Viet and Mèo FAMILY MEMBERS Sy Pham Quoc Brother-in-law LIFE EVENTS FAVOURITE QUOTES Life is like a box of chocolate, you never know what you are gonna get! PHOTOS CHECK-INS St Mary's Cathedral, Sydney Darlinghurst, New South Wales Visited on 24 December 2021 Bango Patterson Park Gladesville, New South Wales, Australia Visited on 19 August 2021 Canberra, Australian Capital Territory Australian Capital Territory Visited on 19 May 2021 Sydney, Australia New South Wales Visited on 3 April 2021 SPORTS Kenny Dalglish MUSIC Dạy Pha Chế Mở Quán - Passion Link Hà Nội Bartending service Piano Lovers Music school Nơi yêu cầu sheet nhạc Community Boi Ngoc Piano Music school FILMS Ngôi Nhà Nhỏ Trên Thảo Nguyên Film TV PROGRAMMES 9 News Melbourne TV Programme Shark Tank Việt Nam TV Programme 9 News Sydney TV Programme BOOKS Đường hai ngả, người thương thành lạ School/university Nếu biết trăm năm là hữu hạn Community LIKES 15s.vn 72+ Golf Academy 9 News Melbourne 9 News Sydney AIOTestking Support - Get free It Question & Answers APO Creative REVIEWS GIVEN itbee.vn 5 stars",
 "contents": "null"
}