{
 "UID": "732188691",
 "name": "Vo Hong Vinh",
 "education": "null",
 "work": "null",
 "placelive": " Ho Chi Minh City, Vietnam Current town/city Hà Tĩnh Home town",
 "contact_info": " /vohongvinh Facebook",
 "basic_info": " Male Gender",
 "relationship": " Married since 11 June 2006",
 "bio": "null",
 "checkin": " Sân Bay Quốc Tế Nội Bài Hanoi, Vietnam Visited on 20 March 2022 Vinpearl Hotel Hue Hue, Vietnam Visited on 7 February 2022 ด่านสากนพูเกีอ.lao-Vietnam Dak Le Kram, Gia Lai-Cong Tum, Vietnam Visited on 7 February 2022 Măng Đen Đại Ngàn Kon Tum Visited on 6 February 2022",
 "sport": "SPORTS HAGL Fans Bóng đá Cuộc sống Arsenal Manchester United - The Red Devils Manchester United News Manchester United",
 "music": "LIKES (RED) 1 triệu Like kêu gọi ông Nguyễn Bá Thanh lên làm thủ tướng 365 dias para llegar a 15.000.000... Esto si es un reto!! ♥ Dark Chocolate ♥ A House Add  to your FACEB00K profile. Works 100%",
 "films": " Phim Rạp Entertainment website STRENGTH AND HONOUR Film",
 "television": " Thông tin Kiến thức Tài chính kinh doanh TV Programme Thời sự VTV Media/news company Vì Yêu Mà Đến Public figure HÀI Vitalk.vn Interest",
 "books": " Bác sỹ Aibôlít Book",
 "app": " Clash of Clans Webgame Tam Quốc Truyền Kỳ",
 "likes": " (RED) 1 triệu Like kêu gọi ông Nguyễn Bá Thanh lên làm thủ tướng 365 dias para llegar a 15.000.000... Esto si es un reto!! ♥ Dark Chocolate ♥ A House Add MUSIC to your FACEB00K profile. Works 100%",
 "backup_info": " 3 9+ Vo Hong Vinh PLACES LIVED Ho Chi Minh City, Vietnam Current town/city Hà Tĩnh Home town CONTACT INFO /vohongvinh Facebook BASIC INFO Male Gender RELATIONSHIP Married since 11 June 2006 LIFE EVENTS PHOTOS SPORTS HAGL Fans Bóng đá Cuộc sống Arsenal Manchester United - The Red Devils Manchester United News Manchester United MUSIC Tình Khúc Vượt Thời Gian 1975 Interest Modern Talking Performing arts Radio Online - vnRadio.vn Radio station metal14 Musician/Band FILMS Phim Rạp Entertainment website STRENGTH AND HONOUR Film TV PROGRAMMES Thông tin Kiến thức Tài chính kinh doanh TV Programme Thời sự VTV Media/news company Vì Yêu Mà Đến Public figure HÀI Vitalk.vn Interest BOOKS Bác sỹ Aibôlít Book APPS AND GAMES Clash of Clans Webgame Tam Quốc Truyền Kỳ LIKES (RED) 1 triệu Like kêu gọi ông Nguyễn Bá Thanh lên làm thủ tướng 365 dias para llegar a 15.000.000... Esto si es un reto!! ♥ Dark Chocolate ♥ A House Add MUSIC to your FACEB00K profile. Works 100%",
 "contents": "null"
}