{
 "UID": "100003536527852",
 "name": "Văn Thái",
 "education": " CD GTVT2 Xây dựng dân dụng THPT Nghèn High School",
 "work": " Da Nang, Vietnam Chief executive officer",
 "placelive": " Da Nang, Vietnam Current town/city Vinh Moved here Hà Tĩnh Home town",
 "contact_info": " /tranvan.thai.3 Facebook",
 "basic_info": " Male Gender Men and women Interested in",
 "relationship": " Single",
 "bio": "null",
 "checkin": " Xóm 1 Xã Vượng Lộc Can Lộc Hà Tĩnh Thanh Khê Visited on 25 July 2018 vườn hoa Đà Lạt Da Lat Visited on 29 April 2018 Bình Dương Province Vietnam Visited on 23 February 2018 Du Lịch Biển Vũng Tàu Vung Tau Visited on 3 September 2017",
 "sport": "SPORTS Zumba Euroland",
 "music": " BPROOFVNteam - BTS Vietnamese Subteam Musician/Band Sạch mụn thâm, nám tàn nhang Nguyenhuynhnhu Business service XONE RADIO Arts and entertainment Rap Viet Music",
 "films": " Xem Phim Hay Film",
 "television": " Bữa trưa vui vẻ TV Programme Có Gì Mới Sáng Nay? TV Programme",
 "books": " Thế Giới Truyện Interest",
 "app": " Loạn Đao Kiếm Thế Yo! Mobile",
 "likes": " Adidas SPC Aeon Mall Canary Bình Dương Auto365.vn Axe Vietnam BLOOK BPROOFVNteam - BTS Vietnamese Subteam Bangkeobinhduong",
 "backup_info": " 4 5 9+ 45 Văn Thái EDUCATION CD GTVT2 Xây dựng dân dụng THPT Nghèn High School WORK Da Nang, Vietnam Chief executive officer PLACES LIVED Da Nang, Vietnam Current town/city Vinh Moved here Hà Tĩnh Home town CONTACT INFO /tranvan.thai.3 Facebook BASIC INFO Male Gender Men and women Interested in OTHER NAMES T-Dragon Other RELATIONSHIP Single FAMILY MEMBERS Ngọc Thúy Older sister LIFE EVENTS FRIENDS Cường Tốc Độ Hoàng Vĩnh Komodo Lương Nam Mai Nguyen PHOTOS CHECK-INS Xóm 1 Xã Vượng Lộc Can Lộc Hà Tĩnh Thanh Khê Visited on 25 July 2018 vườn hoa Đà Lạt Da Lat Visited on 29 April 2018 Bình Dương Province Vietnam Visited on 23 February 2018 Du Lịch Biển Vũng Tàu Vung Tau Visited on 3 September 2017 MUSIC BPROOFVNteam - BTS Vietnamese Subteam Musician/Band Sạch mụn thâm, nám tàn nhang Nguyenhuynhnhu Business service XONE RADIO Arts and entertainment Rap Viet Music FILMS Xem Phim Hay Film TV PROGRAMMES Bữa trưa vui vẻ TV Programme Có Gì Mới Sáng Nay? TV Programme APPS AND GAMES Loạn Đao Kiếm Thế Yo! Mobile LIKES Adidas SPC Aeon Mall Canary Bình Dương Auto365.vn Axe Vietnam BLOOK BPROOFVNteam - BTS Vietnamese Subteam Bangkeobinhduong",
 "contents": "null"
}