{
 "UID": "100005292914824",
 "name": "Wave Pakin",
 "education": " วิทยาลัยสารพัดช่างจันทบุรี University สตรีมารดาพิทักษ์ จันทบุรี High School 18 May 2010 - Present",
 "work": " บริษัท พ่อแม่จำกัดมหาชน",
 "placelive": "null",
 "contact_info": "null",
 "basic_info": " Male Gender",
 "relationship": " Married since 2018",
 "bio": "ABOUT WAVE เรื่องของกู",
 "checkin": " โรงพยาบาลจุฬารัตน์11 Bang Smak, Chachoengsao, Thailand Visited on 3 October 2016 โรงพยาบาลจุฬารัตน์11 Bang Smak, Chachoengsao, Thailand Visited on 26 September 2016 โรงพยาบาลพุทธโสธร(โรงพยาบาลเมืองฉะเชิงเทรา) Chachoengsao Visited on 19 September 2016 @วัดสมานรัตนาราม [พระพิฆเณศ&พระราหู องค์ใหญ่ที่สุดในประเทศไทย] Chachoengsao Visited on 11 September 2016",
 "sport": "SPORTS W.125 I New วาฬซิ่ง club Germany Football Team - Die Mannschaft",
 "music": " เพลงเพื่อชีวิต Musical genre Demo Projects Gaming video creator Kamikaze Record label",
 "films": " รีบอน Film",
 "television": " YouLike คลิปเด็ด Home HormonesTheSeries TV Programme เรื่องเล่าเช้านี้ News & media website",
 "books": " Đọc Truyện Online Library",
 "app": " Drag Racing",
 "likes": " Demo Projects Dingo Town Drag Racing Fan Ayu Ting Ting Femalemotivation Funny Jokes",
 "backup_info": " 2 9+ Wave Pakin WORK บริษัท พ่อแม่จำกัดมหาชน EDUCATION วิทยาลัยสารพัดช่างจันทบุรี University สตรีมารดาพิทักษ์ จันทบุรี High School 18 May 2010 - Present BASIC INFO Male Gender RELATIONSHIP Married since 2018 ABOUT WAVE เรื่องของกู LIFE EVENTS FAVOURITE QUOTES ไม่ต้องเสือก FRIENDS มอส' คนไหน ชื่อ' เจน. ปลาวาฬ ปลาวาฬ Narubas Intanin PHOTOS VIDEOS CHECK-INS โรงพยาบาลจุฬารัตน์11 Bang Smak, Chachoengsao, Thailand Visited on 3 October 2016 โรงพยาบาลจุฬารัตน์11 Bang Smak, Chachoengsao, Thailand Visited on 26 September 2016 โรงพยาบาลพุทธโสธร(โรงพยาบาลเมืองฉะเชิงเทรา) Chachoengsao Visited on 19 September 2016 @วัดสมานรัตนาราม [พระพิฆเณศ&พระราหู องค์ใหญ่ที่สุดในประเทศไทย] Chachoengsao Visited on 11 September 2016 SPORTS W.125 I New วาฬซิ่ง club Germany Football Team - Die Mannschaft MUSIC เพลงเพื่อชีวิต Musical genre Demo Projects Gaming video creator Kamikaze Record label FILMS รีบอน Film TV PROGRAMMES YouLike คลิปเด็ด Home HormonesTheSeries TV Programme เรื่องเล่าเช้านี้ News & media website APPS AND GAMES Drag Racing LIKES Demo Projects Dingo Town Drag Racing Fan Ayu Ting Ting Femalemotivation Funny Jokes",
 "contents": "null"
}