{
 "UID": "100001793650033",
 "name": "Yến Chi Lộ",
 "education": "null",
 "work": "null",
 "placelive": " Hanoi, Vietnam Current town/city Hanoi, Vietnam Home town",
 "contact_info": " /yenchi.lo.1 Facebook",
 "basic_info": " Female Gender",
 "relationship": " Single",
 "bio": "null",
 "checkin": " Nội Thất Thắng Chinh- 29 Lê Trọng Tấn Hanoi, Vietnam Visited on 7 November 2020 Nội Thất Thắng Chinh- 29 Lê Trọng Tấn Hanoi, Vietnam Visited on 16 April 2017",
 "sport": "SPORTS Thanh Hóa FC Since 1962 Manchester United ManUtd Việt Nam",
 "music": " Love Songs Book Đàm Vĩnh Hưng Artist",
 "films": " Cuồng phim-Review News & media website CuaCua.Vn Toy shop",
 "television": " Cafe sáng với VTV3 Interest Shark Tank Việt Nam TV Programme Tấm Cám Beauty Center Spa",
 "books": " Xu Xu đừng Khóc Book",
 "app": " Half-Life 2",
 "likes": " Ao quán - Tinh hoa ẩm thực Việt Bastet's Home Cafe sáng với VTV3 CuaCua.Vn Cuồng phim-Review Cổ Café",
 "backup_info": " 1 9+ Yến Chi Lộ PLACES LIVED Hanoi, Vietnam Current town/city Hanoi, Vietnam Home town CONTACT INFO /yenchi.lo.1 Facebook BASIC INFO Female Gender OTHER NAMES Vịt Other RELATIONSHIP Single LIFE EVENTS FAVOURITE QUOTES Và nụ cười sẽ hong khô tất cả ^^ PHOTOS CHECK-INS Nội Thất Thắng Chinh- 29 Lê Trọng Tấn Hanoi, Vietnam Visited on 7 November 2020 Nội Thất Thắng Chinh- 29 Lê Trọng Tấn Hanoi, Vietnam Visited on 16 April 2017 MUSIC Love Songs Book Đàm Vĩnh Hưng Artist FILMS Cuồng phim-Review News & media website CuaCua.Vn Toy shop TV PROGRAMMES Cafe sáng với VTV3 Interest Shark Tank Việt Nam TV Programme Tấm Cám Beauty Center Spa BOOKS Xu Xu đừng Khóc Book LIKES Ao quán - Tinh hoa ẩm thực Việt Bastet's Home Cafe sáng với VTV3 CuaCua.Vn Cuồng phim-Review Cổ Café",
 "contents": "null"
}