{
 "UID": "100003214346466",
 "name": "Đạt Nguyễn",
 "education": " trường THPT Tĩnh Gia 2 High School School year 2007",
 "work": " Nguyen Le Association Kỹ thuật Led Hanoi, Vietnam",
 "placelive": " Hanoi, Vietnam Current town/city",
 "contact_info": " /nguyenvandat.haui Facebook",
 "basic_info": " Male Gender",
 "relationship": " Single",
 "bio": "ABOUT NGUYỄN bình thường không có gì đặc biệt ! thích bóng đá !",
 "checkin": " Ngân Hàng Hợp Tác Chi Nhánh Bac Giang Visited on 16 October 2018 N.E.X Music Festival 2018 Hanoi, Vietnam Visited on 6 May 2018 Ecopark Ã?Ong Tao Dong, Hai Hung, Vietnam Visited on 4 May 2018 Sân Khấu Quảng Trường Công Viên Văn Lang Viet Tri Visited on 21 April 2018",
 "sport": "SPORTS FC AO LÀNG Real Madrid Beşiktaş Real Madrid C.F.",
 "music": " Âm thanh Ánh sáng 3S Musician/Band Karaman Güncel Journalist",
 "films": " Phim Godzilla Film HDViet Entertainment website hai, hanh dong, kinh di Film",
 "television": " Đẹp + Entertainment website",
 "books": "",
 "app": " EverMerge PUBG Vĩnh Tường Hội những người đam mê Kantai Collection - Móe Fleet Nhật Ký Tình Yêu - Gamota Iron Force Pokémon Play It!",
 "likes": " 2v Fashion Aland Store-Tiệm nước hoa chiết chính hãng Albee Le Fashion Alibaba.com Amazing Kids - Thời trang Phụ kiện cho bé Anna House",
 "backup_info": " 9+ 80 Đạt Nguyễn EDUCATION trường THPT Tĩnh Gia 2 High School School year 2007 WORK Nguyen Le Association Kỹ thuật Led Hanoi, Vietnam PLACES LIVED Hanoi, Vietnam Current town/city CONTACT INFO /nguyenvandat.haui Facebook BASIC INFO Male Gender RELATIONSHIP Single FAMILY MEMBERS Quỳnh Kòi Older sister ABOUT NGUYỄN bình thường không có gì đặc biệt ! thích bóng đá ! LIFE EVENTS FAVOURITE QUOTES Hãy theo đuổi đam mê thành công sẽ đuổi theo bạn PHOTOS VIDEOS CHECK-INS Ngân Hàng Hợp Tác Chi Nhánh Bac Giang Visited on 16 October 2018 N.E.X Music Festival 2018 Hanoi, Vietnam Visited on 6 May 2018 Ecopark Ã?Ong Tao Dong, Hai Hung, Vietnam Visited on 4 May 2018 Sân Khấu Quảng Trường Công Viên Văn Lang Viet Tri Visited on 21 April 2018 SPORTS FC AO LÀNG Real Madrid Beşiktaş Real Madrid C.F. MUSIC Âm thanh Ánh sáng 3S Musician/Band Karaman Güncel Journalist TV PROGRAMMES Đẹp + Entertainment website LIKES 2v Fashion Aland Store-Tiệm nước hoa chiết chính hãng Albee Le Fashion Alibaba.com Amazing Kids - Thời trang Phụ kiện cho bé Anna House",
 "contents": "null"
}