{
 "UID": "100003120325072",
 "name": "Định Lê",
 "education": "null",
 "work": "null",
 "placelive": " Hanoi, Vietnam Current town/city",
 "contact_info": "null",
 "basic_info": " Male Gender",
 "relationship": " Hanh Nguyen Married Since 23 July 2013 See photos of Định and Hanh",
 "bio": "null",
 "checkin": " Ngọc trì ,ái quốc ,hải dương Hải Dương Visited on 8 October 2021 Wellspring Hanoi International Bilingual School Visited on 30 January 2019 Yên Bái Province Vietnam Visited on 18 March 2018 Bãi Cháy,Hạ Long,Quảng Ninh. Ha Long Visited on 28 February 2018",
 "sport": "SPORTS Official Supporters Club Of Chelsea In Vietnam",
 "music": " L’s Babies - Thời Trang Thiết Kế cho Bé & Mẹ Baby & children's clothing shop",
 "films": " Chị Mười Ba Film Món Ba Miền Personal blog",
 "television": " Triết Lý Người Thành Công TV Programme Đại Kỷ Nguyên - Việt Nam Society & culture website Cafe sáng với VTV3 Interest Shark Tank Việt Nam TV Programme",
 "books": " First News Trí Việt Book",
 "app": " NhaTro3T",
 "likes": " Bella Skin Blockin Media Blue Mountain Villa Bánh ShiKa Bóng Đá Trực Tuyến Cakiem.com",
 "backup_info": " 9+ 9 9+ 57 Định Lê PLACES LIVED Hanoi, Vietnam Current town/city BASIC INFO Male Gender RELATIONSHIP Hanh Nguyen Married Since 23 July 2013 See photos of Định and Hanh LIFE EVENTS FAVOURITE QUOTES Sống ở đời, cái gì tránh được thì tránh, né được thì né. Không tránh, không né được thì phải đủ dũng khí để đương đầu đối mặt! FRIENDS Zume Pham Vu Van Bac Trần Hậu Đỗ Văn Thiện PHOTOS VIDEOS CHECK-INS Ngọc trì ,ái quốc ,hải dương Hải Dương Visited on 8 October 2021 Wellspring Hanoi International Bilingual School Visited on 30 January 2019 Yên Bái Province Vietnam Visited on 18 March 2018 Bãi Cháy,Hạ Long,Quảng Ninh. Ha Long Visited on 28 February 2018 SPORTS Official Supporters Club Of Chelsea In Vietnam MUSIC L’s Babies - Thời Trang Thiết Kế cho Bé & Mẹ Baby & children's clothing shop FILMS Chị Mười Ba Film Món Ba Miền Personal blog APPS AND GAMES NhaTro3T LIKES Bella Skin Blockin Media Blue Mountain Villa Bánh ShiKa Bóng Đá Trực Tuyến Cakiem.com",
 "contents": "null"
}