{
 "UID": "100000288920208",
 "name": "吳佳琪",
 "education": " 弘光科技大學 University September 2013 - Present",
 "work": " 嘉義基督教醫院 護理師 10 July 2015 - Present 財團法人天主教聖馬爾定醫院 開刀房實習生 17 December 2012 - 11 January 2013 財團法人天主教聖馬爾定醫院 兒科病房實習生 19 November 2012 - 14 December 2012 財團法人天主教聖馬爾定醫院 產科實習生 22 October 2012 - 16 November 2012 大林慈濟醫院 精神科實習生 4 June 2012 - 29 June 2012 嘉義基督教醫院 實習生 9 April 2012 - 1 June 2012 中埔衛生所 實習生 13 February 2012 - 9 March 2012 台灣藍衣天使救護服務協會",
 "placelive": " Taichung, Taiwan Current town/city Tainan, Taiwan Home town",
 "contact_info": "null",
 "basic_info": " Female Gender Men Interested in",
 "relationship": "null",
 "bio": "null",
 "checkin": " 呆果小豬家 Tainan, Taiwan Visited on 8 August 2020 呆果小豬家 Tainan, Taiwan Visited on 10 May 2020 呆果小豬家 Tainan, Taiwan Visited on 30 March 2020 呆果小豬家 Tainan, Taiwan Visited on 26 January 2020",
 "sport": "SPORTS Nguyễn Tiến Minh",
 "music": " Mayday - 五月天 Musician/Band 丁噹 Ring Musician/Band 五月天 Mayday Musician/Band 五月天 經典語錄 Musician/Band",
 "films": " 被偷走的那五年 Interest 南方小羊牧場 Film",
 "television": " 我的自由年代 TV Programme",
 "books": " FamilyBooks - Tủ Sách Gia Đình Interest Sách bất động sản - Sách của môi giới Việt Book Tacabooks - Sách hay về quản trị doanh nghiệp Book shop",
 "app": " Evony - The King's Return Gunny",
 "likes": " 28fun 搞笑圖片 AES黃鴻升 CJNC 崇仁醫專 護理科學會 Catworld Fashion Shop Daily Horoscope Dorothy",
 "backup_info": " 4 5 9+ 45 吳佳琪 EDUCATION 弘光科技大學 University September 2013 - Present WORK 嘉義基督教醫院 護理師 10 July 2015 - Present 財團法人天主教聖馬爾定醫院 開刀房實習生 17 December 2012 - 11 January 2013 財團法人天主教聖馬爾定醫院 兒科病房實習生 19 November 2012 - 14 December 2012 財團法人天主教聖馬爾定醫院 產科實習生 22 October 2012 - 16 November 2012 大林慈濟醫院 精神科實習生 4 June 2012 - 29 June 2012 嘉義基督教醫院 實習生 9 April 2012 - 1 June 2012 中埔衛生所 實習生 13 February 2012 - 9 March 2012 台灣藍衣天使救護服務協會 PLACES LIVED Taichung, Taiwan Current town/city Tainan, Taiwan Home town BASIC INFO Female Gender Men Interested in LIFE EVENTS PHOTOS VIDEOS CHECK-INS 呆果小豬家 Tainan, Taiwan Visited on 8 August 2020 呆果小豬家 Tainan, Taiwan Visited on 10 May 2020 呆果小豬家 Tainan, Taiwan Visited on 30 March 2020 呆果小豬家 Tainan, Taiwan Visited on 26 January 2020 MUSIC Mayday - 五月天 Musician/Band 丁噹 Ring Musician/Band 五月天 Mayday Musician/Band 五月天 經典語錄 Musician/Band FILMS 被偷走的那五年 Interest 南方小羊牧場 Film TV PROGRAMMES 我的自由年代 TV Programme LIKES 28fun 搞笑圖片 AES黃鴻升 CJNC 崇仁醫專 護理科學會 Catworld Fashion Shop Daily Horoscope Dorothy",
 "contents": "null"
}