{
 "UID": "1641992534",
 "name": "吳卓霖 Tracy",
 "education": " Monash University University 麥劍雄華文中心 High School",
 "work": " Bất động sản Tp.",
 "placelive": " Ho Chi Minh City, Vietnam Current town/city Ho Chi Minh City, Vietnam Home town",
 "contact_info": " /tracy0918770688 Facebook",
 "basic_info": " Female Gender",
 "relationship": "null",
 "bio": "null",
 "checkin": " Cat Bi Airport- Hai Phong City Hai Phong, Vietnam Visited on 29 August 2014",
 "sport": "SPORTS Liverpool FC Socceroos Khu Sinh Thái Hoàng Vân TYOGA Dynamic GYM CLB Storm Gym B&H",
 "music": " Đi Bốn Phương - World on Your Feet Album Âm Nhạc Và Đời Sống Music video",
 "films": " Loving Film Hội Mê Phim Hàn Interest Mọt Phim Interest Gone With The Wind Film",
 "television": " MasterChef Australia TV Programme",
 "books": " Real Kid Books Book Sống và Khát Vọng Community LifeBook - Cuốn Sách Cuộc Đời Book Mọt sách's confession Book",
 "app": " Garena Liên Quân Mobile",
 "likes": " Alô Vũng Tàu B2S Gourmet BIDV - Ngân hàng TMCP Đầu Tư & Phát Triển Việt Nam Ba Chỉ Hun Khói Be Design Boost Your English",
 "backup_info": " 9+ 82 吳卓霖 Tracy EDUCATION Monash University University 麥劍雄華文中心 High School WORK Bất động sản Tp. PLACES LIVED Ho Chi Minh City, Vietnam Current town/city Ho Chi Minh City, Vietnam Home town CONTACT INFO /tracy0918770688 Facebook BASIC INFO Female Gender LIFE EVENTS FRIENDS 李展庄 Dong Quan Sieu Anh Ngo Nhuận Bình PHOTOS CHECK-INS Cat Bi Airport- Hai Phong City Hai Phong, Vietnam Visited on 29 August 2014 TV PROGRAMMES MasterChef Australia TV Programme APPS AND GAMES Garena Liên Quân Mobile LIKES Alô Vũng Tàu B2S Gourmet BIDV - Ngân hàng TMCP Đầu Tư & Phát Triển Việt Nam Ba Chỉ Hun Khói Be Design Boost Your English",
 "contents": "null"
}