{
 "UID": "100005504194560",
 "name": "廖品淳",
 "education": " 台北商業大學 University",
 "work": "null",
 "placelive": " New Taipei City Current town/city",
 "contact_info": " /phoebe.liao.524 Facebook ntubhm_lpc Instagram",
 "basic_info": " 26 January Date of birth Female Gender",
 "relationship": "null",
 "bio": "null",
 "checkin": " Cù Lao Dài Vĩnh Long Visited on 22 November 2020 Thảo Cầm Viên, Q.1 Bình Hưng Hòa B Visited on 22 June 2019 Giay Dep DUWA Ho Chi Minh City, Vietnam Visited on 31 December 2018 VinPro Ho Chi Minh City, Vietnam Visited on 18 August 2018",
 "sport": "SPORTS Bóng Đá Cười",
 "music": " 婁峻碩粉絲後援會 SHOU's Fans Club Musician/Band 唯愛興哲 Musician/Band 靠北南山 Youth organisation 2021新北市歡樂耶誕城 Performing arts",
 "films": " Universal Pictures Film/Television studio",
 "television": " 稍息立正我愛你 Interest 韓劇開麥拉 TV Programme 三立華劇－1989一念間 Back To 1989 TV Programme 三立華劇 - 浮士德的微笑 Behind Your Smile TV Programme",
 "books": " T-Style Shop Business centre",
 "app": " Coin Master School idol festival",
 "likes": " 2021新北市歡樂耶誕城 4Fun Base 創意基地 密室逃脫 Alexi英文美學 B612 BONNY & READ 飾品 Barbell.C",
 "backup_info": " 9+ 9 9+ 57 廖品淳 EDUCATION 台北商業大學 University PLACES LIVED New Taipei City Current town/city CONTACT INFO /phoebe.liao.524 Facebook ntubhm_lpc Instagram BASIC INFO 26 January Date of birth Female Gender LIFE EVENTS FRIENDS 金大師 鄭雅之 吳胤頡 林柏劭 VIDEOS MUSIC 婁峻碩粉絲後援會 SHOU's Fans Club Musician/Band 唯愛興哲 Musician/Band 靠北南山 Youth organisation 2021新北市歡樂耶誕城 Performing arts FILMS Universal Pictures Film/Television studio TV PROGRAMMES 稍息立正我愛你 Interest 韓劇開麥拉 TV Programme 三立華劇－1989一念間 Back To 1989 TV Programme 三立華劇 - 浮士德的微笑 Behind Your Smile TV Programme APPS AND GAMES Coin Master School idol festival LIKES 2021新北市歡樂耶誕城 4Fun Base 創意基地 密室逃脫 Alexi英文美學 B612 BONNY & READ 飾品 Barbell.C REVIEWS GIVEN Fantasy Art 店內很可愛～做出來的成品也很喜歡！下次會再來",
 "contents": "null"
}