{
 "UID": "100000142908267",
 "name": "李湘琦",
 "education": " 輔仁大學 University 桃園高中 High School",
 "work": " 到處跑",
 "placelive": "null",
 "contact_info": " /emma.lee.965580 Facebook",
 "basic_info": " Female Gender",
 "relationship": "null",
 "bio": "ABOUT 琦 粉絲專頁https://m.facebook.com/Hsiangchimama",
 "checkin": " 初魚鐵板燒-新光a9 Taipei, Taiwan Visited on 11 November 2021 浮線發想之島．小國生活 Tachung, T'Ai-Wan, Taiwan Visited on 29 August 2021 星上星港式飲茶 Taoyuan District, Taoyuan Visited on 9 May 2021 日勝生加賀屋國際溫泉飯店 Taipei, Taiwan Visited on 15 December 2020",
 "sport": "SPORTS 張家豪（Anson Chang)",
 "music": " 53 studio Product/Service MADEMOISELLE YULIA Design and fashion",
 "films": " Sulley Film character",
 "television": " 6 Ô Cửa Bí Ẩn TV Programme",
 "books": "null",
 "app": " PIXO STYLE",
 "likes": " 1/2AM Photo美學佈置/婚禮佈置/法式甜點/花藝/道具/派對/囍餅 1028 時尚彩妝 2 kids in wonderland 2143 486先生 53 studio",
 "backup_info": " 9+ 9 9+ 59 李湘琦 EDUCATION 輔仁大學 University 桃園高中 High School WORK 到處跑 CONTACT INFO /emma.lee.965580 Facebook BASIC INFO Female Gender FAMILY MEMBERS ひわたり おんぷ Niece Jerry Chien Husband Su Su Hsu Family member Leon Yu Family member ABOUT 琦 粉絲專頁https://m.facebook.com/Hsiangchimama LIFE EVENTS FRIENDS 陳世君 鳳姐 Fendi Hsu Lavinia Chien PHOTOS VIDEOS CHECK-INS 初魚鐵板燒-新光a9 Taipei, Taiwan Visited on 11 November 2021 浮線發想之島．小國生活 Tachung, T'Ai-Wan, Taiwan Visited on 29 August 2021 星上星港式飲茶 Taoyuan District, Taoyuan Visited on 9 May 2021 日勝生加賀屋國際溫泉飯店 Taipei, Taiwan Visited on 15 December 2020 SPORTS 張家豪（Anson Chang) MUSIC 53 studio Product/Service MADEMOISELLE YULIA Design and fashion FILMS Sulley Film character APPS AND GAMES PIXO STYLE LIKES 1/2AM Photo美學佈置/婚禮佈置/法式甜點/花藝/道具/派對/囍餅 1028 時尚彩妝 2 kids in wonderland 2143 486先生 53 studio REVIEWS GIVEN HOSHINOYA Guguan - 虹夕諾雅 谷關 - 星のやグーグァン 就像來到了日本，沐浴山中，環境非常好，房間寬敞舒適，無間歇温泉溫度很適中，餐飲服務人員也都非常仔細解說，是個可以好好享受慢活的好地方 CoCo壹番屋",
 "contents": "null"
}