{
 "UID": "100000527610946",
 "name": "楊志強",
 "education": " 臺北醫學大學 University School year 1996 中壢高中 High School",
 "work": " 長庚醫院 林口長庚",
 "placelive": " Taoyuan District, Taoyuan Current town/city Taoyuan District, Taoyuan Home town",
 "contact_info": " /nelsoncola Facebook",
 "basic_info": " Male Gender",
 "relationship": " Married",
 "bio": "null",
 "checkin": " 2016臺灣燈會: 夢想新城 Dreaming City Dreaming Life Taoyuan District, Taoyuan Visited on 21 February 2016 一毛不拔複合式鹽水雞〔林森直營店〕 Taipei, Taiwan Visited on 22 September 2012 林口長庚醫院 病理大樓 血液腫瘤科 Linkou County Visited on 19 September 2012 Costco 南崁店 Taoyuan District, Taoyuan Visited on 15 September 2012",
 "sport": "SPORTS 王建民",
 "music": " D.C.樂團 Musician/Band",
 "films": " Phim Hành Động Võ Thuật Interest Câu Lạc Bộ Phim Hay Interest Phim Rạp Entertainment website",
 "television": " Go車誌 Vehicle consultant",
 "books": " Hội thích truyện trinh thám Book",
 "app": " 泰坦之戰：暗黑戰神 War of Titans",
 "likes": " 921地震教育園區 Abic愛貝客-親子旅遊&親子餐廳大募集 Android 中文網（APK.TW） Android 中文資訊網 BIC CAMERA_繁體中文 CERIO Service Center",
 "backup_info": " 4 5 9+ 45 楊志強 EDUCATION 臺北醫學大學 University School year 1996 中壢高中 High School WORK 長庚醫院 林口長庚 PLACES LIVED Taoyuan District, Taoyuan Current town/city Taoyuan District, Taoyuan Home town CONTACT INFO /nelsoncola Facebook BASIC INFO Male Gender RELATIONSHIP Married FAMILY MEMBERS 林佑瑋 Son 楊勛宇 Son LIFE EVENTS FRIENDS 徐金蘭 ChianYu Tung Cherring Lu 陳昫宏 PHOTOS VIDEOS CHECK-INS 2016臺灣燈會: 夢想新城 Dreaming City Dreaming Life Taoyuan District, Taoyuan Visited on 21 February 2016 一毛不拔複合式鹽水雞〔林森直營店〕 Taipei, Taiwan Visited on 22 September 2012 林口長庚醫院 病理大樓 血液腫瘤科 Linkou County Visited on 19 September 2012 Costco 南崁店 Taoyuan District, Taoyuan Visited on 15 September 2012 SPORTS 王建民 TV PROGRAMMES Go車誌 Vehicle consultant LIKES 921地震教育園區 Abic愛貝客-親子旅遊&親子餐廳大募集 Android 中文網（APK.TW） Android 中文資訊網 BIC CAMERA_繁體中文 CERIO Service Center REVIEWS GIVEN Upsangel 在路由器、MESH方面非常專業，在琳瑯滿目的路由器市場中，對於選購自己適合的機器很有幫助。",
 "contents": "null"
}