{
 "UID": "100001128755971",
 "name": "許家源",
 "education": " 國立中興大學附屬臺中高級農業職業學校 High School 農場經營科 國立台中高級農業學校 High School",
 "work": " 中華民國海軍陸戰隊 上兵",
 "placelive": " Nantou City Current town/city Taichung, Taiwan Home town",
 "contact_info": "null",
 "basic_info": " Male Gender Women Interested in",
 "relationship": "null",
 "bio": "null",
 "checkin": " 台東知本溫泉 Taitung City Visited on 23 May 2014 濁水溪河床西瓜園 Yünlin, Taiwan Visited on 22 May 2014 北港朝天宮 Beigang Township Visited on 19 April 2014 聯莊羽球館 Nantouhsien, T'Ai-Wan, Taiwan Visited on 5 April 2014",
 "sport": "SPORTS Manchester United Football Club",
 "music": " W&W Musician/Band",
 "films": " 哆啦a夢的語錄 Interest",
 "television": " News Interest",
 "books": " 勵志類 Book",
 "app": " bida",
 "likes": " AI回憶 BNP Paribas Cardif Cia Cia Fu佳佳fu 甘梅薯條忠孝店 Ever Rich昇恆昌 News Pairs - ペアーズ",
 "backup_info": " 1 9+ 許家源 WORK 中華民國海軍陸戰隊 上兵 EDUCATION 國立中興大學附屬臺中高級農業職業學校 High School 農場經營科 國立台中高級農業學校 High School PLACES LIVED Nantou City Current town/city Taichung, Taiwan Home town BASIC INFO Male Gender Women Interested in FAMILY MEMBERS Hsing Yu Hsu Sister 許智恆 Cousin LIFE EVENTS FAVOURITE QUOTES 人一定要靠自己 FRIENDS 徐裕隆 Yuan Po Lin 陳強 張敬名 PHOTOS CHECK-INS 台東知本溫泉 Taitung City Visited on 23 May 2014 濁水溪河床西瓜園 Yünlin, Taiwan Visited on 22 May 2014 北港朝天宮 Beigang Township Visited on 19 April 2014 聯莊羽球館 Nantouhsien, T'Ai-Wan, Taiwan Visited on 5 April 2014 MUSIC W&W Musician/Band FILMS 哆啦a夢的語錄 Interest TV PROGRAMMES News Interest BOOKS 勵志類 Book LIKES AI回憶 BNP Paribas Cardif Cia Cia Fu佳佳fu 甘梅薯條忠孝店 Ever Rich昇恆昌 News Pairs - ペアーズ REVIEWS GIVEN Cia Cia Fu佳佳fu 甘梅薯條忠孝店 5 stars 玖育生化科技有限公司 5 stars",
 "contents": "null"
}