{
 "name": "LÆ°Æ¡ng VÅ© Thiá»‡n",
 "education": "Há»ŒC Váº¤N TrÆ°á»ng Äáº¡i há»c Ngoáº¡i thÆ°Æ¡ng Äáº¡i há»c 13 thÃ¡ng 8, 2018 - Hiá»‡n táº¡i THCS & THPT LÆ°Æ¡ng Tháº¿ Vinh - CÆ¡ Sá»Ÿ Cáº§u Giáº¥y TrÆ°á»ng trung há»c Well met !",
 "work": "null",
 "placelive": "NÆ I Tá»ªNG Sá»NG HÃ  Ná»™i Tá»‰nh/ThÃ nh phá»‘ hiá»‡n táº¡i HÃ  Ná»™i QuÃª quÃ¡n",
 "contact_info": "THÃ”NG TIN LIÃŠN Há»† /vuthien.luong Facebook",
 "basic_info": "THÃ”NG TIN CÆ  Báº¢N 15 thÃ¡ng 10 Sinh nháº­t Nam Giá»›i tÃ­nh Ná»¯ ThÃ­ch",
 "relationship": "Má»I QUAN Há»†",
 "bio": "null",
 "checkin": "null",
 "sport": "null",
 "music": "null",
 "films": "null",
 "television": "null",
 "books": "null",
 "app": "null",
 "likes": "null",
 "backup_info": " LÆ°Æ¡ng VÅ© Thiá»‡n Há»ŒC Váº¤N TrÆ°á»ng Äáº¡i há»c Ngoáº¡i thÆ°Æ¡ng Äáº¡i há»c 13 thÃ¡ng 8, 2018 - Hiá»‡n táº¡i THCS & THPT LÆ°Æ¡ng Tháº¿ Vinh - CÆ¡ Sá»Ÿ Cáº§u Giáº¥y TrÆ°á»ng trung há»c Well met ! NÆ I Tá»ªNG Sá»NG HÃ  Ná»™i Tá»‰nh/ThÃ nh phá»‘ hiá»‡n táº¡i HÃ  Ná»™i QuÃª quÃ¡n THÃ”NG TIN LIÃŠN Há»† /vuthien.luong Facebook THÃ”NG TIN CÆ  Báº¢N 15 thÃ¡ng 10 Sinh nháº­t Nam Giá»›i tÃ­nh Ná»¯ ThÃ­ch Má»I QUAN Há»† THÃ€NH VIÃŠN TRONG GIA ÄÃŒNH SÆ¡n Zai ÄÃ¢y Anh trai Luong Ngoc Hoan Bá»‘ Sá»° KIá»†N TRONG Äá»œI áº¢NH VIDEO CHECK IN Hola Resort HÃ  Ná»™i ÄÃ£ ghÃ© thÄƒm vÃ o 5 thÃ¡ng 8, 2017 Rá»«ng ThÃ´ng Báº£n Ãng - Má»™c ChÃ¢u Má»™c ChÃ¢u ÄÃ£ ghÃ© thÄƒm vÃ o 5 thÃ¡ng 11, 2016 Biá»ƒn Sáº§m SÆ¡n HÃ  Ná»™i ÄÃ£ ghÃ© thÄƒm vÃ o 1 thÃ¡ng 6, 2014 Cáº£m Tháº¥y KhÃ³ Xá»­ ThÃ nh phá»‘ Há»“ ChÃ­ Minh ÄÃ£ ghÃ© thÄƒm vÃ o 4 thÃ¡ng 5, 2014 THá»‚ THAO Next Sports Spurs Only AAA Design & Build Arsenal BARCELONA SPORTING CLUB - PÃ¡gina oficial FC Barcelona Ã‚M NHáº C BangTin BangTan Trang dÃ nh cho fan Ã”ng CÃ¹ Láº³ng Video ca nháº¡c Thá»§y Äáº·ng - The Voice Nháº¡c sá»¹/Ban nháº¡c ÄÃ¬ Va Quanh Ta Video ca nháº¡c PHIM MCV Movie Phim Cuá»“ng phim-Review Trang web tin tá»©c & truyá»n thÃ´ng ChÃ¢u Xinhâ€™s Shop - ChuyÃªn má»¹ pháº©m xÃ¡ch tay, HÃ ng ná»™i Ä‘á»‹a HÃ n Quá»‘c LÃ m Ä‘áº¹p, má»¹ pháº©m & chÄƒm sÃ³c cÃ¡ nhÃ¢n Skit Movie - ìŠ¤í‚· ë¬´ë¹„ Phim CHÆ¯Æ NG TRÃŒNH TV Absolute Chad Moments ChÆ°Æ¡ng trÃ¬nh TV The Flash Fanpage Viá»‡t Nam ChÆ°Æ¡ng trÃ¬nh TV The Amazing World of Gumball Vietnam Fan Club Giáº£i trÃ­ Reply 1988 Vietnam Fanpage ChÆ°Æ¡ng trÃ¬nh TV SÃCH Nhá»¯ng káº» má»™ng mÆ¡ Quan tÃ¢m Má»—i NgÃ y 1 Trang SÃ¡ch SÃ¡ch Bad Luck Quan tÃ¢m Sá»‘ng Thá»±c Táº¿ Giá»¯a Äá»i Thá»±c Dá»¥ng SÃ¡ch á»¨NG Dá»¤NG VÃ€ TRÃ’ CHÆ I Community NFT VN VALORANT Vietnam Warhammer 40,000 Apex Legends Funny Iron Hammer Cao Thá»§ Runeterra THÃCH Otofun Há»™i Xu XÃ¨ng Master PhÆ°á»›c Nguyá»…n Tráº¡m Tin Crypto Vá»±a trÃ¡i cÃ¢y nhÃ  Nhung Äá» 7749 tá»· tá»· xinh Ä‘áº¹p BÃ€I ÄÃNH GIÃ ÄÃƒ VIáº¾T IZONE - IELTS Chiáº¿n LÆ°á»£c Giáº£ng viÃªn tráº» nÄƒng Ä‘á»™ng, gáº§n gÅ©i vÃ  chia sáº» nhiá»u kiáº¿n thá»©c bá»• Ã­ch, thÃº vá»‹ vá»›i há»c sinh (y)",
 "contents": [
  {
   "time": "11 thÃ¡ng 7 lÃºc 08:00 Â·",
   "content": "   Cháº³ng nháº½ máº·c Ã¡o bÃ³ng Ä‘Ã¡ Ä‘i lÃ m =)) QuÃ¢n Bi10 thÃ¡ng 7 lÃºc 09:29 Â· Nháº­n xÃ©t cá»§a báº¡n vá» máº«u Ã¡o sÃ¢n khÃ¡ch má»›i cá»§a Liverpool Ä‘i ğŸ˜ áº¢nh: Liverpool FC",
   "comment": []
  },
  {
   "time": "11 thÃ¡ng 7 lÃºc 08:00 Â·",
   "content": "   Cháº³ng nháº½ máº·c Ã¡o bÃ³ng Ä‘Ã¡ Ä‘i lÃ m =)) QuÃ¢n Bi10 thÃ¡ng 7 lÃºc 09:29 Â· Nháº­n xÃ©t cá»§a báº¡n vá» máº«u Ã¡o sÃ¢n khÃ¡ch má»›i cá»§a Liverpool Ä‘i ğŸ˜ áº¢nh: Liverpool FC",
   "comment": []
  },
  {
   "time": "11 thÃ¡ng 7 lÃºc 08:00 Â·",
   "content": "   Cháº³ng nháº½ máº·c Ã¡o bÃ³ng Ä‘Ã¡ Ä‘i lÃ m =)) QuÃ¢n Bi10 thÃ¡ng 7 lÃºc 09:29 Â· Nháº­n xÃ©t cá»§a báº¡n vá» máº«u Ã¡o sÃ¢n khÃ¡ch má»›i cá»§a Liverpool Ä‘i ğŸ˜ áº¢nh: Liverpool FC",
   "comment": []
  },
  {
   "time": "11 thÃ¡ng 7 lÃºc 08:00 Â·",
   "content": "   Cháº³ng nháº½ máº·c Ã¡o bÃ³ng Ä‘Ã¡ Ä‘i lÃ m =)) QuÃ¢n Bi10 thÃ¡ng 7 lÃºc 09:29 Â· Nháº­n xÃ©t cá»§a báº¡n vá» máº«u Ã¡o sÃ¢n khÃ¡ch má»›i cá»§a Liverpool Ä‘i ğŸ˜ áº¢nh: Liverpool FC",
   "comment": []
  },
  {
   "time": "11 thÃ¡ng 7 lÃºc 08:00 Â·",
   "content": "   Cháº³ng nháº½ máº·c Ã¡o bÃ³ng Ä‘Ã¡ Ä‘i lÃ m =)) QuÃ¢n Bi10 thÃ¡ng 7 lÃºc 09:29 Â· Nháº­n xÃ©t cá»§a báº¡n vá» máº«u Ã¡o sÃ¢n khÃ¡ch má»›i cá»§a Liverpool Ä‘i ğŸ˜ áº¢nh: Liverpool FC",
   "comment": []
  },
  {
   "time": "26 thÃ¡ng 6 lÃºc 20:45 Â·",
   "content": "  Ä‘Ã£ cáº­p nháº­t tráº¡ng thÃ¡i cá»§a anh áº¥y.  Ná»™i dung nÃ y hiá»‡n khÃ´ng hiá»ƒn thá»‹ Lá»—i nÃ y thÆ°á»ng do chá»§ sá»Ÿ há»¯u chá»‰ chia sáº» ná»™i dung vá»›i má»™t nhÃ³m nhá», thay Ä‘á»•i ngÆ°á»i Ä‘Æ°á»£c xem hoáº·c Ä‘Ã£ xÃ³a ná»™i dung.",
   "comment": []
  }
 ]
}